"""He was born at Plessiel , a hamlet of Drucat near Abbeville , to a long-established family of Picardy , the great-nephew of the painter Eustache Le Sueur .""","*hamlet","[u'small', u'village', u'neighborhood', u'village', u'town', u'town', u'village', u'village', u'suburb', u'village', u'village', u'town', u'village', u'house', u'village', u'community', u'town', u'small village', u'village', u'town', u'village', u'small town', u'village', u'town', u'suburb', u'community', u'village', u'place', u'village', u'community', u'division', u'village', u'community', u'village', u'village', u'village', u'town', u'village', u'district', u'community', u'village', u'town', u'village', u'village', u'village', u'town', u'suburb', u'village', u'town', u'community', u'village', u'village']","[u'village', u'crossroads', u'Hamlet']","['Y']","[u'ham', u'kraal', u'thorp', u'village', u'dorp']","['Y']"
"""It was discovered and opened about the same time as Crystal Cave , but was closed by the owners in the 1940s .""","discover","[u'seen', u'found', u'found', u'found', u'found', u'found', u'found', u'found', u'found', u'found', u'found', u'found', u'found', u'found', u'found', u'found', u'found', u'found', u'found', u'found', u'found', u'found', u'found', u'found', u'found', u'found', u'found', u'found', u'found', u'found', u'found ', u'found', u'found', u'found', u'found', u'found', u'found', u'found', u'found', u'found', u'found', u'found', u'found', u'found', u'found', u'found', u'found', u'found', u'found', u'found', u'', u'']","[u'happen_upon', u'bring_out', u'describe', u'notice', u'distinguish', u'see', u'identify', u'attain', u'get_wind', u'find', u'detect', u'divulge', u'chance_on', u'strike', u'expose', u'disclose', u'give_away', u'pick_up', u'unwrap', u'come_upon', u'let_on', u'break', u'observe', u'hear', u'light_upon', u'key', u'come_across', u'find_out', u'get_word', u'reveal', u'name', u'get_a_line', u'fall_upon', u'chance_upon', u'let_out', u'learn', u'key_out']","['N']","[u'spy', u'determine', u'ken', u'recognize', u'espy', u'see', u'sight', u'get at the truth ', u'find', u'discern', u'analogy', u'have in sight', u'behold', u'disclose', u'evolve', u'dismask', u'perceive', u'descry', u'distinguish', u'make out', u'learn ']","['N']"
"""Fernando Navarro i Corbacho is a Spanish footballer who currently plays for Sevilla FC , as a left defender .""","defender","[u'fighter', u'protector', u'protector', u'guard', u'fielder', u'protector', u'protector', u'guard', u'player', u'supporter', u'player', u'fighter', u'guard', u'champion', u'goalkeeper', u'guardian', u'guard', u'player', u'protector', u'fighter', u'player', u'defenseman', u'player', u'guard', u'opponent', u'guard', u'player', u'player', u'back', u'guard', u'guard', u'back', u'protector', u'fielder', u'protector', u'guard', u'blocker', u'defenseman', u'protector', u'player', u'protector', u'guard', u'protector', u'stopper', u'player', u'guard', u'guard', u'blocker', u'defense player', u'', u'']","[u'protector', u'withstander', u'shielder', u'guardian']","['Y']","[u'protector']","['Y']"
"""However , the availability of suitable habitat is critical : forest must be neither too old nor too young .""","availability","[u'presence', u'accessibility', u'need', u'possibility', u'possibility', u'need', u'time', u'convenience', u'pervasiveness', u'amount', u'type', u'vacancy', u'opening', u'being', u'vacancy', u'type', u'opening', u'presence', u'presence', u'presence', u'abundance', u'possibility', u'ready for use', u'usability', u'presence', u'chance', u'openness ', u'existence', u'option', u'presence', u'presence ', u'existence', u'existence', u'opening', u'place', u'presence', u'opportunity', u'readiness', u'existens', u'presence ', u'possibility', u'presence', u'presence', u'time', u'opening', u'time', u'need', u'available ', u'ease of finding', u'handiness', u'', u'']","[u'handiness', u'availableness', u'accessibility']","['Y']","[]","['N']"
"""Neem Karoli was a life-long adept of bhakti yoga , and encouraged service to others as the highest form of unconditional devotion to God .""","highest","[u'best', u'most important', u'best', u'most important', u'best', u'best', u'best', u'tallest', u'nobelest', u'most high', u'greatest', u'best', u'greatest', u'biggest', u'best', u'best', u'best', u'best', u'best', u'biggest', u'top', u'best', u'best', u'best', u'best', u'top', u'topmost', u'utmost', u'best', u'top', u'best', u'top', u'utmost ', u'best', u'top', u'peakl', u'best', u'biggest', u'best', u'best', u'top', u'capital', u'best', u'top', u'top', u'best', u'biggest', u'best', u'biggest', u'top', u'', u'']","[u'high-pitched', u'eminent', u'gamy', u'high', u'in_high_spirits', u'mellow', u'gamey']","['N']","[]","['N']"
"""The Pittsburgh Steelers are a professional American football team based in Pittsburgh , Pennsylvania .""","base","[u'living', u'located', u'located', u'located', u'located', u'located', u'from', u'set', u'headquartered', u'found', u'found', u'housed', u'found', u'found', u'located', u'placed', u'from', u'located', u'located', u'located', u'located', u'located', u'located', u'located', u'located', u'housed', u'located', u'located', u'located', u'located', u'located', u'located', u'residing', u'formed', u'located', u'found', u'located', u'found', u'located', u'located', u'located', u'set', u'located', u'located', u'established', u'located', u'located', u'located', u'located', u'playing', u'', u'']","[u'al-Qaida', u'radix', u'lowly', u'root_word', u'base_of_operations', u'radical', u'baseborn', u'meanspirited', u""al-Qa'ida"", u'home', u'pedestal', u'establish', u'ground', u'free-base', u'basis', u'groundwork', u'theme', u'Base', u'immoral', u'al-Qaeda', u'humble', u'foundation', u'infrastructure', u'substructure', u'understructure', u'stem', u'basal', u'foot', u'nucleotide', u'cornerstone', u'floor', u'alkali', u'bag', u'Qaeda', u'stand', u'fundament', u'found', u'root', u'mean']","['Y']","[u'vile', u'scandalous', u'facinorous', u'foul', u'ignoble', u'felonious', u'exteriority ', u'sneaking', u'beggarly', u'scrubby', u'ground', u'gross', u'basis', u'recreant', u'support', u'imbed', u'black', u'grave', u'of a deep dye', u'sorry', u'modulus', u'low', u'foundation', u'bottom', u'heinous', u'ignominious', u'shameful', u'basement', u'blackguard', u'infamous', u'scurvy', u'arrant', u'sinister', u'craven', u'dunghill', u'nefarious', u'common', u'villainous', u'outside ', u'found', u'embed', u'mean']","['Y']"
"Microsoft Windows includes an implementation of SSL and TLS as part of its Secure Channel package .","implementation","[u'application', u'use', u'use', u'usage', u'instance', u'combination', u'program', u'version', u'approach', u'usage', u'utilization', u'type', u'version', u'use of', u'start', u'addition', u'example', u'application', u'configuration', u'installation', u'added use', u'addition', u'use', u'copy', u'use', u'inclusion', u'use', u'example', u'addition', u'usage', u'application ', u'aspect', u'version', u'version', u'inclusion', u'employment', u'introduction', u'application', u'version', u'use', u'application', u'use', u'start', u'similar', u'addition', u'inclusion', u'realization', u'execution', u'addition', u'usage', u'', u'']","[u'execution', u'carrying_out', u'effectuation']","['Y']","[]","['N']"
"""The Kingdom of the Franks under Charlemagne was particularly hard-hit by these raiders , who could sail down the Seine with near impunity .""","impunity","[u'freedom', u'immunity', u'freedom', u'freedom from punishment', u'fearlessness', u'carelessness', u'freedom', u'freedom', u'freedom', u'permission', u'immunity', u'secrecy', u'certainty', u'safety', u'exception', u'punishment', u'freedom', u'immunity', u'untouchability', u'abandon', u'safety', u'exception', u'liberty', u'invicibility', u'immunity', u'exemption', u'trouble', u'freedom', u'invincibility', u'blameless', u'freedom', u'safety', u'freedom', u'freedom', u'freedom', u'freedom', u'freedom', u'freedom', u'unchecked', u'loss', u'nonpunishment', u'freedom', u'immunity', u'immunity', u'liberty', u'without punishment', u'easily', u'freedom', u'safety', u'freedom', u'', u'']","[]","['N']","[u'come off']","['N']"
"The association of virtue with withdrawal from society - and specifically from cities - was a familiar theme in religious literature .","*theme","[u'idea', u'subject', u'motif', u'design', u'topic', u'topic', u'subject', u'idea', u'idea', u'storyline', u'pattern', u'idea', u'happening', u'idea', u'idea', u'idea', u'topic', u'topic', u'subject', u'topic', u'topic', u'storyline', u'idea', u'plot', u'idea', u'idea', u'idea', u'idea', u'idea', u'topic', u'idea', u'subject', u'topic', u'topic ', u'motif', u'topic', u'idea', u'subject', u'idea', u'subject', u'subject', u'topic', u'place', u'concept', u'subject', u'topic', u'point', u'thought', u'topic', u'motif', u'', u'']","[u'melodic_theme', u'motif', u'root_word', u'radical', u'idea', u'stem', u'topic', u'paper', u'base', u'report', u'musical_theme', u'root', u'composition', u'subject']","['Y']","[u'what it is about', u'topic', u'business', u'affair', u'text', u'matter in hand', u'noemata', u'argument', u'project', u'matter', u'thesis']","['Y']"
"""Fired by enthusiasm , Tolstoy returned to Yasnaya Polyana and founded thirteen schools for his serfs ' children , based on ground-breaking libertarian principles Tolstoy described in his 1862 essay `` The School at Yasnaya Polyana '' .""","enthusiasm","[u'excitement', u'joy', u'intensity', u'joy', u'interest', u'excitment', u'inspiration', u'happiness', u'excitement', u'energy', u'energy', u'excitement', u'excitement', u'excitement', u'excitment', u'intensity', u'excitment', u'excitedness', u'excitement', u'motivation', u'excitement', u'interest', u'excitement', u'devotion', u'energy', u'excitement', u'interest', u'passion', u'excitement', u'eagerness', u'spirit', u'interest', u'gusto', u'excitement', u'passion', u'excitement', u'energy', u'passion', u'excitement', u'excitement', u'excitement', u'happiness', u'eagerness', u'happiness', u'energy', u'vigor', u'excitement', u'gusto', u'eagerness', u'', u'', u'']","[u'exuberance', u'ebullience']","['N']","[u'empressement', u'rapture', u'infatuation', u'hopefulness', u'buoyancy', u'idolatry', u'adoration', u'passion', u'fervor', u'fanaticism', u'heart of grace', u'enchantment', u'ardor', u'transport of love', u'furore', u'gallantry', u'zeal', u'verve', u'aspiration', u'optimism', u'flame', u'gush', u'devotion']","['Y']"
"""After its sale in 1998 , it merged into Festival Mushroom Records .""","merge","[u'combined', u'combined', u'joined', u'mixed', u'turned', u'turned', u'joined', u'combined', u'combined', u'joined', u'joined', u'combined', u'absorbed', u'united', u'converged', u'formed', u'combined', u'formed', u'formed', u'joined', u'joined', u'changed', u'turned', u'became part of', u'combined', u'changed', u'joined', u'changed', u'combined', u'combined', u'joined', u'combined', u'combined', u'combined', u'combined', u'joined', u'grew', u'joined', u'united', u'blended', u'blended', u'turned', u'joined', u'joined', u'joined', u'formed', u'fused', u'joined', u'combined', u'combined', u'combined', u'']","[u'unify', u'conflate', u'mix', u'immix', u'coalesce', u'unite', u'commingle', u'fuse', u'combine', u'flux', u'blend', u'meld']","['N']","[u'consolidate', u'incorporate', u'impregnate', u'immerse', u'centralize', u'coalesce', u'absorb', u'melt into one', u'unite', u'amalgamate', u'fuse', u'combine', u'immerge', u'embody', u'reembody', u'coincide', u'blend']","['N']"
"""As a result of this acquisition and the legal dispute with Hearst Corporation , Mandrakesoft announced that the new company name would be Mandriva , and that Mandriva Linux would be the new name covering products .""","dispute","[u'argument', u'fight', u'problem', u'disagreement', u'disagreement', u'argument', u'argument', u'argument', u'argument', u'disagreement', u'fight', u'trouble', u'argument', u'disagreement', u'fight', u'argument', u'disagreement', u'fight', u'argument', u'fight', u'disagreement', u'argument', u'confrontation', u'issue', u'disagreement', u'fight', u'argument', u'fight', u'disagreement', u'gain', u'argument', u'argument', u'fight', u'disagreement', u'differences', u'argument', u'battle', u'fight', u'argument', u'argument', u'debate', u'debate', u'conflict', u'argument', u'complaint', u'conflict', u'fight', u'battle', u'fight', u'argument', u'argument', u'']","[u'argufy', u'difference_of_opinion', u'challenge', u'contravention', u'altercate', u'quarrel', u'scrap', u'difference', u'gainsay', u'conflict']","['Y']","[u'tiff', u'bandy words', u'wrangle', u'debate', u'barney', u'towrow', u'question', u'altercation', u'fall out', u'spat', u'squabble', u'argufy', u'reason', u'snarl', u'tracasserie', u'words', u'discuss', u'challenge', u'bandy arguments', u'high words', u'argue', u'demel_e', u'quarrel']","['Y']"
"""The CIBF was founded by the General Egyptian Book Organisation , a government publishers and retailers group , in 1969 to coincide with celebrations of the 1000th anniversary of the founding of the city of Cairo .""","found","[u'opening', u'starting', u'original', u'begining', u'starting', u'discovery', u'making', u'birth', u'start', u'beginning', u'start', u'starting', u'start', u'creation', u'start', u'discovery', u'established', u'making', u'establishing', u'creation', u'birth', u'creation', u'creation', u'beginning', u'creation', u'creation', u'beginning', u'starting', u'beginning', u'start', u'origin', u'start', u'beginning  ', u'establishment', u'creating', u'setting up', u'start', u'beginning', u'establishing', u'establishment', u'settlement', u'starting', u'starting', u'beginning', u'start', u'creation', u'beginning', u'setting up', u'start', u'creation', u'', u'']","[u'find_oneself', u'retrieve', u'bump', u'discover', u'set_up', u'constitute', u'see', u'determine', u'line_up', u'happen', u'recover', u'establish', u'find', u'witness', u'ground', u'detect', u'notice', u'feel', u'regain', u'plant', u'get_hold', u'get', u'obtain', u'chance', u'observe', u'incur', u'find_out', u'encounter', u'launch', u'institute', u'come_up', u'rule', u'receive', u'base', u'ascertain']","['N']","[u'bottom', u'institute', u'imbed', u'broach', u'lay the foundation of', u'base', u'embed', u'ground']","['N']"
"""The city was first founded by the British in 1827 , who leased the island from Spain during the colonial period .""","lease","[u'rented', u'rented', u'rented', u'rented', u'rented', u'rented', u'rented', u'rented', u'rented', u'rented', u'loaned', u'rented', u'rented', u'borrowed', u'rented', u'loaned', u'borrowed', u'rented', u'rented', u'rented', u'rented', u'rented', u'rented', u'rented', u'rented', u'rented', u'rented', u'rented', u'rented', u'rented', u'secured', u'gave', u'borrowed', u'rented', u'rented', u'loaned', u'rented', u'let', u'rented', u'rented', u'rented', u'rented', u'rented', u'rented', u'rented', u'rented', u'rented', u'rented', u'loaned', u'borrowed', u'rented', u'']","[u'letting', u'term_of_a_contract', u'hire', u'engage', u'charter', u'let', u'rent', u'take', u'rental']","['Y']","[u'limitation', u'strict settlement', u'particular estate', u'term', u'sett', u'let', u'demise', u'settlement', u'underlet']","['Y']"
"""If the object has exactly the same density as the fluid , then its buoyancy equals its weight .""","fluid","[u'water', u'liquid', u'liquid', u'liquid', u'liquid', u'liquid', u'liquid', u'liquid', u'liquid', u'liquid', u'liquid', u'liquid', u'liquid', u'easy', u'liquid', u'liquid', u'liquid', u'liquid', u'liquid', u'liquid', u'liqiud', u'liquid', u'liquid', u'liquid', u'liquid', u'water', u'liquid', u'liquid', u'liquid', u'liquid', u'liquid', u'liquid', u'liquid', u'liquid', u'liquid', u'water', u'liquid', u'liquid', u'liquid', u'liquid', u'liquid', u'water', u'liquid', u'liquid', u'liquid', u'liquid', u'liquid', u'liquid', u'liquid', u'liquid', u'', u'']","[u'liquid', u'mobile', u'smooth', u'runny', u'fluent', u'unstable']","['Y']","[u'succulent', u'liquid', u'inelastic fluid', u'juicy', u'serous', u'sappy']","['Y']"
"""In Switzerland , the constitutional ban on absinthe was repealed in 2000 during an overhaul of the national constitution , although the prohibition was written into ordinary law instead .""","prohibition","[u'restriction', u'constraint', u'prevention', u'ban', u'ban', u'refusal', u'ban', u'ban', u'ban', u'limit', u'ban', u'laws against drinking', u'ban', u'ban', u'rule', u'ban', u'refusal', u'ban', u'ban', u'ban', u'ban', u'ban', u'ban', u'forbidding law', u'ban', u'banning', u'law against it', u'ban', u'ban', u'ban', u'prevention', u'ban', u'ban', u'ban', u'ban', u'ban', u'ban', u'ban', u'act', u'restriction', u'restriction', u'ban', u'ban', u'ban', u'restriction', u'allowance', u'banning', u'ban', u'refusal', u'law', u'', u'']","[u'proscription', u'forbiddance', u'prohibition_era', u'inhibition', u'ban']","['Y']","[u'', u'forbid it Heaven!', u'hands off!', u'preclusion', u'Heaven forbid!', u'noninclusion', u'inhibition', u'Encratism', u'God forbid!', u'far be it from!', u'cry you mercy!', u'thief ', u'Heaven forefend']","['Y']"
"""Due to their fast growth , the foremost benefit of these trees is their wood .""","*foremost","[u'greatest', u'greatest', u'main', u'biggest', u'main', u'first', u'main', u'greatest', u'biggest', u'greatest', u'first', u'major', u'first', u'best', u'main', u'highest', u'biggest ', u'main', u'biggest', u'most important', u'first', u'best', u'first', u'leading', u'best', u'main', u'best', u'main', u'most important', u'most important', u'biggest', u'biggest', u'primary', u'largest', u'first', u'best', u'greatest', u'biggest', u'biggest', u'primary', u'primary', u'important', u'major', u'main', u'primary', u'leading', u'biggest', u'most important', u'greatest', u'main', u'', u'']","[u'first_of_all', u'frontmost', u'world-class', u'firstly', u'first_off', u'first']","['Y']","[u'supreme', u'preeminent', u'crowning', u'radical', u'all-absorbing', u'primary', u'principal', u'leading', u'forehead', u'vital', u'cardinal', u'capital', u'main', u'overruling', u'paramount', u'prime', u'utmost', u'chief', u'headmost', u'greatest', u'essential', u'first']","['Y']"
"Men are supposed to come to the mosque wearing loose and clean clothes that do not reveal the shape of the body .","reveal","[u'show', u'show', u'show', u'show', u'show', u'show', u'show', u'show', u'show', u'show', u'show', u'show', u'show', u'show', u'show', u'show', u'show', u'show', u'show', u'show', u'show', u'show', u'show', u'show', u'show', u'show', u'show', u'show', u'show', u'show', u'show', u'show', u'show', u'show', u'show', u'show', u'show', u'show', u'show', u'show', u'show', u'show', u'show', u'show', u'show', u'show', u'show', u'show', u'show', u'show', u'', u'']","[u'disclose', u'unwrap', u'bring_out', u'divulge', u'expose', u'let_on', u'discover', u'unveil', u'break', u'let_out', u'give_away', u'uncover']","['N']","[u'break', u'divulge']","['N']"
"""Intense feelings of resentment trigger the initial retaliation , which causes the other party to feel equally aggrieved and vengeful .""","retaliation","[u'fight', u'reprisal', u'fight back', u'reaction', u'revenge', u'revengeance', u'revenge', u'retribution', u'revenge', u'revenge', u'reaction', u'response', u'revenge', u'revenge', u'payback', u'vengence', u'revenge', u'revenge', u'response', u'attack', u'revenge', u'revenge', u'revenge', u'revenge', u'fight', u'repayment', u'counterattack', u'counterattack ', u'response', u'revenge', u'revenge', u'vengeance', u'payback', u'payback', u'attack', u'revenge', u'fight back', u'return', u'return', u'revenge', u'revenge', u'attack', u'fight back', u'anger', u'punishment', u'vengeance', u'attack', u'reaction', u'vengance', u'revenge', u'', u'']","[u'revenge']","['Y']","[u'""-""', u'', u';\nsecurity card', u';\npolestar', u';\nreveille', u';\ncoat of arms', u'record ', u'prototype', u';\ntitle', u'colors', u';\nampersand', u';\ntricolor', u';\nsign', u'quarantine flag', u';\ntilde', u';\nlighthouse', u'pointer', u';\nopen sesame', u'staff', u'weathercock', u';\ncarte de visite', u'call', u'""%""', u';\ntrade mark', u'invisibility', u';\nmot de passe', u';\nattestation', u'crest', u';\ncipher', u'""*""', u'old glory', u'streamer', u';\nwarning ', u'hand and seal', u';\nbadge', u'sanctus bell', u'seamark', u'""@""', u'jack', u'balize', u'payback', u';\nangelus', u'ticket', u'flagstaff', u'oriflamme', u'union jack', u';\ndib', u'refreshment equalization', u'cry', u'countersign', u';\nflag', u'""=""', u'fingerpost', u';\nbrand', u';\ncredentials ', u'heading', u';\npassword', u'stars and stripes', u';\ngarland', u';\nbugle call', u'""+""', u'cairn', u';\npattern ', u';\nperiod', u';\nbandrol', u'countermark', u'voucher', u'pass', u'sufficiency', u';\nforward slash', u'mot du guet', u"";\nl'etoile du Nord"", u';\npass-parole', u';\ntest ', u'""\\\\""', u';\nlivery', u'telltale', u';\nscepter ', u';\ncockade', u""fool's cap"", u'""#""', u'uniform', u'favor', u'experiment', u';\nshield', u'"":""', u'gonfalon', u';\nbell', u'beacon-fire', u'eagle', u'left arrow', u';\nlabel', u';\nexposition &c (explanation) ', u'proof ', u';\nadvertisement ', u';\naddress', u'sigil', u'standard', u';\nguidepost', u';\nplus sign', u';\nbunting', u'ancient', u';\nquestion mark', u';\nwitness', u'post', u';\nduplicate', u'card', u'publication', u'difficulty', u'""~""', u'scepter ', u'lodestar', u'guide', u'chop', u';\nbanderole', u'measure for measure', u'cock', u'directing post', u';\ncacher', u';\nsingle quote', u'pendant', u'""--""', u';\nbeacon', u'signboard', u'reprisal', u';\nword of command', u';\npercent sign', u';\ndash', u'chevron', u';\ntrace', u'mark', u';\ngauge ', u';\nheraldry', u'""', u';\ncountercheck', u';\ncolon', u';\nyellow-flag', u'direction', u'arms', u';\nstamp', u';\nindorsement', u';\nseal', u'""!""', u';\npillars of Hercules', u'autography', u'handpost', u'watchword', u';\nmilliary', u';\ncomma', u'alarm ', u';\ncarat', u';\nescutcheon', u';\nexclamation point', u'supporters', u'name', u';\ncommercial at', u'signpost', u'billet', u'tally', u'blue Peter', u';\nhand', u';\nbackward slash', u'vane', u';\nvexillum', u'visiting card', u';\ninsignia', u';\nensign', u'trumpet call', u'""&""', u'yellow jack', u'scutcheon', u';\nbanner', u'bill', u'counterfoil', u';\nshibboleth', u'sign manual', u';\nfigurehead', u'signet', u';\nparaph', u';\nmileage ticket', u';\ntrophy ', u';\nsacring bell', u';\nbale-fire', u'bannerol', u';\nmilestone', u';\ntimbrology', u'chip', u'epaulet', u'assent', u'oriflamb', u';\nequals sign', u'evidence', u';\n""', u'loadstar', u'Hall mark', u'hand writing', u';\nsignature', u'tit for tat ', u'check', u';\nsuperscription', u'information', u'""\'""', u';\npennon', u';\nwarning &c ', u';\narmorial bearings', u'"">""', u'passkey', u'brand', u';\nomen ', u'milepost', u';\nburgee', u'criterion', u';\ncheck', u'endorsement', u';\n\n', u'""/""', u';\ncynosure', u'""_""', u'tu quoque ', u'labarum', u';\ntessera', u'""""', u';\nlandmark', u'pharos', u'hatchment', u';\nright arrow', u';\npound sign', u'hand', u';\nbattle cry', u';\nem dash', u'letter', u';\napostrophe', u'autograph', u';\nnotification ', u';\ntotem', u'love knot', u'incredulity', u';\nhyphen', u'alarum', u'""?""', u'counter', u'retort', u'insufficiency', u';\nprefigurement ', u'banneret', u'catchword', u'rallying cry', u';\naddress card', u';\nasterisk', u'pennant', u'docket', u';\nsemicolon']","['Y']"
"The cheetah hunts by vision rather than by scent .","vision","[u'sight', u'sight', u'sight', u'sight', u'seeing', u'sight', u'sight', u'sight', u'sight', u'what he sees', u'sight', u'sight', u'sight', u'sight', u'sight', u'sight', u'sight', u'sight', u'eye', u'sight', u'sight', u'sight', u'sight', u'sight', u'sight', u'their eyes', u'sight', u'eyesight ', u'sight', u'seeing', u'sight', u'sight', u'eyesight ', u'sight', u'sight', u'sight', u'sight', u'eyesight ', u'sight', u'seeing', u'sight', u'sight', u'sight', u'sight', u'sight', u'eyesight', u'sight', u'sight', u'sight', u'sight', u'', u'']","[u'visual_modality', u'visual_sensation', u'imagination', u'visual_sense', u'sight', u'imaginativeness']","['Y']","[u'eyesight', u'maggot', u'chimera', u'sight', u'specter', u'throw away an opportunity', u'myth', u'neglect an opportunity ', u'neglectful ', u'field of view ', u'set aside', u'ignore ', u'neglect ', u'apparition', u'optics', u'waste an opportunity', u'figment', u'lose an opportunity', u'shadow', u'spirit', u'ghost', u'conceit', u'revenant', u'shade', u'dream']","['Y']"
"""So impressed was Rostropovich with his young pupil that at the end of her study with him , he declared her `` the only cellist of the younger generation that could equal and overtake own achievement . ''""","declare","[u'said', u'called', u'confirmed', u'announced', u'called', u'proclaimed', u'announced', u'called', u'called', u'called', u'claimed', u'told', u'said to', u'said to', u'called', u'called', u'said', u'announced', u'called', u'named', u'called', u'anounced', u'appointed', u'proclaimed', u'named', u'called', u'called', u'said of', u'told', u'recognized', u'announced', u'deemed', u'labeled', u'called', u'called', u'named', u'called', u'called', u'announced', u'called ', u'made', u'called', u'called', u'told', u'called', u'announced', u'said of', u'called', u'proclaimed', u'elected', u'', u'']","[u'announce', u'hold', u'adjudge']","['N']","[u'say', u'state', u'predicate', u'affirm']","['N']"
