"""In March 1992 , Linux version 0.95 was the first to be capable of running X. This large version number jump was due to a feeling that a version 1.0 with no major missing pieces was imminent .""","*piece","[u'parts', u'parts', u'parts', u'parts', u'component', u'sections', u'parts', u'parts', u'parts', u'parts', u'parts', u'elements', u'parts', u'parts', u'parts', u'part', u'parts', u'parts', u'parts', u'components', u'parts', u'parts', u'components', u'parts', u'parts', u'parts', u'parts', u'bits', u'parts', u'parts', u'parts', u'parts', u'parts', u'parts', u'parts', u'parts', u'parts', u'parts', u'information', u'parts', u'parts', u'parts', u'bits', u'parts', u'parts', u'parts', u'bits', u'parts', u'parts', u'items', u'parts', u'']","['nibble@JJ', 'set_up@NN', 'small-arm@NN', ""objet_d'art@NN"", 'firearm@NN', 'slice@NN', 'art_object@NN', 'musical_composition@NN', 'piece_of_music@NN', 'opus@NN', 'put_together@NN', 'composition@NN', 'spell@NN', 'part@NN', 'assemble@JJ', 'bit@NN', 'man@NN', 'tack_together@NN', 'patch@NN', 'while@IN', 'tack@NN', 'pick@NN', 'piece@NN']","['Y']"
"""Much of the water carried by these streams is diverted .""","disport","[u'drawn away', u'redirected', u'changed', u'redirected', u'turned', u'moved', u'rerouted', u'changed', u'rerouted', u'led away', u'rerouted', u'redirected', u'sent away', u'redirected', u'changed', u'redirected', u'separated', u'redirected', u'switched', u'redirected', u'redirected', u'rerouted', u'switched', u'rerouted', u'redirected', u'moved', u'moved', u'split', u'redirected', u'changed', u'redirected', u'altered', u'separated', u'moved', u'altered', u'redirected', u'rerouted', u'redirected', u'redirected', u'split', u'turned', u'redirected', u'drawn away', u'veered', u'moved', u'rerouted', u'channeled', u'redirected', u'deflected', u'changed', u'redirected', u'']","['hive_off@NN', 'amuse@NN', 'divert@NN', 'deviate@NN', 'disport@NN']","['N']"
"""Harry also becomes the worthy possessor of the remaining Deathly Hallows : the Invisibility Cloak and the Resurrection Stone , hence becoming the true Master of Death .""","possessor","[u'owner', u'buyer', u'owner', u'owner', u'owner', u'owner', u'owner', u'holder', u'owner', u'owner', u'owner', u'owner', u'owner', u'owner', u'owner', u'owner', u'owner', u'holder', u'owner', u'owner', u'owner', u'owner', u'owner', u'owner', u'owner', u'owner', u'master', u'owner', u'owner', u'keeper', u'owner', u'owner', u'owner', u'owner', u'owner', u'owner', u'owner', u'owner', u'teacher', u'owner', u'keeper', u'owner', u'owner', u'holder', u'owner', u'owner', u'owner', u'holder', u'owner', u'owner', u'owner', u'']","['owner@NN', 'possessor@NN']","['Y']"
"""Escapologists escape from handcuffs , straitjackets , cages , coffins , steel boxes , barrels , bags , burning buildings , fish-tanks and other perils , often in combination .""","riskiness","[u'dangers', u'dangers', u'difficulties', u'dangers', u'dangers', u'danger', u'restraints', u'problems', u'dangers', u'risks', u'dangers', u'dangers', u'dangers', u'dangers', u'hazards', u'dangers', u'fates', u'dangers', u'dangers', u'dangers', u'dangers', u'dangers', u'dangers', u'dangers', u'dangers', u'dangers', u'dangers', u'dangers', u'dangers', u'dangers', u'dangers', u'dangers', u'situations', u'dangers', u'dangers', u'dangers', u'dangers', u'dangers', u'dangers', u'dangers', u'dangers', u'dangers', u'dangers', u'dangers', u'dangers', u'dangers', u'dangers', u'dangers', u'dangers', u'troubles', u'dangers', u'']","['jeopardise@NN', 'scupper@NN', 'peril@NN', 'risk@NN', 'danger@NN', 'jeopardy@NN', 'jeopardize@NN', 'hazard@NN', 'endangerment@NN', 'imperil@NN', 'queer@NN', 'endanger@NN', 'threaten@NNS', 'menace@NN', 'expose@VB', 'riskiness@NN']","['Y']"
"""The storm continued , crossing the Outer Banks of North Carolina , and retained its strength until June 20 when it became extratropical near Newfoundland .""","hold","[u'kept', u'kept', u'held', u'maintained', u'kept', u'kept', u'held', u'kept', u'kept', u'kept', u'kept', u'kept', u'kept', u'kept', u'kept', u'held', u'held', u'kept', u'kept', u'kept', u'kept', u'held', u'kept', u'kept', u'kept', u'kept', u'kept', u'kept', u'kept', u'kept', u'held', u'regained', u'kept', u'held', u'kept', u'kept', u'kept', u'kept', u'kept', u'maintained', u'kept', u'kept', u'kept', u'kept', u'held', u'kept', u'maintained', u'kept', u'kept', u'held', u'kept', u'']","['keep_back@NN', 'hold_back@NN', 'keep@VB', 'continue@NN', 'keep_on@NN', 'retain@NN', 'hold@NN']","['N']"
"""The Convent has been the official residence of the Governor of Gibraltar since 1728 .""","mansion_house","[u'home', u'home', u'home', u'dwelling', u'home', u'home', u'home', u'home', u'people', u'home', u'home', u'house', u'home', u'home', u'home', u'home', u'home', u'home', u'home', u'home', u'home', u'dwelling', u'home', u'home', u'home', u'home', u'home', u'home', u'home', u'home', u'home', u'home', u'home', u'home', u'home', u'house', u'house', u'home', u'home', u'home', u'home', u'home', u'house', u'home', u'house', u'abode', u'house', u'home', u'home', u'owner', u'home', u'']","['abode@NN', 'residence@NN', 'manse@NN', 'abidance@NN', 'residency@NN', 'mansion@NN', 'hall@NN', 'mansion_house@NN']","['Y']"
"""Food is procured with its suckers and then crushed using its tough `` beak '' of chitin .""","secure","[u'obtained', u'gotten', u'found', u'gathered', u'batten', u'aquired', u'grabbed', u'created', u'gotten', u'obtained', u'attained', u'obtained', u'made', u'grabbed', u'gathered', u'obtained', u'acquired', u'made', u'obtained', u'received', u'acquired', u'gathered', u'obtained', u'grabbed', u'obtained', u'obtained', u'grabbed', u'gathered', u'processed', u'obtained', u'gotten', u'gotten', u'collected', u'gotten', u'obtained', u'gotten', u'obtained', u'obtained', u'obtained', u'gotten', u'gathered', u'gathered', u'gathered', u'gotten', u'obtained', u'obtained', u'gathered', u'secured', u'obtained', u'gathered', u'obtained', u'']","['pander@NN', 'procure@NN', 'pimp@NN', 'secure@NN']","['N']"
"""The United States convened a 13-nation conference of the International Opium Commission in 1909 in Shanghai , China in response to increasing criticism of the opium trade .""","convene","[u'opened', u'started', u'assembled', u'called', u'gathered', u'created', u'made', u'called', u'aggregated', u'made', u'brought together', u'gathered', u'called', u'hosted', u'organized', u'assembled', u'held', u'gathered', u'held', u'met', u'started', u'assembled', u'ordered', u'held', u'created', u'assembled', u'called', u'held', u'called', u'assembled', u'called', u'called', u'met', u'gathered', u'started', u'called', u'called', u'organized', u'held', u'assembled', u'assembled', u'organized', u'gathered', u'assembled', u'met', u'assembled', u'gathered', u'assembled', u'opened', u'called', u'called', u'assembled']","['convoke@NN', 'convene@NN']","['N']"
"""Photosynthesis is vital for life on Earth .""","life-sustaining","[u'important', u'critical', u'essential', u'necessary', u'important', u'necessary', u'important', u'important', u'important', u'needed', u'required', u'important', u'necessary', u'required', u'necessary', u'essential', u'needed', u'necessary', u'important', u'needed', u'essential', u'essential', u'necessary', u'necessary', u'essential', u'essential', u'important', u'necessary', u'important', u'important', u'needed', u'important', u'critical', u'needed', u'necessary', u'crucial', u'needed', u'needed', u'necessary', u'important', u'important', u'important', u'important', u'important', u'important', u'needed', u'essential', u'necessary', u'required', u'essential', u'important', u'']","['full_of_life@NN', 'critical@JJ', 'lively@RB', 'vital@NN', 'life-sustaining@NN']","['Y']"
"""Dodd simply retained his athletic director position , which he had acquired in 1950 .""","gain","[u'received', u'gotten', u'got', u'gotten', u'achieved', u'gained', u'gained', u'got', u'gained', u'gotten', u'gotten', u'taken', u'gained', u'got', u'received', u'amassed', u'gained', u'received', u'got', u'received', u'obtained', u'obtained', u'gained', u'got', u'gotten', u'gained', u'obtained', u'received', u'gained', u'gotten', u'obtained', u'gotten', u'gotten', u'achieved', u'started', u'gotten', u'gotten', u'received', u'inherited', u'got', u'achieved', u'gotten', u'gotten', u'received', u'obtained', u'gained', u'gained', u'taken', u'gained', u'got', u'gotten', u'']","['evolve@NN', 'adopt@NN', 'develop@VB', 'get@VB', 'assume@VB', 'win@NN', 'acquire@VB', 'larn@NN', 'take_on@NN', 'produce@NN', 'take@VB', 'learn@NN', 'grow@NN', 'gain@NN']","['N']"
"""Radiometric dating is a technique used to date materials , usually based on a comparison between the observed abundance of a naturally occurring radioactive isotope and its decay products , using known decay rates .""","teemingness","[u'plenty', u'large amount', u'supply', u'a lot', u'amount', u'bounty', u'surplus', u'amount', u'excess', u'excess', u'great amount', u'large amount', u'plenty', u'amount', u'wealth', u'surplus', u'quantity', u'supply', u'amount', u'plenitude', u'amount', u'outpouring', u'plenty', u'amount', u'large amount', u'amount', u'amount', u'surplus', u'portion', u'amount', u'plenty', u'surplus', u'bounty', u'amount', u'amount', u'plenty', u'profusion', u'amount', u'amount', u'amount', u'plenty', u'wealth', u'availability', u'supply', u'plenitude', u'plenty', u'wealth', u'plenty', u'heap', u'growth', u'amount', u'']","['abundance@NN', 'copiousness@NN', 'teemingness@NN']","['N']"
"""Bacterial contaminants are ubiquitous , and foods left unused too long will often acquire substantial amounts of bacterial colonies and become dangerous to eat , leading to food poisoning .""","substantive","[u'significant', u'huge', u'large', u'big', u'high', u'large', u'significant', u'large', u'large', u'large', u'significant', u'heavy', u'significant', u'many', u'extensive', u'big', u'large', u'large', u'large', u'large', u'big', u'large', u'large', u'large', u'large', u'large', u'large', u'major', u'large', u'large', u'large', u'large', u'large', u'large', u'copious', u'great', u'large', u'large', u'large', u'a lot', u'large', u'large', u'large', u'large', u'large', u'large', u'large', u'large', u'a lot', u'large', u'large', u'']","['real@JJ', 'satisfying@VBG', 'solid@JJ', 'material@NN', 'hearty@NN', 'substantial@JJ', 'square@NN', 'strong@JJ', 'significant@JJ', 'substantive@JJ']","['Y']"
"""Tibooburra has an arid , desert climate with temperatures soaring above 40 Celsius in summer , often reaching as high as 47 C .""","waterless","[u'dry', u'dry', u'dry', u'dry', u'dry', u'dry', u'dry', u'dry', u'dry', u'dry', u'dry', u'dry', u'dry', u'dry', u'dry', u'dry', u'dry', u'dry', u'dry', u'dry', u'dry', u'dry', u'dry', u'dry', u'dry', u'dry', u'dry', u'desolate', u'dry', u'dry', u'dry', u'dry', u'dry', u'dry', u'dry', u'dry', u'dry', u'dry', u'dry', u'moistureless', u'barren', u'dry', u'dry', u'dry', u'dry', u'dry', u'dry', u'dry', u'dry', u'dry', u'dry', u'']","['desiccate@NN', 'desiccated@VBN', 'arid@NN', 'waterless@NN']","['N']"
"""Hanna meandered around the southeastern Bahamas , weakening to a tropical storm while also dumping heavy rain on already-devastated Haiti .""","weave","[u'wandered', u'wandered', u'wondered', u'moved', u'strolled', u'wandered', u'moved', u'wandered', u'strolled', u'wandered', u'wandered', u'wandered', u'wandered', u'traveled', u'wandered', u'navigated', u'drifted', u'wandered', u'wandered', u'wandered', u'drifted', u'wandered', u'wandered', u'wandered', u'walked', u'twisted', u'blew', u'traveled', u'wandered', u'wandered', u'wandered', u'wandered', u'went', u'wandered', u'traveled', u'curved', u'wandered', u'wandered', u'walked', u'wandered', u'wandered', u'wandered', u'drifted', u'walked', u'wandered', u'wandered', u'drifted', u'wandered', u'walked', u'zigzagged', u'wandered', u'']","['ramble@JJ', 'thread@NN', 'meander@NN', 'wander@NN', 'wind@NN', 'weave@NN']","['N']"
"""With the high Gulf pressures - a ship reported a pressure of 1015.5 millibars less than 60 m from the storm center at the time it was upgraded to a tropical storm - Alicia was unable to gain size , staying very small , but generated faster winds , and became a Category 1 hurricane on August 16""","generate","[u'created', u'created', u'made', u'yielded', u'made', u'created', u'created', u'created', u'created', u'made', u'produced', u'created', u'made', u'made', u'made', u'created', u'formed', u'made', u'made', u'created', u'created', u'produced', u'created', u'produced', u'powered', u'created', u'made', u'created', u'created', u'had', u'created', u'made', u'achieved', u'created', u'created', u'made', u'made', u'created', u'created', u'built', u'produced', u'created', u'created', u'created', u'created', u'produced', u'created', u'made', u'developed', u'produced', u'created', u'']","['sire@NN', 'return@NN', 'engender@NN', 'render@NN', 'give@VB', 'get@VB', 'father@NN', 'yield@NN', 'mother@NN', 'bring_forth@NN', 'beget@NN', 'generate@NN']","['N']"
"""Das Rheingold is the first of the four operas that comprise Der Ring des Nibelungen , by Richard Wagner .""","comprise","[u'make up', u'make up', u'makes', u'make up', u'make up', u'make up', u'includes', u'consist of', u'make up', u'compose', u'make up', u'make up', u'form', u'make up', u'make up', u'make up', u'make up', u'compose', u'form', u'contain', u'include', u'make up', u'make up', u'make up', u'include', u'make up', u'make up', u'contains', u'form', u'make up', u'contain', u'agreed', u'make up', u'make up', u'included', u'form', u'include', u'make up', u'make up', u'make up', u'contain', u'contain', u'form', u'contain', u'cover', u'make up', u'form', u'create', u'include', u'includes', u'make up', u'']","['incorporate@NN', 'consist@NN', 'represent@NN', 'make_up@NN', 'constitute@NN', 'contain@NN', 'be@VB', 'comprise@NN']","['Y']"
"""A frenulum is a small fold of tissue that secures or restricts the motion of a mobile organ in the body .""","fasten","[u'stops', u'holds', u'ties', u'binds', u'holds', u'holds', u'holds', u'fixed', u'holds', u'holds', u'protects', u'holds', u'tightens', u'holds', u'holds', u'holds', u'keeps', u'holds', u'holds', u'prevents', u'locks', u'holds', u'protects', u'holds', u'confines', u'fastens', u'fixes', u'holds', u'stops', u'holds', u'holds', u'fastens', u'limits', u'holds', u'fastens', u'holds', u'holds', u'fixes', u'restrains', u'holds', u'keep', u'holds', u'holds', u'traps', u'locks', u'holds', u'holds', u'guards', u'holds', u'tightens', u'holds', u'']","['unattackable@JJ', 'secure@NN', 'unassailable@JJ', 'stop_up@NN', 'unafraid@NN', 'guarantee@NN', 'batten_down@NN', 'fix@NN', 'dependable@JJ', 'untroubled@JJ', 'plug@NN', 'good@JJ', 'batten@NN', 'safe@JJ', 'procure@NN', 'impregnable@JJ', 'strong@JJ', 'insure@NN', 'inviolable@JJ', 'assure@NN', 'ensure@VB', 'fasten@NNS']","['N']"
"""Helen Hunt has been recognized extensively in her career . In 1998 she become the second actress to win a Golden Globe Award , an Academy Award and an Emmy Award in the same year .""","calling","[u'job', u'job', u'job', u'job', u'line of work', u'job', u'work', u'work', u'job', u'job', u'job', u'profession', u'job', u'field', u'work', u'job', u'life', u'life', u'job', u'job', u'life', u'job', u'work', u'life', u'work', u'work', u'job', u'job', u'job', u'job', u'work', u'profession', u'life', u'life', u'job', u'honored', u'work', u'profession', u'job', u'job', u'job', u'employment', u'field', u'occupation', u'job', u'job', u'work', u'job', u'profession', u'profession', u'job', u'']","['career@NN', 'life_history@NN', 'vocation@NN', 'calling@VBG']","['N']"
"""When Wotan refuses to abandon his `` free hero '' , Fricka lays bare his self-deception : Siegmund is in no sense independent since his fate has been pre-ordained by Wotan , who has even indirectly led him to find the magic sword .""","turn_down","[u'does not want', u'declines', u'declines', u'denies', u'declines', u'declines', u'decides not to', u'declines', u'declines', u'does not want', u'protests', u'ceases', u'disallowed', u'does not want', u'stopped', u'fails', u'declines', u'declined', u'declines', u'declines', u'declines', u'denies', u""doesn't"", u'stops', u'says no', u'declines', u'denied', u""doesn't want"", u'denies', u'declines', u'declines', u'declines', u'refrain', u'denies', u'disagrees', u""doesn't"", u'declines', u'declines', u'decline', u'decides not', u'declines', u""won't"", u'avoids', u'declines', u'declines', u'decline', u'declines', u'avoids', u'avoids', u'declines', u'declines', u'']","['decline@NN', 'refuse@NN', 'deny@NN', 'garbage@NN', 'turn_away@NN', 'defy@NN', 'pass_up@NN', 'resist@NN', 'food_waste@NN', 'reject@NN', 'scraps@NNS', 'turn_down@NN']","['Y']"
"""The storm never approached land during its lifespan , and no damage or casualties were reported .""","casualty","[u'deaths', u'deaths', u'injuries', u'deaths', u'deaths', u'deaths', u'injuries', u'deaths', u'deaths', u'deaths', u'deaths', u'deaths', u'deaths', u'injuries', u'deaths', u'accidents', u'deaths', u'injuries', u'deaths', u'deaths', u'deaths', u'deaths', u'deaths', u'victims', u'injuries', u'deaths', u'injuries', u'injuries', u'deaths', u'deaths', u'deaths', u'deaths', u'deaths', u'victims', u'deaths', u'victims', u'deaths', u'deaths', u'deaths', u'injuries', u'deaths', u'deaths', u'fatalities', u'deaths', u'deaths', u'injuries', u'deaths', u'deaths', u'deaths', u'injuries', u'deaths', u'']","['fatal_accident@NN', 'injured_party@NN', 'casualty@NN']","['N']"
"""The purpose of public speaking can range from simply transmitting information , to motivating people to act , to simply telling a story .""","channel","[u'sending', u'giving', u'communicating', u'sending', u'delivering', u'sending', u'giving', u'conveying', u'sending', u'giving', u'sending', u'sending', u'sending', u'sending', u'giving', u'sending', u'sending', u'transferring', u'passing', u'sending', u'moving', u'communicating', u'sending', u'sending', u'communicating', u'forwarding', u'giving', u'giving', u'spreading', u'giving', u'giving', u'giving', u'giving', u'spreading', u'transferring', u'sending', u'giving', u'giving', u'conveying', u'sending', u'sharing', u'sending', u'relaying', u'giving', u'broadcasting', u'transferring', u'transferring', u'communicating', u'sending', u'relaying', u'sending', u'']","['channelise@NN', 'beam@NN', 'transfer@NN', 'impart@NN', 'communicate@NN', 'send@NN', 'air@NN', 'broadcast@NN', 'carry@NN', 'transport@NN', 'convey@NN', 'conduct@NN', 'transmit@NN', 'channelize@NN', 'channel@NNS']","['N']"
"""Published by Tor Books , it was released on August 15 , 1994 in hardcover , and in paperback on July 15 , 1997 .""","waiver","[u'initiated', u'sent', u'created', u'sold', u'made available', u'sold', u'delivered', u'available', u'premiered', u'dispersed', u'sold', u'put out', u'distributed', u'sold', u'sold', u'available', u'given', u'sold', u'sold', u'launched', u'published', u'revealed', u'delivered', u'available', u'delivered', u'put out', u'dispensed', u'put out', u'issued', u'available first', u'sold', u'let out', u'sold', u'published', u'issued', u'provided', u'distributed', u'sold', u'opened', u'distributed', u'sent', u'sold', u'put out', u'available', u'let go', u'dropped', u'able to be sold', u'made public', u'sold', u'sold', u'sold', u'']","['freeing@VBG', 'secrete@NN', 'tone_ending@VBG', 'vent@NN', 'bring_out@NN', 'unloose@JJ', 'sack@NN', 'exhaust@NN', 'unblock@NN', 'unloosen@NN', 'put_out@NN', 'dismissal@NN', 'expel@NN', 'publish@NN', 'liberation@NN', 'going@VBG', 'exit@NN', 'spillage@NN', 'issue@NN', 'let_go_of@NN', 'give_up@NN', 'sacking@VBG', 'press_release@NN', 'loose@JJ', 'free@JJ', 'let_go@NN', 'outlet@NN', 'discharge@NN', 'relinquish@NN', 'loss@NN', 'acquittance@NN', 'eject@NN', 'spill@NN', 'resign@NN', 'liberate@NN', 'button@NN', 'firing@VBG', 'departure@NN', 'handout@NN', 'turn@NN', 'unfreeze@NN', 'expiration@NN', 'release@NN', 'passing@NN', 'dismission@NN', 'waiver@NN']","['N']"
"""In many circumstances , these investments can be less expensive than fossil fuel energy systems .""","circumstances","[u'situations', u'situations', u'instances', u'situations', u'situations', u'situations', u'cases', u'situations', u'situations', u'cases', u'cases', u'ways', u'cases', u'situations', u'situations', u'situations', u'situations', u'examples', u'cases', u'instances', u'cases', u'situations', u'situations', u'cases', u'instances', u'times', u'situations', u'situations', u'situations', u'situations', u'situations', u'instances', u'situations', u'situations', u'instances', u'cases', u'situations', u'situations', u'situations', u'cases', u'instances', u'scenarios', u'events', u'ways', u'situations', u'situations', u'situations', u'situations', u'situations', u'events', u'situations', u'']","['context@NN', 'fortune@NN', 'destiny@NN', 'fate@NN', 'circumstance@NN', 'portion@NN', 'setting@VBG', 'lot@NN', 'consideration@NN', 'luck@NN', 'condition@NN', 'circumstances@NNS']","['N']"
"""Following the death of Schidlof from a heart attack in 1987 , the Amadeus Quartet disbanded .""","disband","[u'dissolved', u'scattered', u'broke up', u'broke up', u'quit', u'broke up', u'separated', u'broke up', u'broke up', u'broke up', u'dissolved', u'broke up', u'separated', u'broke up', u'died', u'separated', u'ended', u'broke up', u'separated', u'ended', u'broke up', u'separated', u'split up', u'dissolved', u'dissolved', u'broke up', u'broke up', u'broke up', u'stopped', u'separated', u'broke up', u'dissolved', u'broke up', u'split', u'broke up', u'separated', u'broke up', u'broke up', u'separated', u'separated', u'broke apart', u'dissolved', u'ended', u'broke up', u'broke up', u'broke up', u'split', u'separated', u'split', u'separated', u'broke up', u'']","['dissolve@NN', 'disband@NN']","['N']"
"""By 1960 he had developed the short story into a screenplay , and envisaged it as containing a suitable role for Monroe .""","imagine","[u'imagined', u'pictured', u'saw', u'imagined', u'imagined', u'saw', u'saw', u'imagined', u'saw', u'saw', u'imagined', u'imagined', u'saw', u'saw', u'imagined', u'imagined', u'considered', u'imagined', u'saw', u'imagined', u'anticipated', u'imagined', u'imagined', u'conceived', u'imagined', u'good', u'pictured', u'saw', u'pictured', u'envisioned', u'anticipated', u'imagined', u'pictured', u'saw', u'imagined', u'pictured', u'envisioned', u'saw', u'imagined', u'envisioned', u'saw', u'saw', u'imagined', u'pictured', u'imagined', u'predicted', u'seen', u'pictured', u'featured', u'imagined', u'imagined', u'']","['conceive_of@NN', 'envisage@NN', 'ideate@NN', 'imagine@NN']","['N']"
"""With poor sales of the A340-200 , Airbus decided to use the fuselage of the A340-200 with the wings and engines of the A330-300 .""","fuselage","[u'trunk', u'cabin', u'body', u'cabin', u'main parts', u'body', u'body', u'cabin', u'body', u'body', u'body', u'mass', u'body', u'body', u'fuel tank', u'frame', u'body', u'body', u'body', u'frame', u'core', u'body', u'body', u'body', u'gas tank', u'body', u'body', u'fuel tank', u'cabin', u'body', u'front', u'tank', u'gas tank', u'tank', u'body', u'body', u'bulk', u'body', u'body', u'body', u'body', u'body', u'bulk', u'cabin', u'body', u'body', u'body', u'frame', u'center', u'body', u'body', u'']","['fuselage@NN']","['N']"
"""The last event was held on June 11 , 2000 , not to be held again due to the acquisition of WCW by World Wrestling Federation .""","acquisition","[u'buying', u'purchase', u'purchase', u'purchase', u'ownership', u'addition', u'purchase', u'gain', u'ownership', u'purchase', u'purchase', u'purchase', u'gaining', u'obtaining', u'receiving', u'gain', u'purchase', u'buying', u'purchase', u'purchase', u'addition', u'purchase', u'gain', u'gain', u'ownership', u'buying', u'gain', u'gain', u'gaining', u'purchase', u'addition', u'purchase', u'gain', u'gain', u'purchase', u'purchase', u'purchase', u'attainment', u'gaining', u'receiving', u'gaining', u'purchase', u'buying', u'attaining', u'purchase', u'purchase', u'purchase', u'acquirement', u'obtaining', u'purchase', u'purchase', u'']","['acquirement@NN', 'accomplishment@NN', 'attainment@NN', 'learning@VBG', 'skill@NN', 'acquisition@NN']","['Y']"
"""Kowal suggested the name and the IAU endorsed it in 1975 .""","certify","[u'approved', u'supported', u'okayed', u'approved', u'approved', u'supported', u'approved', u'supported', u'supported', u'recommended', u'supported', u'supported', u'adopted', u'backed', u'approved', u'accepted', u'accepted', u'supported', u'approved', u'supported', u'approved', u'supported', u'approved', u'approved', u'accepted', u'supported', u'supported', u'backed', u'accepted', u'approved', u'supported', u'ratified', u'passed', u'authorized', u'okayed', u'supported', u'approved', u'supported', u'supported', u'supported', u'supported', u'favored', u'approved', u'approved', u'approved', u'authorized', u'supported', u'supported', u'approved', u'supported', u'supported', u'']","['indorse@NN', 'plunk_for@NN', 'support@NN', 'plump_for@NN', 'back@RB', 'second@JJ', 'endorse@NN', 'certify@NN']","['N']"
"""Dry air wrapping around the southern periphery of the cyclone eroded most of the deep convection by early on September 12 .""","periphery","[u'surroundings', u'outskirts', u'edge', u'outside', u'area', u'edge', u'outskirts', u'edge', u'border', u'edge', u'edge', u'edge', u'side', u'edge', u'edge', u'part', u'rim', u'edge', u'outside', u'edge', u'edge', u'edge', u'border', u'edge', u'edge', u'edge', u'edge', u'edge', u'edge', u'border', u'border', u'edge', u'edge', u'circumference', u'edges', u'border', u'edge', u'edge', u'end', u'side', u'side', u'border', u'end', u'border', u'edge', u'border', u'edge', u'edge', u'part', u'edge', u'edge', u'']","['outer_boundary@JJ', 'fringe@NN', 'periphery@NN']","['N']"
