"""Fernando Navarro i Corbacho is a Spanish footballer who currently plays for Sevilla FC , as a left defender .""","guardian","[u'fighter', u'protector', u'protector', u'guard', u'fielder', u'protector', u'protector', u'guard', u'player', u'supporter', u'player', u'fighter', u'guard', u'champion', u'goalkeeper', u'guard', u'player', u'protector', u'fighter', u'player', u'defenseman', u'player', u'guard', u'opponent', u'guard', u'player', u'player', u'back', u'guard', u'defender', u'guard', u'back', u'protector', u'fielder', u'protector', u'guard', u'blocker', u'defenseman', u'protector', u'player', u'protector', u'guard', u'protector', u'stopper', u'player', u'guard', u'guard', u'blocker', u'defense player', u'', u'']","['defender@NN', 'protector@NN', 'withstander@NN', 'shielder@NN', 'guardian@NN']","['Y']"
"""Throughout recorded history , several cosmologies and cosmogonies have been proposed to account for observations of the Universe .""","observation","[u'sights', u'measuring', u'study', u'recordings', u'views', u'appearance', u'reviews', u'views', u'viewings', u'watching', u'views', u'sightings', u'inspections', u'detections', u'studies', u'views', u'what has been seen', u'viewings', u'studies', u'knowledge', u'views', u'viewings', u'research', u'reviews', u'views', u'research', u'what they see', u'events', u'studies', u'events', u'views', u'evidence', u'interpretations ', u'experiences', u'views', u'viewing', u'studies', u'tales', u'studies', u'noticings', u'happenings', u'views', u'consideration', u'studies', u'sightings', u'studies', u'views', u'studies', u'records', u'examinations', u'', u'']","['notice@NN', 'observance@NN', 'reflection@NN', 'watching@VBG', 'reflexion@NN', 'observation@NN']","['Y']"
"""Saint-Montan is a commune in the Ardche department in south-eastern France .""","section","[u'area', u'district', u'area', u'area', u'part', u'area', u'area', u'area', u'area', u'area', u'agency', u'section', u'section', u'area', u'group', u'part', u'area', u'section', u'section', u'place', u'area', u'area', u'area', u'area', u'section', u'county', u'area', u'area', u'branch', u'section', u'section', u'section', u'category', u'section', u'section', u'region', u'category', u'area', u'area', u'area', u'area', u'area', u'area', u'area', u'area', u'area', u'section', u'area', u'region', u'', u'']","['department@NN', 'section@NN']","['N']"
"""The term is also at times used as a derogatory term for films or sequels of films that are of inferior quality , or are not expected to find financial success .""","derogative","[u'bad', u'demeaning', u'bad', u'insulting', u'bad', u'bad', u'negative', u'pejorative', u'bad', u'rude', u'negative', u'negative', u'rude', u'negative', u'negative', u'bad', u'negative', u'negative', u'negative', u'bad', u'mean', u'negative', u'mean', u'different', u'offensive', u'bad', u'foul', u'offensive', u'offensive', u'bad', u'negative', u'negative', u'bad', u'bad', u'negative', u'bad', u'negative', u'bad', u'bad', u'negative', u'negative', u'degrading', u'mean', u'bad', u'bad', u'bad', u'negative', u'negative', u'negative', u'negative', u'', u'']","['disparaging@VBG', 'derogatory@NN', 'derogative@NN']","['N']"
"""The Hush Sound is currently on hiatus .""","suspension","[u'hold', u'break', u'break', u'pause', u'leave', u'break', u'break', u'break', u'break', u'rest', u'break', u'break', u'break', u'hold', u'break', u'pause', u'break', u'stop', u'break', u'break', u'break', u'break', u'break', u'a break', u'vacation', u'break', u'break', u'break', u'break', u'a break', u'leave', u'break', u'break', u'break', u'break', u'break', u'hold', u'break', u'vacation', u'break', u'pause', u'vacation', u'holiday', u'vacation', u'break', u'vacation', u'break', u'a break', u'break', u'hold', u'', u'']","['reprieve@NN', 'hiatus@NN', 'abatement@NN', 'respite@NN', 'foramen@NNS', 'suspension@NN']","['N']"
"""Mainstream music denotes music that is familiar and unthreatening to the masses , as for example popular music , pop music , middle of the road music , pop rap or soft rock ; Mainstream jazz is generally seen as an evolution of be-bop , which was originally regarded as radical .""","denote","[u'means', u'indicates', u'shows', u'is', u'means', u'means', u'means', u'shows', u'promotes', u'means', u'means', u'expresses', u'is', u'shows', u'means', u'symbolizes', u'expresses', u'means', u'is', u'shows', u'means', u'expresses', u'means', u'marks', u'means', u'notates', u'indicates', u'means', u'means', u'defines', u'means', u'is', u'expresses ', u'represents', u'means', u'describes', u'is', u'frowns on', u'indicates', u'means', u'is', u'means', u'means', u'is', u'describes', u'is', u'marks', u'indicates', u'means', u'means', u'', u'']","['announce@NN', 'refer@NN', 'denote@NN']","['N']"
"""Edwards attended West Buckland School where his potential for the triple jump was spotted at an early age .""","potentiality","[u'ability', u'ability', u'talent', u'chance', u'skill', u'talent', u'strength', u'skill', u'skill', u'abillity', u'promise', u'promising', u'ability', u'accomplishment', u'ability', u'talent', u'ability', u'ability', u'promise', u'talent', u'promise', u'strength', u'skill', u'talent', u'talent', u'possibility', u'talent', u'ability', u'promise', u'talent', u'ability', u'skill', u'future', u'likely', u'skill', u'talent', u'talent', u'ability', u'ability', u'skills', u'ability', u'talent', u'ability', u'capability ', u'ability', u'skill', u'possibility', u'talent', u'possibility', u'aptitude ', u'', u'']","['potential_drop@NN', 'potential_difference@NN', 'potency@NN', 'possible@JJ', 'electric_potential@JJ', 'likely@JJ', 'potential@JJ', 'voltage@NN', 'potentiality@NN']","['Y']"
"""Inheriting a collapsing empire and faced with constant warfare during his reign against both the Seljuk Turks in Asia Minor and the Normans in the western Balkans , Alexios was able to halt the Byzantine decline and begin the military , financial , and territorial recovery known as the `` Komnenian restoration '' .""","*predominate","[u'rule', u'rule', u'time as king', u'rule', u'rule', u'rule', u'rule', u'rule', u'rule', u'rule', u'rule', u'war', u'rule', u'rule', u'rule', u'rule', u'rule', u'control', u'leadership', u'stint', u'rule', u'rule', u'rule', u'rule', u'rule', u'attack', u'rule', u'rule', u'rule', u'rule', u'rule', u'leadership', u'rule', u'rule', u'rule', u'rule', u'rule', u'rule', u'rule', u'rule', u'rule', u'power', u'rule', u'rule', u'war', u'rule', u'time', u'command', u'rule', u'rule', u'', u'']","['rule@NN', 'reign@NN', 'sovereignty@NN', 'dominate@NN', 'prevail@NN', 'predominate@NN']","['Y']"
"""In the census of 2005 , the population of the Banja Luka Region was at 709,000 residents , predominantly Serb .""","house_physician","[u'people', u'citizens', u'citizen', u'people', u'place', u'people', u'people', u'citizens', u'people', u'people', u'people', u'people', u'people', u'people', u'people', u'citizens', u'citizens', u'citizens', u'inhabitant', u'people', u'citizens', u'people', u'people', u'people', u'people', u'people', u'homeowners', u'citizens', u'people', u'people', u'people', u'people', u'people', u'people', u'people', u'people', u'people', u'people', u'citizens', u'people', u'people', u'citizens', u'people', u'people', u'people', u'people', u'people', u'people', u'people', u'people', u'', u'']","['resident@NN', 'occupier@NN', 'resident_physician@NN', 'occupant@NN', 'house_physician@NN']","['N']"
"""Monte Plata is a province of the Dominican Republic , and also the name of its capital city . It was split from San Crist_bal in 1992 .""","responsibility","[u'area', u'part', u'city', u'part', u'area', u'part', u'area', u'region', u'part', u'area', u'part', u'area', u'section', u'division', u'part', u'territory', u'region', u'city', u'territory', u'region', u'part', u'area', u'area', u'area', u'region', u'area', u'state', u'region', u'area', u'state', u'town', u'state', u'state', u'section', u'part', u'area', u'area', u'part', u'town ', u'region', u'region', u'region', u'area', u'part', u'section', u'domain', u'district', u'region', u'region', u'district', u'', u'']","['province@NN', 'state@NN', 'responsibility@NN']","['Y']"
"""It is sent as an HTTP header by a web server to a web browser and then sent back unchanged by the browser each time it accesses that server .""","approach","[u'connects to', u'uses', u'enters', u'contacts', u'uses', u'enters', u'uses', u'enters', u'goes to', u'uses', u'connects', u'reaches', u'goes on', u'uses', u'pings', u'contacts', u'contacts', u'approached ', u'enters', u'opens', u'reaches', u'uses', u'uses', u'routes', u'uses', u'contacts', u'uses', u'checks', u'contacts', u'connects', u'reaches', u'reaches', u'uses', u'contacts', u'uses', u'enters', u'goes to', u'reaches', u'enters', u'contacts', u'goes on ', u'connects to ', u'connects to', u'hits', u'contacts', u'uses', u'contacts', u'contacts', u'contacts', u'enters', u'', u'']","['entree@NN', 'admission@NN', 'accession@NN', 'admittance@NN', 'access@NN', 'memory_access@NN', 'access_code@NN', 'get_at@NN', 'approach@NN']","['N']"
"""In contrast , the 2007 Microp_dia has roughly 65,000 articles , the vast majority of which contain fewer than 750 words , no references , and no named contributors .""","fewer","[u'less', u'less', u'less', u'less', u'less', u'less', u'less', u'less', u'less', u'less', u'less', u'less', u'less', u'less', u'under', u'less', u'less', u'less', u'less', u'less', u'less', u'less', u'less', u'less', u'less', u'less', u'less', u'lesser', u'less', u'less', u'less', u'less', u'less', u'lesser', u'less', u'less', u'less', u'less', u'less', u'less', u'less', u'less', u'less', u'less', u'less', u'less', u'less', u'less', u'less', u'less', u'', u'']","['few@JJ', 'fewer@JJR']","['N']"
"""By 1961 , Gordy had appointed Robinson vice-president of Motown Records , a title Robinson held for as long as Gordy remained with the company .""","persist","[u'worked', u'stayed', u'stayed', u'stayed', u'stayed', u'stayed', u'stayed', u'stayed', u'stayed', u'stayed', u'stayed', u'stayed', u'stayed', u'stayed', u'stayed', u'stayed', u'stayed', u'stayed', u'kept', u'stayed', u'stayed', u'stayed', u'stayed', u'stayed', u'stayed', u'stayed', u'stayed', u'stayed', u'stayed', u'stayed', u'stayed', u'stayed', u'stayed', u'was', u'stayed', u'stayed', u'stayed', u'stayed', u'stayed', u'stayed', u'stayed', u'stayed', u'stayed', u'stayed', u'stayed', u'stayed', u'stayed', u'stayed', u'stayed', u'stayed', u'', u'']","['rest@NN', 'stay@NN', 'remain@NN', 'continue@NN', 'stay_on@NN', 'persist@NN']","['N']"
"""From 1908 to 1911 he was the principal conductor of the Vienna Hofoper succeeding Gustav Mahler ; he retained the conductorship of the Vienna Philharmonic until 1927 .""","hold","[u'kept', u'kept', u'kept', u'kept', u'kept', u'kept', u'kept', u'kept', u'kept', u'kept', u'kept', u'kept', u'kept', u'kept', u'kept', u'kept', u'kept', u'held', u'kept', u'kept', u'kept', u'held', u'kept', u'kept', u'kept', u'kept', u'had', u'kept', u'kept', u'kept', u'kept', u'held', u'kept', u'held', u'kept', u'kept', u'kept', u'kept', u'kept', u'kept', u'kept', u'held', u'kept', u'got ', u'kept', u'kept', u'kept', u'kept', u'kept', u'kept', u'', u'']","['keep_back@NN', 'hold_back@NN', 'keep@VB', 'continue@NN', 'keep_on@NN', 'retain@NN', 'hold@NN']","['N']"
"""Mexican cinnamon hot chocolate is traditionally served alongside a variety of Mexican pastries known as pan dulce and , as in Spain , churros .""","traditionally","[u'normally', u'usually', u'normally', u'often', u'normally', u'usually', u'usually', u'usually', u'usually', u'usually', u'usually', u'usually', u'usually', u'usually', u'normally', u'usually', u'usually', u'normally', u'customarily', u'normally', u'usually', u'normally', u'usually', u'always', u'typically', u'often', u'normally', u'usually', u'normally', u'usually', u'usually', u'usually', u'normally', u'normally', u'commonly', u'usually', u'usually', u'usually', u'normally', u'usually', u'originally', u'usually', u'usually', u'usually', u'usually', u'usually', u'usually', u'usually', u'usually', u'historcally', u'', u'']","['traditionally@RB']","['N']"
"""Slaves were previously introduced by the British and French who colonized the island in the 18th century .""","present","[u'brought in', u'given', u'brought', u'brought in', u'imported', u'presented', u'brought', u'produced', u'brought', u'brought', u'obtained', u'brought in', u'brought', u'brought', u'brought', u'brought', u'shown', u'expressed', u'started', u'brought', u'brought', u'called', u'made known', u'brought over', u'presented', u'brought in', u'found', u'brought', u'brought', u'brought', u'brought', u'brought', u'shown', u'brought', u'met', u'started', u'established', u'brought', u'started', u'presented', u'presented', u'brought', u'brought', u'brought', u'brought', u'brought in', u'brought', u'brought in ', u'shown', u'brought', u'', u'']","['insert@NN', 'inaugurate@NN', 'bring_in@NN', 'acquaint@NN', 'put_in@NN', 'bring_out@NN', 'usher_in@NN', 'stick_in@NN', 'preface@NN', 'innovate@NN', 'inclose@NN', 'enclose@VB', 'introduce@NN', 'premise@NN', 'enter@NN', 'infix@NN', 'precede@NN', 'present@NN']","['N']"
"""Cholera , sometimes known as Asiatic or epidemic cholera , is an infectious gastroenteritis caused by enterotoxin-producing strains of the bacterium Vibrio cholerae .""","puree","[u'variations', u'groups', u'types', u'chunks', u'types', u'parts', u'lines', u'parts', u'lines', u'forms', u'strands', u'a family', u'parts', u'classes', u'types', u'versions', u'groups', u'types', u'types', u'versions', u'strings', u'types', u'kinds', u'kinds', u'pieces', u'types', u'pressures', u'types', u'types', u'types', u'differences', u'types', u'types', u'types', u'groups', u'types', u'types', u'kinds', u'type', u'types', u'strings', u'families', u'problems', u'types', u'variations', u'styles', u'types', u'types', u'kinds', u'lines', u'', u'']","['breed@NN', 'deform@NN', 'filter_out@NN', 'straining@VBG', 'strain@NN', 'tenor@NN', 'melody@NN', 'line@NN', 'filter@NN', 'separate_out@NN', 'sieve@NN', 'extend@NN', 'nisus@NN', 'filtrate@NN', 'pains@NNS', 'mental_strain@NN', 'stock@NN', 'form@NN', 'melodic_phrase@NN', 'reach@NN', 'variant@NN', 'distort@NN', 'melodic_line@NN', 'sift@NN', 'tense@NN', 'tense_up@NN', 'song@NN', 'var.@NN', 'striving@VBG', 'tune@NN', 'strive@NN', 'stress@NN', 'air@NN', 'try@NN', 'nervous_strain@NN', 'puree@NN']","['N']"
"""A hurricane struck Dominica and Puerto Rico between July 22 and July 24 .""","*impinge_on","[u'hit', u'hit', u'hit', u'hit', u'hit', u'hit', u'hit', u'hit', u'hit', u'hit', u'hit', u'hit', u'hit', u'hit', u'nit', u'hit', u'hit', u'hit', u'hit', u'hit', u'hit', u'hit', u'hit', u'hit', u'hit', u'hit', u'hit', u'hit', u'hit', u'hit', u'hit', u'hit', u'hit', u'hit', u'hit', u'hit', u'hit', u'hit', u'hit', u'hit', u'hit', u'hit', u'hit', u'hit', u'hit', u'hit', u'hit', u'hit', u'hit', u'hit', u'', u'']","['tap@NN', 'excise@NN', 'take_up@NN', 'scratch@NN', 'move@NN', 'discover@NN', 'attain@NN', 'rap@NN', 'run_into@NN', 'happen_upon@NN', 'mint@NN', 'walk_out@NN', 'chance_on@NN', 'strike@NN', 'work_stoppage@NN', 'come_to@NN', 'take@VB', 'hit@NN', 'come_upon@NN', 'impress@NN', 'strickle@NN', 'bang@NN', 'light_upon@NN', 'fall@NN', 'affect@NN', 'coin@NN', 'shine@NN', 'smash@NN', 'collide_with@NN', 'come_across@NN', 'fall_upon@NN', 'assume@VB', 'expunge@NN', 'chance_upon@NN', 'smasher@NN', 'ten-strike@NN', 'impinge_on@NN']","['Y']"
"""In 1975 the old district Steinfurt was merged with the district Tecklenburg , and together with Greven and Saerbeck from the former district M_nster the current district was formed .""","take_form","[u'born', u'started', u'made', u'created', u'established.', u'made', u'made', u'organized', u'made', u'made', u'created', u'created', u'made', u'made', u'created', u'made', u'created', u'made', u'made', u'created', u'created', u'made', u'made', u'created', u'made', u'created', u'created', u'made', u'made', u'made', u'founded', u'created', u'created', u'created', u'created', u'created', u'made', u'made', u'made', u'made', u'made', u'made', u'made', u'created', u'made', u'made', u'made', u'made', u'made', u'made', u'', u'']","['mould@NN', 'organize@VB', 'figure@NN', 'flesh@NN', 'soma@NN', 'spring@NN', 'frame@NN', 'constitute@NN', 'strain@NN', 'shape@NN', 'human_body@NN', 'mold@NN', 'contour@NN', 'configuration@NN', 'variety@NN', 'pattern@NN', 'make@VB', 'physique@NN', 'signifier@NN', 'grade@NN', 'build@NN', 'manakin@NN', 'forge@NN', 'word_form@NN', 'sort@NN', 'var.@NN', 'cast@NN', 'form@NN', 'variant@NN', 'conformation@NN', 'anatomy@NN', 'chassis@NN', 'mannequin@NN', 'phase@NN', 'physical_body@NN', 'class@NN', 'manikin@NN', 'mannikin@NN', 'imprint@NN', 'kind@NN', 'course@NN', 'take_shape@NN', 'work@NN', 'material_body@NN', 'descriptor@NN', 'organise@NN', 'bod@NN', 'take_form@NN']","['N']"
"""It was discovered by a team of astronomers led by Brett J. Gladman , et al . in 2003 .""","key_out","[u'found', u'found', u'found', u'found', u'found', u'found', u'found', u'found', u'found', u'found', u'found', u'evident', u'found', u'found', u'found', u'found', u'found', u'found', u'found', u'found', u'found', u'found', u'found', u'found', u'found', u'found', u'found', u'found', u'found', u'found', u'found', u'found', u'found', u'found', u'found', u'found', u'found', u'found', u'found', u'found', u'found', u'found', u'found', u'found', u'found', u'found', u'found', u'found', u'found', u'found', u'', u'']","['happen_upon@NN', 'bring_out@NN', 'describe@NN', 'notice@NN', 'distinguish@NN', 'see@VB', 'identify@VB', 'attain@NN', 'get_wind@NN', 'find@VB', 'detect@NN', 'divulge@NN', 'chance_on@NN', 'strike@NN', 'expose@VB', 'disclose@VB', 'give_away@NN', 'pick_up@NN', 'unwrap@NN', 'come_upon@NN', 'let_on@NN', 'discover@NN', 'break@NN', 'observe@NN', 'hear@NN', 'light_upon@NN', 'key@NN', 'come_across@NN', 'find_out@NN', 'get_word@NN', 'reveal@NN', 'name@NN', 'get_a_line@NN', 'fall_upon@NN', 'chance_upon@NN', 'let_out@NN', 'learn@NN', 'key_out@NN']","['N']"
"""Cyanobacteria , also known as blue-green algae , blue-green bacteria or Cyanophyta , is a phylum of bacteria that obtain their energy through photosynthesis .""","*find","[u'get', u'get', u'get', u'get', u'gain', u'get', u'get', u'get', u'get', u'get', u'get', u'get', u'get', u'get', u'gain', u'get', u'hold', u'get', u'get', u'get', u'get', u'get', u'kept', u'get', u'get', u'get', u'gain', u'get', u'get', u'get', u'get', u'get', u'get', u'get', u'get', u'get', u'get', u'get', u'get', u'grab', u'get', u'get', u'get', u'get', u'got', u'get', u'get', u'get', u'get', u'get', u'', u'']","['get@VB', 'receive@NN', 'obtain@VB', 'incur@NN', 'hold@NN', 'prevail@NN', 'find@VB']","['Y']"
"""She finally divorced Monroe in 1947 and also split with Guy .""","rent","[u'divided', u'parted', u'broke', u'broke up', u'brokeup', u'broke', u'separated', u'broke-up', u'divided', u'ended', u'divided', u'broke', u'broke up', u'left', u'broke up with', u'separated', u'broke up', u'seperated', u'stopped', u'ended it', u'left', u'left', u'divorced', u'brokeup', u'broke up', u'broke up', u'broke up', u'separated ', u'brokeup', u'broke-up', u'broke up', u'separated', u'broke-up', u'parted', u'departed', u'broke up', u'left off', u'broke-up', u'left', u'broke up', u'left', u'separated', u'parted', u'brokeup', u'broke', u'divorced', u'separated', u'broke up', u'broke', u'broke up', u'', u'']","['rive@NN', 'divide@NN', 'burst@NN', 'stock_split@NN', 'rip@NN', 'Split@NN', 'carve_up@NN', 'disunited@VBN', 'break_up@NN', 'schism@NN', 'snag@NN', 'split@NN', 'dissever@NN', 'fragmented@VBN', 'separate@JJ', 'break@NN', 'part@NN', 'cleave@NN', 'disconnected@VBN', 'tear@NN', 'split_up@NN', 'break_open@VB', 'rent@NN']","['N']"
"""Criss is a commune in the Sarthe department in the Pays de la Loire region in north-western France .""","area","[u'area', u'area', u'area', u'area', u'area', u'area', u'area', u'area', u'area', u'area', u'area', u'section', u'area', u'area', u'area', u'area', u'area', u'section', u'area', u'area', u'area', u'area', u'area', u'area', u'area', u'area', u'area', u'area', u'area', u'area', u'area', u'area', u'area', u'area', u'area', u'area', u'section', u'area', u'area', u'area', u'area', u'area', u'section', u'area', u'area', u'section', u'area', u'area', u'area', u'', u'']","['realm@NN', 'region@NN', 'part@NN', 'neighborhood@NN', 'area@NN']","['N']"
"""Dan pulled in Ruth Marie as a fifth person in his alliance , but after losing another Immunity Challenge , Sally convinced the La Mina men that she was a more valuable player .""","convince","[u'persuaded', u'assured', u'persuaded', u'showed', u'told', u'told', u'told', u'persuaded', u'converted', u'told', u'assured', u'persuaded', u'assured', u'told', u'persuaded', u'told', u'persuaded', u'told', u'persuaded', u'told', u'showed', u'swayed', u'proved to', u'persuaded', u'showed', u'persuaded', u'showed', u'showed', u'told', u'told', u'persuaded ', u'swayed', u'explained', u'showed', u'told', u'persuaded', u'told', u'persuaded', u'told', u'persuaded', u'told', u'told', u'persuaded', u'guaranteed', u'persuaded', u'showed', u'proved to', u'assured', u'told', u'assured', u'', u'']","['convert@NN', 'win_over@NN', 'convince@NN']","['N']"
"""Greater Armenia is an Armenian irredentist political goal aimed at uniting with Armenia most of the Armenian Highland , the historical homeland of the Armenians since antiquity up until the Armenian Genocide when they were massacred and forcefully expelled by the Ottoman Turkish government .""","forcefully","[u'energetically', u'strongly', u'effectively', u'strongly', u'forcibly', u'violently', u'rudely', u'powerfully', u'physically', u'strongly', u'angrily', u'powerfully', u'quickly', u'firmly', u'strongly', u'emphatically', u'energeticlly', u'controllably', u'brutally', u'essentially', u'forcibly', u'violently', u'forcibly', u'powerfully', u'harshly', u'strongly', u'powerfully', u'strongly ', u'vigorously', u'forcibly', u'severly', u'strongly', u'harshly', u'powerfully', u'strongly', u'powerfully', u'violently', u'strongly', u'made to be', u'strongly', u'harshly', u'strongly', u'strongly', u'powerfully', u'violently', u'powerfully', u'physically', u'quickly', u'strongly', u'forcibly', u'', u'']","['forcefully@RB']","['N']"
"""Lightcurve data for Europa has been particularly tricky to interpret , so much so for a long time its period of rotation was in dispute despite numerous observations .""","cunning","[u'hard', u'suspect', u'difficult', u'hard', u'hard', u'hard', u'hard', u'hard', u'hard', u'difficult', u'hard', u'hard', u'difficult', u'hard', u'hard', u'hard', u'difficult', u'hard', u'hard', u'hard', u'hard', u'confusing', u'hard', u'complicated', u'hard', u'hard', u'difficult ', u'tough', u'difficult', u'hard', u'hard', u'hard', u'hard', u'hard', u'hard', u'difficult', u'hard', u'hard', u'hard', u'hard', u'hard', u'difficult', u'difficult', u'hard', u'hard', u'hard', u'hard', u'difficult', u'hard', u'hard', u'', u'']","['tricky@NN', 'wily@RB', 'knavish@VB', 'sly@RB', 'catchy@NN', 'slick@NN', 'foxy@NN', 'guileful@NN', 'slippery@NN', 'tricksy@NN', 'dodgy@NN', 'crafty@NN', 'cunning@VBG']","['N']"
"""It is typically used for scraping or cutting food before the food enters the esophagus .""","quarrel","[u'scratching', u'scratching', u'rubbing', u'scratching', u'reducing', u'wearing down', u'slicing', u'removing', u'scratching', u'peeling', u'scratching', u'scratching', u'trimming', u'scratching', u'ripping', u'breaking', u'scratching', u'shaving', u'grinding', u'clearing', u'scratching', u'grating', u'scratching', u'scratching', u'scratching', u'rubbing', u'chewing', u'peeling', u'shaving', u'scratching', u'tearing', u'scratching', u'shaving', u'scratching', u'tearing', u'poking', u'slicing', u'collecting', u'grating ', u'softening', u'grinding', u'grinding', u'peeling', u'chopping', u'shaving', u'rubbing', u'shredding', u'grinding', u'peeling', u'scratching', u'', u'']","['junk@NN', 'combat@NN', 'argufy@NN', 'dispute@NN', 'chip@NN', 'flake@NN', 'fight@NN', 'altercate@NN', 'fleck@NN', 'fighting@VBG', 'rubbish@NN', 'bit@NN', 'trash@NN', 'scrap@NN', 'quarrel@NN']","['N']"
"""City of Faizabad is the headquarters of Faizabad District and a municipal board in the state of Uttar Pradesh , India , situated on the banks of river Ghaghra .""","headquarter","[u'base', u'base', u'head office', u'central location', u'home', u'capital', u'location', u'home office', u'center', u'base', u'home', u'base', u'base', u'location', u'base', u'base', u'main office', u'home', u'home', u'base', u'base', u'home', u'office', u'location', u'base', u'office', u'location', u'main location', u'base', u'base', u'seat', u'base', u'base', u'base', u'home', u'base', u'office', u'hometown', u'base', u'center', u'base', u'base', u'location', u'home', u'base', u'capital', u'head building', u'center', u'base', u'center', u'', u'']","['headquarter@NN']","['N']"
"""The name Kalganup is believed to be the Noongar word for ` place of many waters ' .""","consider","[u'thought', u'accepted', u'said', u'thought', u'thought', u'thought', u'thought', u'thought', u'known', u'thought', u'thought', u'thought', u'thought', u'thought', u'said', u'thought', u'known', u'thought', u'known', u'thought', u'thought', u'thought', u'thought', u'known', u'thought', u'thought', u'thought', u'thought', u'thought', u'thought', u'thought', u'thought', u'thought', u'trusted', u'understood', u'thought', u'thought', u'thought', u'thought', u'thought', u'thought', u'said', u'thought', u'thought', u'accepted', u'known', u'accepted', u'thought', u'thought', u'known', u'', u'']","['trust@NN', 'conceive@NN', 'believe@VB', 'think@NN', 'consider@VB']","['N']"
