"""The True Cross is the name for physical remnants which , by a Christian tradition , are believed to be from the cross upon which Jesus was crucified .""","remnants","[u'pieces', u'remains', u'bits', u'parts', u'parts', u'pieces', u'remains', u'pieces', u'remains', u'remains', u'pieces', u'remains', u'pieces', u'pieces', u'pieces', u'leftovers', u'leftovers', u'remains', u'remains', u'leftovers', u'artifacts', u'parts', u'remains', u'part', u'pieces', u'peices', u'pieces', u'pieces of wood', u'leftovers', u'remains', u'pieces', u'remains', u'parts', u'left overs', u'residual', u'items', u'pieces', u'remainders', u'remains', u'leftovers', u'remains', u'pieces', u'remains', u'leftovers', u'remains', u'pieces', u'remains', u'remains', u'remains', u'bits', u'', u'']","[u'oddment', u'leftover', u'remnant', u'end', u'remainder']","['N']","[]","['N']"
"The reservoir has a volume of 4.26 mio m and a surface area of 0.25 km .","reservoir","[u'lake', u'lake', u'lake', u'basin', u'stockpile', u'lake', u'lake', u'container', u'lake', u'lake', u'lake', u'lake', u'water source', u'water', u'container', u'source', u'container', u'basin', u'lake', u'lake', u'tank', u'tank', u'lake', u'reserve', u'container', u'lake', u'lake', u'basin', u'lake', u'pool', u'tank', u'tank', u'tank', u'lake', u'basin', u'space', u'lake', u'tank', u'body of water', u'pond', u'tank', u'tank', u'lake', u'river', u'basin', u'lake', u'basin', u'pool', u'pond', u'', u'', u'']","[u'artificial_lake', u'man-made_lake', u'source']","['Y']","[u'tank', u'cistern', u'pond', u'aljibar', u'mill pond']","['Y']"
"""In electronics , a voltage divider is a simple linear circuit that produces an output voltage that is a fraction of its input voltage . Voltage division refers to the partitioning of a voltage among the components of the divider .""","produce","[u'makes', u'creates', u'makes', u'makes', u'makes', u'makes', u'makes', u'makes', u'creates', u'makes', u'makes', u'creates', u'creates', u'results in', u'makes', u'makes', u'makes', u'creates', u'makes', u'gives', u'makes', u'makes', u'creates', u'gives', u'makes', u'makes', u'makes', u'creates', u'makes', u'creates', u'makes', u'creates', u'makes', u'makes', u'creates', u'gives', u'creates', u'makes', u'achieves', u'makes', u'makes', u'makes', u'makes', u'creates', u'makes', u'creates ', u'has', u'creates', u'makes', u'makes', u'', u'']","[u'green_goods', u'garden_truck', u'give_rise', u'raise', u'get', u'farm', u'make', u'acquire', u'green_groceries', u'bring_about', u'bring_out', u'bring_on', u'develop', u'grow', u'bring_forth', u'create']","['N']","[u'bear fruit ', u'frame', u'contrive', u'protract', u'proceeds', u'fabric', u'perform', u'make', u'construct', u'prolong', u'production', u'merchandise', u'performance', u'stock', u'manufacture', u'do', u'product', u'form', u'gar', u'staple commodity', u'effects', u'article', u'ware', u'handiwork', u'goods', u'commodity', u'give birth to ', u'fabricate', u'work', u'profit', u'operate', u'gain']","['N']"
"""Super Smash Bros. was developed by HAL Laboratory , a Nintendo second-party developer , during .""","develop","[u'created', u'created', u'made', u'made', u'made', u'made', u'started', u'created', u'created', u'created', u'made', u'created', u'made', u'created', u'made', u'made', u'made', u'made', u'built', u'made', u'created', u'created', u'created', u'made', u'made', u'created', u'created', u'made', u'made', u'made', u'made', u'made', u'created', u'created', u'created', u'made', u'made', u'written', u'established', u'made', u'made', u'made', u'created', u'written', u'made', u'made', u'started', u'created', u'created', u'made', u'', u'']","[u'formulate', u'uprise', u'spring_up', u'arise', u'modernize', u'educate', u'prepare', u'modernise', u'germinate', u'make_grow', u'evolve', u'rise', u'get', u'acquire', u'break', u'train', u'grow', u'originate', u'build_up', u'recrudesce', u'produce', u'explicate']","['N']","[u'distend', u'hatch', u'stuff', u'magnify', u'extend', u'breed', u'rarefy', u'blow up', u'spread', u'pad', u'expand', u'bring up', u'spread out', u'widen', u'inflate', u'puff', u'cram', u'aggrandize', u'amplify']","['N']"
"His work is displayed in the Museum of Modern Art in Yerevan .","display","[u'exhibited', u'shown', u'shown', u'shown', u'shown', u'shown', u'shown', u'shown', u'shown', u'shown', u'shown', u'revealed', u'shown', u'shown', u'shown', u'shown', u'shown', u'shown', u'shown', u'shown ', u'shown', u'shown', u'visible', u'showed', u'shown', u'shown', u'shown', u'shown', u'shown', u'shown', u'shown', u'on show', u'shown', u'shown', u'showed', u'shown', u'shown', u'shown', u'shown', u'shown', u'shown', u'hung up', u'shown', u'showed', u'shown', u'shown', u'shown', u'shown', u'showing', u'shown', u'', u'']","[u'exhibit', u'video_display', u'show', u'showing', u'expose', u'presentation']","['Y']","[u'exhibit', u'put forward', u'pomp', u'bring to light', u'show', u'tour de force ', u""put through one's paces"", u'etalage', u'solemnity', u'state', u'ostentation', u'parade', u'hold up', u'unroll', u'mise en sc ne', u'demonstrate', u'array', u'exposure', u'flourish', u'trot out']","['N']"
"""A historic organ was installed in it by the Austrian firm Rieger , in 1907 .""","instal","[u'built', u'put', u'placed', u'put ', u'integrated', u'placed', u'setup', u'built', u'put', u'put', u'built', u'put', u'put', u'placed', u'put', u'put', u'put', u'put', u'put', u'put', u'built', u'put', u'put', u'put', u'put', u'put', u'put', u'built', u'put', u'put', u'placed', u'put in', u'put', u'built', u'put', u'placed', u'put', u'put', u'put', u'built', u'put in place', u'set up', u'placed', u'put', u'put', u'placed', u'connected', u'built', u'put in', u'put', u'', u'']","[u'establish', u'set_up', u'install', u'put_in']","['N']","[]","['N']"
"The Romans believed the fumes produced by burning castoreum could induce an abortion ; Paracelsus thought it could be used in the treatment of epilepsy ; and medieval beekeepers used it to increase honey production .","produce","[u'caused', u'made', u'made', u'made', u'made', u'built', u'created', u'made', u'made', u'made', u'caused', u'made', u'made', u'created', u'created', u'made', u'made', u'made', u'made', u'created', u'created', u'made', u'created', u'made', u'made', u'made', u'made', u'made', u'made', u'made', u'made', u'made', u'made', u'made', u'made', u'made', u'made', u'made', u'made', u'made', u'made', u'made', u'made', u'made', u'made', u'made', u'composed', u'caused', u'made', u'created', u'', u'']","[u'green_goods', u'garden_truck', u'give_rise', u'raise', u'get', u'farm', u'make', u'acquire', u'green_groceries', u'bring_about', u'bring_out', u'bring_on', u'develop', u'grow', u'bring_forth', u'create']","['N']","[u'bear fruit ', u'frame', u'contrive', u'protract', u'proceeds', u'fabric', u'perform', u'make', u'construct', u'prolong', u'production', u'merchandise', u'performance', u'stock', u'manufacture', u'do', u'product', u'form', u'gar', u'staple commodity', u'effects', u'article', u'ware', u'handiwork', u'goods', u'commodity', u'give birth to ', u'fabricate', u'work', u'profit', u'operate', u'gain']","['N']"
"""Radames affirms that Aida is the person he will marry , and Aida convinces him to flee to the desert with her .""","affirm","[u'says', u'confirms', u'confirms', u'confirms', u'repeats', u'declares', u'agrees', u'states', u'promises', u'agrees', u'confirms', u'agrees', u'says', u'decides', u'confirms', u'confirms', u'assures', u'guarantees', u'support', u'agrees', u'swears', u'announces', u'validates', u'confirms', u'says', u'again', u'states', u'says', u'confirms', u'says', u'acknowledges', u'declares', u'agrees', u'declares', u'agrees', u'agrees', u'agrees', u'confirms', u'states', u'confirms', u'promises', u'confirms', u'attests', u'asserts', u'promises', u'agrees', u'agrees', u'states', u'agrees', u'swears', u'declares', u'agrees']","[u'avow', u'swan', u'substantiate', u'support', u'confirm', u'assert', u'corroborate', u'swear', u'sustain', u'verify', u'aver']","['Y']","[u'pledge troth', u""give one's word"", u'plight troth', u'say', u'give troth', u""pledge one's word"", u'confirm', u""pass one's honor"", u'state', u'pass troth', u""plight one's word"", u'predicate', u'state ', u'swear ', u'declare ', u'pledge credit', u'give credit', u""pass one's word"", u'plight credit', u'declare', u""plight one's honor"", u""give one's honor"", u""pledge one's honor"", u'pass credit']","['N']"
"A perfectly elastic collision is defined as one in which there is no loss of kinetic energy in the collision . An inelastic collision is one in which part of the kinetic energy is changed to some other form of energy in the collision .","kinetic","[u'active', u'moving', u'moving', u'moving', u'movement', u'motion', u'static', u'active', u'motive', u'motion', u'movement', u'movement', u'innate', u'moving', u'movement', u'active', u'moving', u'real', u'moving', u'active', u'strong', u'moving', u'moving', u'movement', u'driving', u'motion', u'moving', u'active', u'motion related', u'active', u'motion-', u'moving', u'active', u'moving', u'living', u'active', u'moving', u'moving', u'moving', u'active', u'powerful', u'moving', u'stored', u'active', u'active', u'moving', u'moving', u'moving', u'motion based', u'', u'']","[u'energizing', u'energising']","['N']","[]","['N']"
"Fives is a British sport believed to derive from the same origins as many racquet sports .","*derive","[u'come', u'come from', u'come', u'come', u'develop', u'come', u'come', u'come from', u'come', u'come', u'arrive', u'come', u'come from', u'come', u'come', u'come', u'come', u'begin', u'come', u'come', u'originate', u'come', u'come', u'come', u'come', u'come', u'come', u'come', u'come', u'come', u'come', u'come', u'come', u'come', u'created', u'come', u'begin', u'come', u'come', u'come', u'come', u'come from', u'come ', u'come from', u'come', u'come', u'come', u'come', u'be ', u'come', u'', u'']","[u'educe', u'deduce', u'deduct', u'gain', u'come', u'infer', u'descend']","['Y']","[u'draw', u'ween', u'gather', u'deduce', u'collect', u'make a deduction', u'get in the harvest', u'weet', u'draw an inference']","['N']"
"The process is termed lichenometry .","term","[u'called', u'called', u'called', u'called', u'called', u'named', u'named', u'named', u'called', u'called', u'called', u'called', u'named', u'called', u'called', u'called', u'called', u'called', u'called', u'called', u'named', u'called', u'called', u'named', u'called', u'called', u'named', u'called', u'called', u'named', u'named', u'called', u'called', u'called', u'called', u'called', u'called', u'named', u'called', u'called', u'called', u'called', u'named', u'named', u'called', u'named', u'coined', u'called', u'named', u'called', u'', u'']","[u'terminus', u'terminal_figure', u'full_term', u'condition']","['N']","[u'christen', u'denominate designate', u'point', u'station', u'period', u'rank', u'characterize', u'bourn', u'verge', u'reservation', u'conclusion', u'settlement', u'pale', u'style', u'span', u'strict settlement', u'space', u'stage ', u'dub', u'vocable', u'mark', u'in the same category ', u'call', u'place ', u'entitle', u'enclave', u'boundary', u'confine', u'finis', u'lease', u'finale', u'curbstone', u'season', u'clepe', u'spell', u'limitation', u'but', u'desinence', u'step', u'endpoint', u'baptize', u'word', u'distinguish by the name of', u'omega', u'specify', u'stage', u'terminus', u'noun', u'name', u'particular estate', u'bounds', u'of the same class ', u'limit', u'define', u'expression', u'last']","['N']"
"""Southeastern Oklahoma , also known by its official tourism designation , Kiamichi Country , encompasses the southeastern quarter of the state of Oklahoma .""","encompass","[u'makes up', u'covers', u'encircles', u'covers', u'covers', u'fills', u'includes', u'surrounds', u'covers', u'covers', u'includes', u'includes', u'surrounds', u'covers', u'is filled by', u'includes', u'surrounds', u'surrounds', u'contains', u'makes up', u'forms', u'covers', u'includes', u'contains', u'makes up', u'spans', u'covers', u'occupies', u'includes', u'is', u'surrounds', u'surrounds', u'contains', u'place', u'includes', u'surrounds', u'surrounds', u'includes', u'includes', u'surrounds', u'includes', u'takes up', u'includes', u'surrounds', u'surrounds', u'envelopes', u'includes', u'contains', u'circles', u'covers', u'includes', u'']","[u'cover', u'embrace', u'comprehend']","['N']","[u'inclose', u'encircle', u'lap', u'embrace', u'surround', u'beset', u'gird', u'environ', u'compass', u'enclose', u'circumvent']","['N']"
"""Phosgene can be detected at 0.4 ppm , which is four times the Threshold Limit Value .""","detect","[u'seen', u'seen', u'found', u'seen', u'found', u'found', u'seen', u'found', u'seen', u'spotted', u'found', u'noticed', u'seen', u'found', u'found', u'found', u'spotted', u'discovered', u'found', u'seen', u'found', u'seen', u'found', u'noticed', u'seen', u'noticed', u'noticed', u'found', u'noticed', u'found', u'noticed', u'noticed', u'noticed', u'seen', u'seen', u'shown', u'found', u'found', u'seen', u'seen', u'found', u'observed', u'found', u'seen', u'found', u'seen', u'noticed', u'found', u'observed', u'found', u'', u'']","[u'notice', u'observe', u'find', u'discover']","['N']","[]","['N']"
"""Railways now bypass the three major falls , and much of the trade of central Africa passes along the river , including copper , palm oil , sugar , coffee , and cotton .""","bypass","[u'avoid', u'cross', u'cross', u'avoid', u'route', u'skip', u'go by', u'go around', u'avoid', u'avoid', u'avoid', u'go around', u'skip', u'skip', u'go through', u'avoid', u'go around', u'go through', u'ignore', u'avoid', u'avoid', u'avoid', u'cross', u'go past', u'avoid', u'pass', u'pass', u'go around', u'go by', u'skip', u'pass', u'go around', u'avoid', u'detour', u'avoid', u'circumvent ', u'ignore', u'go around', u'detour around', u'avoid', u'pass by', u'ignore', u'avoid', u'detour', u'avoid', u'go around', u'go past', u'avoid', u'avoid', u'avoid', u'', u'']","[u'electrical_shunt', u'shunt', u'beltway', u'short-circuit', u'get_around', u'ringway', u'go_around', u'ring_road']","['N']","[]","['N']"
"""Pool , also known as pocket billiards , is the general term for a family of cue sports played on a pool table with six receptacles called pockets along the , into which balls are deposited as the main goal of play .""","receptacles","[u'holes ', u'holes', u'containers', u'holes', u'holes', u'holes', u'holes', u'holes', u'holes', u'containers', u'containers', u'holes', u'places', u'holes', u'holes', u'holes', u'holes', u'baskets', u'holes', u'containers', u'holes', u'holes', u'containers', u'holes', u'holders', u'containers', u'holes', u'holes', u'holes', u'holders', u'holes', u'holders', u'pouches', u'containers', u'holes', u'areas', u'holes', u'holes', u'spaces to collect', u'holes', u'openings', u'holes', u'holes', u'holes', u'containers', u'holes', u'holes', u'openings', u'divisions ', u'openings', u'', u'']","[u'receptacle']","['N']","[]","['N']"
"""While at Trinity he became more focussed on music , for there he met the folk song collector Cecil Sharp and composer and folk song enthusiast Ralph Vaughan Williams .""","focus","[u'fixed', u'fixed', u'concentrated', u'fixated', u'sighted', u'interested', u'centered', u'in love with working', u'interested', u'fixed', u'interested', u'concentrated', u'fixed', u'centered', u'fixed', u'centered', u'concentrated', u'concentrated', u'concerned', u'distracted', u'dedicated', u'interested', u'driven', u'concentrated', u'intrested', u'centered', u'concentrated', u'intent', u'concentrated', u'keen', u'interested', u'involved', u'supported', u'set', u'fixated', u'concentrated', u'interested', u'attracted', u'reliant', u'fond', u'mindful', u'intigued', u'centered', u'attracted', u'hooked', u'intent ', u'fixated', u'interested', u'centered', u'interested', u'', u'']","[u'nidus', u'direction', u'centering', u'center', u'concenter', u'centre', u'pore', u'focussing', u'focal_point', u'stress', u'concentrate', u'concentre', u'focusing', u'sharpen', u'focalize', u'focalise', u'rivet']","['N']","[u'hearth', u'resort ', u'combustion chamber']","['N']"
"""He is widely known for his roles as Little Joe Cartwright in Bonanza , Charles Ingalls in Little House on the Prairie , and Jonathan Smith in Highway to Heaven .""","widely","[u'well', u'well', u'largely', u'mostly', u'well', u'well', u'largely', u'majorly', u'famously', u'mostly', u'well ', u'well', u'extensively', u'well', u'mostly', u'famously', u'well', u'well', u'broadly', u'mostly', u'often', u'mostly', u'mostly', u'well', u'well', u'well', u'commonly', u'generally', u'commonly', u'mostly', u'well', u'well', u'well', u'popularly', u'largely', u'commonly', u'commonly', u'well', u'broadly', u'well', u'mostly', u'often', u'commonly', u'popularly', u'well', u'commonly', u'generally', u'commonly', u'commonly', u'well', u'', u'']","[u'wide']","['N']","[u'far and wide']","['N']"
"It is currently used mostly for football matches and is the home stadium of Union Sportive du Foyer de la RÌ©gie Abidjan-Niger .","match","[u'games', u'games', u'games', u'games', u'games', u'games', u'games', u'games', u'games', u'games', u'games', u'games', u'games', u'games', u'games', u'games', u'games', u'games', u'games', u'games', u'games', u'games', u'games', u'games', u'games', u'games', u'games', u'games', u'games', u'games', u'games', u'games', u'games', u'games', u'games', u'games', u'games', u'games', u'games', u'games ', u'games', u'games', u'games', u'games', u'games', u'games', u'games', u'games', u'games', u'games', u'', u'']","[u'catch', u'correspond', u'pair', u'twin', u'mates', u'play_off', u'lucifer', u'touch', u'pit', u'check', u'cope_with', u'fit', u'equalise', u'mate', u'gibe', u'couple', u'tally', u'friction_match', u'jibe', u'peer', u'compeer', u'rival', u'equal', u'oppose', u'equalize', u'meet', u'equate', u'agree']","['N']","[u'congreve', u'steeple chase', u'recognize', u'rhyme with', u'peer', u'twin', u'identify', u'lucifer', u'equal', u'recognition', u'fusee', u'locofoco', u'match up', u'corrivalry', u'mate', u'identification', u'corrivalship', u'horse racing', u'concours', u'vesuvian', u'handicap', u'reach', u'heat', u'pendant', u'pair', u'diagnosis', u'fellow', u'compeer', u'parallel', u'sister', u'run abreast', u'spill', u'light', u'keep pace with', u'fellow companion', u'brother', u'counterpart', u'race', u'vesta', u'double', u'agonism']","['N']"
"""The primary trinity included Tinia , Uni and Menrva .""","primary","[u'main', u'main', u'main', u'main', u'first', u'main', u'main', u'main', u'main', u'first', u'complete', u'main', u'central', u'main', u'main', u'main', u'most important', u'main', u'main', u'main', u'main', u'main', u'main', u'main', u'original', u'first', u'most important', u'main', u'main', u'central', u'main', u'main', u'main', u'first', u'original', u'most important', u'initial', u'leading ', u'main', u'main', u'first', u'first', u'main', u'main', u'first', u'main', u'main', u'main', u'main', u'main', u'', u'']","[u'primary_quill', u'primary_feather', u'primary_coil', u'elemental', u'basal', u'chief', u'primary_election', u'master', u'primary_winding', u'elementary', u'main', u'principal']","['Y']","[u'prime', u'primitive', u'council fire', u'paramount', u'radical', u'all-absorbing', u'capital', u'foremost', u'primordial', u'chief', u'vital', u'cardinal', u'leading', u'overruling', u'powwow', u'main', u'essential', u'principal']","['Y']"
"""In 1832 his family emigrated thence to Belleville , Ontario , where he apprenticed with the printer at the town newspaper , The Belleville Intelligencer .""","emigrate","[u'moved', u'moved', u'moved', u'moved', u'moved', u'moved', u'moved', u'moved abroad', u'moved', u'moved', u'moved', u'moved', u'came', u'moved', u'moved', u'moved', u'moved', u'moved', u'moved', u'traveled', u'traveled', u'moved', u'came', u'moved', u'moved', u'moved', u'moved', u'moved', u'moved', u'moved', u'moved', u'moved', u'moved', u'moved', u'moved', u'moved', u'came', u'moved', u'moved', u'moved', u'moved', u'moved', u'migrated', u'moved', u'left', u'moved', u'departed', u'moved', u'moved', u'migrated', u'moved', u'']","[]","['N']","[u'migrate']","['N']"
"""Loch Ness is best known for the alleged sightings of the legendary Loch Ness Monster , also known as `` Nessie '' .""","legendary","[u'famous', u'fabled', u'famous', u'epic', u'famous', u'famous', u'famous', u'famed', u'fabled', u'ancient', u'famed', u'famous', u'famous', u'mythical', u'famous', u'famed', u'rare', u'well known', u'famous', u'famous', u'famous ', u'famous', u'fabled', u'great', u'famous', u'awesome', u'fabld', u'famous', u'well known', u'famous', u'famous', u'famous', u'famous', u'famous', u' fabled', u'famous', u'unreal', u'famous', u'infamous', u'reputed', u'supposed', u'well-known', u'popular', u'mythical', u'mystical ', u'famous', u'famous', u'mythical', u'famous', u'famous', u'', u'']","[u'fabled']","['Y']","[u'fabulous']","['N']"
"""Polar bear fur consists of a layer of dense underfur and an outer layer of guard hairs , which appear white to tan but are actually transparent .""","transparent","[u'clear', u'clear', u'clear', u'clear', u'clear', u'see through', u'clear', u'clear', u'clear', u'clear', u'clear', u'clear', u'clear', u'clear', u'see through', u'clear', u'clear', u'translucent', u'clear', u'clear', u'see through', u'clear', u'clear', u'clear', u'clear', u'clear', u'see through', u'clear', u'clear', u'clear', u'clear', u'colorless', u'see through', u'clear', u'clear', u'see through', u'clear', u'clear', u'clear', u'clear', u'clear', u'clear', u'clear', u'clear', u'clear', u'clear', u'clear', u'clear', u'see through', u'clear', u'clear', u'']","[u'gauze-like', u'sheer', u'gossamer', u'vaporous', u'crystal_clear', u'lucid', u'limpid', u'cobwebby', u'vapourous', u'filmy', u'guileless', u'pellucid', u'see-through', u'diaphanous', u'crystalline', u'gauzy']","['N']","[u'lucid', u'tralucent', u'relucent', u'pellucid', u'diaphanous', u'luminous', u'translucent']","['Y']"
"This is a considerably higher total than that of any other European country .","considerably","[u'much', u'significantly', u'much', u'lot', u'much', u'much', u'greatly', u'much', u'greatly', u'reasonably', u'very', u'much', u'much', u'much', u'much', u'much', u'much', u'much', u'remarkably ', u'much ', u'much', u'much', u'much', u'much', u'much', u'much', u'mcuh', u'much', u'much', u'a lot', u'larger', u'much', u'significantly', u'much', u'much', u'much', u'definitely', u'much', u'far', u'noticably', u'much', u'much', u'much', u'noteworthy', u'lot', u'much', u'much', u'greatly', u'noticeably', u'greatly', u'', u'']","[u'substantially', u'well']","['N']","[]","['N']"
"The Croatia national football team represents the Republic of Croatia in international football .","represent","[u'embodies', u'personifies', u'plays for', u'stands for', u'symbolizes', u'plays for', u'means', u'stands up for', u'symbolizes', u'belongs to', u'helps', u'portrays', u'plays for', u'is from', u'serves', u'serves', u'plays for', u'speaks for', u'plays for', u'exhibits', u'stands for', u'stands for', u'supports', u'acts as', u'stands for', u'stands for', u'signifies', u'plays for', u'captures', u'display', u'marks', u'serves', u'embodies', u'plays for', u'stands for', u'plays for', u'leads', u'plays for', u'stands for', u'plays for', u'from', u'exhibits', u'plays for', u'plays for', u'serves', u'plays for', u'equals', u'appears as', u'forms', u'is', u'', u'']","[u'exemplify', u'play', u'lay_out', u'stand_for', u'be', u'make_up', u'defend', u'correspond', u'symbolise', u'typify', u'map', u'present', u'interpret', u'act', u'constitute', u'symbolize', u'comprise', u'stage']","['N']","[u'delineate', u'let fall', u'intimate', u'depict ', u'representing', u'express', u'communicate', u'make known', u'set forth', u'mention', u'exhibit', u'stand for', u'portray ']","['N']"
"""As of , it lies at latitude 66 33 39 south of the equator .""","lie","[u'is', u'resides', u'is', u'is', u'is', u'is', u'sits', u'is located', u'sits', u'stations', u'sits', u'sits', u'sits', u'sits', u'exists', u'is', u'is', u'is', u'is', u'is positioned', u'is', u'is', u'is found', u'sits', u'is', u'sits', u'locates', u'is', u'is', u'sits', u'is', u'sits', u'is', u'rests', u'exists', u'is', u'exists', u'is', u'is found', u'is located', u'stands', u'is located', u'is', u'is', u'sits', u'sets', u'is', u'rests', u'sits', u'sits', u'', u'']","[u'prevarication', u'Trygve_Halvden_Lie', u'consist', u'Lie', u'Trygve_Lie', u'lie_in', u'rest', u'dwell', u'lie_down']","['N']","[u'taradiddle', u'story', u'whopper', u'shuffle ', u'misrepresent ', u'recline', u'pretend ', u'falsehood', u'bounce', u'couch', u'fib', u'thing that is not', u'make capital out of', u'untruth', u'have its seat in', u'stand', u'suggestio falsi ', u'crammer', u""take one's stand upon""]","['N']"
"""Triangles can also be classified according to their internal angles , measured here in degrees .""","classify","[u'grouped', u'grouped', u'categorized', u'arranged', u'labeled', u'grouped', u'grouped', u'categorized', u'named', u'divided', u'arranged', u'grouped', u'grouped', u'organized', u'named', u'grouped', u'grouped', u'grouped', u'grouped', u'organized', u'separated', u'sorted', u'sorted', u'named', u'grouped', u'defined', u'listed', u'categorized', u'categorized', u'identified', u'grouped', u'described', u'grouped', u'defined', u'called', u'grouped', u'sorted', u'grouped', u'described', u'grouped', u'organized', u'coded', u'arranged', u'categorized', u'sorted', u'organized', u'organized', u'categorized', u'organized', u'sorted', u'grouped', u'']","[u'sort', u'relegate', u'separate', u'assort', u'sort_out', u'class']","['N']","[u'class']","['N']"
