"""Typically , the biggest difference between film and stage musicals is the use of lavish background scenery which would be impractical in a theater .""","lavish","[u'extravagant', u'extravagant', u'rich', u'rich', u'fancy', u'complicated', u'fancy', u'expensive', u'plentiful', u'fancy', u'elaborate', u'flamboyant', u'expensive', u'special', u'fancy', u'pretty', u'fancy', u'elaborate', u'fancy', u'expensive', u'fancy', u'impressive', u'garish', u'fancy', u'fancy', u'nice', u'plentiful', u'extravagant', u'impressive', u'generous', u'wild', u'rich', u'excessive', u'generous', u'big', u'detailed', u'gaudy', u'complex', u'fancy', u'splendid', u'fancy', u'fancy', u'rich', u'grand', u'lively', u'fancy', u'extensive', u'extravagant', u'luxurious', u'lush', u'fancy', u'']","[u'overgenerous', u'unstinting', u'lush', u'plush', u'lucullan', u'unstinted', u'shower', u'plushy', u'munificent', u'too-generous', u'unsparing']","['Y']","[u'improvident', u'thrust upon', u'losel', u'excessive', u'squander', u'wasteful', u'unthrifty', u'overmuch', u'inordinate', u'extravagant', u'thriftless', u'prodigal', u'overliberal', u'pour on', u'exuberant', u'sow broadcast', u'dissipated', u'superabundant', u'profuse', u'replete']","['Y']"
"""The dead body of a human is referred to as a cadaver , or corpse .""","*human","[u'person', u'person', u'person', u'person', u'person', u'man', u'person', u'person', u'person', u'person', u'person', u'person', u'person', u'man', u'person', u'person', u'man or woman', u'person', u'person', u'person', u'person', u'person', u'person', u'person', u'person', u'person', u'person', u'person', u'person', u'person', u'person', u'person', u'man', u'person', u'person', u'person', u'person', u'person', u'person', u'person', u'person', u'person', u'person', u'person', u'person', u'person', u'person', u'person', u'person', u'person', u'', u'']","[u'human_being', u'homo', u'man']","['Y']","[u'fleshly', u'civic', u'personal', u'national', u'social', u'corporeal', u'individual', u'mortal', u'voice ', u'public']","['N']"
"He is portrayed by Mark Hamill .","portray","[u'played', u'played', u'played', u'played', u'represented', u'acted', u'played', u'played', u'played', u'played', u'played', u'played', u'played', u'played', u'played', u'played', u'played', u'acted', u'acted', u'acted by', u'depicted', u'played', u'played', u'represented', u'represented ', u'played', u'represented', u'played', u'represented ', u'done', u'played', u'played', u'played ', u'shown', u'played', u'played', u'played', u'shown', u'played', u'played', u'played', u'played', u'played', u'represented', u'played', u'imitated', u'played', u'played', u'represented', u'played', u'', u'']","[u'impersonate', u'depict', u'limn', u'present']","['N']","[]","['N']"
"""Not to be confused with `` terms '' in colloquial usages , the shortened form of technical terms which are defined within a discipline or speciality field .""","*discipline","[u'subject', u'job', u'specialist', u'thought', u'study', u'career', u'area of study', u'order', u'field', u'subject', u'control ', u'strict', u'career', u'career', u'area', u'practice', u'an area', u'profession', u'skill', u'topic', u'subject', u'group', u'practice', u'field of study', u'study', u'specific', u'job', u'practice', u'mastery', u'education', u'trade', u'area', u'area', u'(an) area', u'course', u'subject', u'topic of study', u'method', u'control', u'control', u'subject', u'area', u'category', u'specific', u'subject', u'practice', u'workers job', u'study', u'job', u'skipping', u'', u'']","[u'subject_field', u'field_of_study', u'study', u'check', u'subject_area', u'field', u'train', u'bailiwick', u'correct', u'sort_out', u'correction', u'condition', u'subject']","['Y']","[u'trial', u'control', u'train', u'infliction']","['Y']"
"The Man in the High Castle occurs in an alternate universe United States ruled by the victorious Axis powers .","alternate","[u'varied', u'other', u'different', u'opposite', u'different', u'different', u'different', u'different', u'different', u'imaginary', u'different', u'different', u'different', u'another', u'separate', u'different', u'different', u'different', u'different', u'other', u'different', u'different', u'variant', u'mirror', u'different', u'different', u'other', u'another', u'different', u'another', u'different', u'different', u'different', u'another', u'different', u'different', u'different', u'other', u'other', u'other', u'different', u'different', u'different', u'different', u'parallel', u'recurrent', u'separate', u'parallel', u'different', u'opposite', u'different', u'']","[u'alternating', u'interchange', u'understudy', u'surrogate', u'take_turns', u'flip', u'jump', u'switch', u'tack', u'flip-flop', u'alternative', u'substitute', u'replacement']","['N']","[u'hesitate', u'swerve', u'every other', u'undulate', u'wave', u'amoebean', u'sputter', u'reciprocate', u'stop and start', u'intermit']","['N']"
"""The character may be speaking his or her thoughts aloud , directly addressing another character , or speaking to the audience , especially the former .""","character","[u'actor', u'figure', u'person', u'person', u'actor', u'actor', u'person', u'actor', u'person', u'person', u'artist', u'actor', u'actor', u'person', u'actor', u'person', u'person', u'guy', u'person', u'person', u'person', u'person in the story', u'person', u'actor', u'person', u'person', u'person', u'person', u'actor', u'person', u'actor', u'person', u'person', u'person', u'person', u'person', u'actor', u'person', u'person', u'role', u'figure', u'person', u'personality', u'actor', u'person', u'person', u'person', u'person', u'person', u'person', u'', u'']","[u'fictional_character', u'fibre', u'fiber', u'character_reference', u'fictitious_character', u'reference', u'grapheme', u'eccentric', u'lineament', u'persona', u'theatrical_role', u'part', u'role', u'case', u'type', u'quality', u'graphic_symbol']","['Y']","[u'trim', u'fashion', u'tone', u'queer fish', u'black swan', u'nonsuch', u'manner', u'quality', u'wonder', u'style', u'nonesuch', u'constitution', u'rara avis', u'description', u'prodigy', u'disposition', u'complexion', u'crasis', u'role', u'type', u'monster', u'nature', u'dramatis personae', u'black sheep', u'denomination', u'part', u'curiosity', u'spirit', u'diathesis', u'designation', u'light', u'flying fish', u'miracle', u'stamp predicament', u'principle', u'qualities', u'guise', u'nondescript', u'lusus naturae', u'original', u'rubric']","['Y']"
"""After the demise of the WHL , however , the Stanley Cup was awarded exclusively to the NHL playoff champion , and the Wales Trophy was given to the regular season champion .""","*exclusively","[u'only', u'solely', u'only', u'only', u'only', u'only', u'only', u'only', u'singularly', u'only', u'only', u'solely', u'only', u'only', u'only', u'only', u'only', u'only', u'only', u'only', u'only', u'only', u'soley ', u'only', u'only', u'entirely', u'only', u'only', u'only', u'only', u'only', u'just', u'only', u'soley', u'solely ', u'only', u'only', u'only', u'only', u'only', u'only', u'only', u'only', u'rights', u'only', u'only', u'only', u'solely', u'entirely', u'only', u'', u'']","[u'alone', u'entirely', u'solely', u'only']","['Y']","[]","['N']"
"""The most recent goaltender to have scored a goal by deliberately shooting the puck into his opponents ' net was Evgeni Nabokov , in 2002 .""","deliberately","[u'purposefully', u'willfully', u'purposely', u'purposefully', u'purposely', u'purposely', u'purposely', u'on purpose', u'purposely', u'purpose;y', u'purposely', u'intentionally', u'purposefully ', u'knowingly', u'on purpose', u'purposely', u'freely', u'purposly', u'purposely ', u'purposely', u'purposefully', u'intentionally', u'purposely', u'purposely', u'purposely ', u'purposely', u'purposely', u'intentionally', u'knowingly ', u'purposefully', u'knowingly', u'purposely', u'purposely', u'directly', u'purposely', u'purposely', u'purposely', u'purposely', u'purposely', u'carefully', u'purposely', u'purposely', u'purposely ', u'purposely', u'purposely', u'purposely', u'instinctively', u'freely', u'purpousfully', u'intentionally', u'', u'']","[u'designedly', u'measuredly', u'advisedly', u'on_purpose', u'by_choice', u'intentionally', u'by_design', u'purposely']","['Y']","[u'in cold blood', u'without undue haste', u'unhurriedly', u'with premeditation', u'with eyes open', u'leisurely', u'all things considered', u'slowly', u""at one's leisure""]","['N']"
"A hurricane struck Dominica and Puerto Rico between July 22 and July 24 .","*strike","[u'hit', u'hit', u'hit', u'hit', u'hit', u'hit', u'hit', u'hit', u'hit', u'hit', u'hit', u'hit', u'hit', u'hit', u'nit', u'hit', u'hit', u'hit', u'hit', u'hit', u'hit', u'hit', u'hit', u'hit', u'hit', u'hit', u'hit', u'hit', u'hit', u'hit', u'hit', u'hit', u'hit', u'hit', u'hit', u'hit', u'hit', u'hit', u'hit', u'hit', u'hit', u'hit', u'hit', u'hit', u'hit', u'hit', u'hit', u'hit', u'hit', u'hit', u'', u'']","[u'tap', u'excise', u'take_up', u'scratch', u'move', u'discover', u'attain', u'rap', u'run_into', u'happen_upon', u'mint', u'walk_out', u'chance_on', u'work_stoppage', u'come_to', u'take', u'hit', u'come_upon', u'impress', u'strickle', u'bang', u'light_upon', u'fall', u'affect', u'coin', u'shine', u'smash', u'collide_with', u'come_across', u'fall_upon', u'assume', u'expunge', u'chance_upon', u'smasher', u'ten-strike', u'impinge_on']","['Y']","[u'tap', u'inspire', u'move', u'slap', u'dash', u'strain', u'slam', u'rap', u'touch', u'strike with awe', u'animate', u'quicken', u'blow', u'smite', u'impassion', u'perform', u'support', u'take effect', u'strike with wonder', u'sustain', u'interest', u'infect', u'play', u'hit', u'flap', u'dab', u'beat', u'excite', u'pat', u'impress', u'thump', u'bang', u'affect', u'knock', u'maintain', u'turn out']","['Y']"
"Dhamtour has an average elevation of 1110 metres .","elevation","[u'height', u'height', u'height', u'height', u'height', u'height', u'height', u'altitude', u'height', u'height', u'height', u'height', u'height', u'height', u'height', u'height', u'height', u'height', u'height', u'height', u'height', u'height', u'height', u'height', u'height', u'height', u'height', u'height', u'height', u'height', u'height', u'height', u'height', u'height', u'height ', u'height', u'height', u'height', u'height', u'height', u'altitude', u'height', u'rise', u'height', u'altitude', u'height', u'height', u'height', u'height', u'height', u'', u'']","[u'superlative', u'aggrandizement', u'acme', u'EL', u'natural_elevation', u'top', u'altitude', u'aggrandisement', u'height', u'ALT', u'lift', u'peak', u'pinnacle', u'tiptop', u'meridian', u'raising', u'summit']","['Y']","[u'erection', u'magnanimity', u'loftiness of purpose', u'exaltation', u'altitude', u'height', u'sublimity', u'world ', u'loftiness']","['Y']"
"But critics note that Francis Galton did not advocate coercion when he defined the principles of eugenics .","advocate","[u'like', u'cause', u'support', u'endorse', u'promote', u'promote', u'promote', u'support', u'encourage', u'support', u'endorse', u'support', u'apply', u'suggest', u'support', u'support', u'support', u'promote', u'speak', u'for', u'favor', u'support', u'support', u'promote', u'allow', u'suggest', u'promote', u'support', u'suggest', u'want back', u'support', u'support', u'recommend', u'promote', u'promote', u'want', u'promote', u'agree with', u'endorse', u'promote', u'support', u'support', u'support', u'state', u'support', u'promote', u'allow', u'support', u'support', u'support', u'support', u'']","[u'advocator', u'urge', u'counsel', u'counselor-at-law', u'exponent', u'counsellor', u'pleader', u'proponent', u'recommend', u'counselor', u'preach']","['Y']","[u'attorney', u'prompt', u'patron', u'mediator', u""one's man of business"", u'publicist', u'legal adviser', u'factor', u'abettor', u'juris consult', u'pundit', u'seconder', u'suggest', u'partisan', u'sympathizer', u'auctioneer', u'submonish', u'upholder', u'wellwisher', u'recommend', u'beat up for recruits', u'jurist', u'friend', u'tutelary saint', u'proctor', u'champion', u'civilian', u""plead one's cause"", u'clerk', u'prescribe', u'broker', u'backer', u'solicitor', u'good genius', u'underwriter', u'commission agent', u'legist', u'bailiff', u'press into the service', u'friend at court', u'defend', u'secretary']","['Y']"
"His reign spanned the years from 809 through 823 .","span","[u'stretched over', u'was ', u'crossed', u'oversaw', u'covered', u'crossed', u'included', u'lasted', u'lasted', u'lasted', u'covered', u'lasted', u'was between', u'lasted', u'covered ', u'lasted', u'lasted', u'included', u'lasted', u'was in', u'ranged', u'lasted', u'included', u'lasted', u'lasted', u'covered', u'lasted ', u'lasted', u'covered', u'covered', u'lasted', u'grew', u'lasted', u'included', u'joined', u'covered', u'was from', u'covered', u'lasted', u'lasted', u'bridged', u'went from', u'lasted', u'ranged', u'lasted from', u'was from', u'went from ', u'lasted', u'covered', u'lasted', u'', u'']","[u'bridge', u'twosome', u'traverse', u'distich', u'couple', u'duo', u'cross', u'straddle', u'twain', u'sweep', u'yoke', u'couplet', u'pair', u'duet', u'brace', u'dyad', u'duad']","['N']","[u""hair's breadth"", u'period', u'impermanence', u'evanescence', u'space', u'favor', u'mate', u'caducity', u'mortality', u'pace step', u'season', u'spell', u'reach', u'doublets', u'dispermy', u'stage', u'term', u'longitude', u'stride', u'length', u'dyad', u'bridge over', u'fugacity']","['N']"
"Digital signatures are equivalent to traditional handwritten signatures in many respects ; properly implemented digital signatures are more difficult to forge than the handwritten type .","forge","[u'copy', u'fake', u'copy', u'fake', u'fake', u'fake', u'fake', u'copy', u'fake', u'fake', u'falsify', u'fake', u'copy', u'make', u'fake', u'copy', u'copy', u'fake', u'duplicate', u'fake', u'fake', u'copy', u'recreate', u'copy', u'fake', u'make', u'make', u'copy', u'create', u'fake', u'fake', u'create', u'copy', u'fake', u'copy', u'fake', u'fake', u'create', u'fake', u'copy', u'fake', u'fake', u'fake', u'fake', u'fake', u'fake', u'duplicate', u'fake', u'fake', u'fake', u'fake', u'']","[u'mould', u'fashion', u'smithy', u'form', u'formulate', u'devise', u'mold', u'work', u'contrive', u'invent', u'excogitate', u'shape', u'fake', u'spurt', u'hammer', u'spirt', u'counterfeit']","['Y']","[u'loom', u'fiery furnace', u'chisel', u'carve', u'coin', u'mint', u'weave']","['N']"
"The northern and western edges of the Cotswolds are marked by steep escarpments down to the Severn valley and the Warwickshire Avon .","escarpments","[u'slopes', u'ledges', u'inclines', u'declines', u'slopes', u'cliff like ridge', u'hills', u'cliffs', u'embankments', u'cliffs', u'cliffs', u'cliffs', u'cliffs', u'cliffs', u'hills', u'hills', u'cliffs', u'rocks', u'hills', u'slopes', u'cliffs', u'cliffs', u'cliffs', u'ridges', u'bluffs ', u'rocks', u'slope', u'slope', u'hills', u'cliffs', u'hills', u'cliffs', u'bluffs', u'cliffs', u'slopes', u'ledges', u'slopes', u'cliffs', u'slopes', u'cliffs', u'cliffs', u'cliffs', u'cliffs', u'slopes', u'cliffs', u'steps', u'ridges', u'slopes', u'cliffs', u'cliffs', u'', u'']","[u'escarpment', u'scarp', u'escarp', u'protective_embankment']","['N']","[]","['N']"
"""The MTR was immediately popular with residents of Hong Kong ; as a result , subsequent lines have been built to cover more territory . There are continual debates regarding how and where to expand the MTR network .""","*immediately","[u'instantly ', u'instantly', u'instantly', u'instantly', u'instantly', u'instantly', u'rightaway', u'instantly', u'instantly', u'instantly', u'right away', u'instantly', u'at once', u'instantly', u'instantly', u'always', u'right away', u'quickly', u'right away', u'quickly', u'rapidly', u'instantly', u'instantly', u'quickly', u'instantly', u'soon', u'right away', u'instantly ', u'instantly', u'right away', u'instantly', u'really', u'instantly', u'quickly', u'instantly', u'right away', u'soon', u'soon', u'quickly', u'quickly', u'quickly', u'quickly', u'instantly', u'quickly', u'instantly', u'instantly', u'now', u'instantly', u'instantly', u'instantly', u'', u'']","[u'straightaway', u'forthwith', u'like_a_shot', u'at_once', u'straight_off', u'directly', u'right_away', u'now', u'instantly']","['Y']","[u'apace', u'briefly', u'if not sooner', u'shortly', u'presently at the first opportunity', u'in a while', u'forthwith', u'almost immediately', u'in no long time', u'quickly', u'no sooner said than done', u'directly', u'by and by', u'incontinently', u'before the ink is dry', u'speedily', u'summarily']","['Y']"
"""The toys are similar to many other small plush toys , however , each Webkinz toy has an attached tag with a unique `` Secret Code '' printed on it that allows access to the `` Webkinz World '' website .""","unique","[u'special', u'one-of-a-kind', u'different', u'special', u'special', u'special', u'exclusive', u'special', u'individual', u'different', u'one-of-a-kind', u'singular', u'special', u'special', u'special', u'special', u'special', u'personal', u'one of a kind', u'special', u'special', u'different', u'special', u'different', u'special', u'special', u'original', u'different', u'specific', u'one-of a kind', u'different', u'unusual', u'special', u'unusual', u'sepcial', u'special', u'different', u'rare', u'exclusive', u'its own', u'different', u'special', u'seperate', u'specific', u'special', u'special', u'one of a kind', u'exclusive', u'special', u'rare', u'', u'']","[u'singular', u'unequaled', u'unequalled', u'unparalleled', u'alone']","['Y']","[u'', u'class unmatched', u'singular', u'first and last', u'unrepeated', u'azygous', u'one-of-a-kind', u'odd', u'original']","['Y']"
"Yass is a prominent area for raising sheep which produce very fine wool due to the soil and climatic conditions of the Yass area .","*prominent","[u'popular', u'obvious', u'noticeable', u'known', u'popular', u'important', u'major', u'main', u'famous', u'known', u'well-known', u'huge', u'better', u'noted', u'excellent', u'known', u'big', u'important', u'major', u'popular', u'good', u'striking', u'great', u'great', u'special', u'main', u'major', u'ideal', u'obvious', u'great', u'noticable ', u'noticeable', u'noticeable', u'big', u'well-known', u'defined ', u'important', u'valuable', u'prime', u'better', u'prime', u'populat', u'remarkable ', u'large', u'famous', u'noticeable', u'important', u'grand', u'rich', u'noted', u'', u'']","[u'salient', u'spectacular', u'striking', u'big', u'outstanding', u'large']","['Y']","[u'pronounced', u'salient', u'striking', u'notable', u'signal', u'demonstrative', u'eminent', u'projecting', u'convex', u'protuberant', u'in the foreground']","['Y']"
"""It is also the only one of the former provinces of South Africa not to undergo border changes , excluding the incorporation of Bantustans .""","exclude","[u'barring', u'ignoring', u'not including', u'leaving out', u'barring', u'without', u'except', u'barring', u'minus', u'removing', u'rejecting', u'apart from', u'except for', u'besides', u'barring', u'not including', u'without', u'without', u'prohibiting', u'besides', u'not counting', u'except for', u'not including', u'except for', u'minus', u'except', u'besides', u'but not', u'except for', u'besides', u'not including', u'except', u'except for', u'short of', u'besides', u'except', u'without', u'not including', u'except', u'except', u'not including', u'except for', u'saving', u'except', u'bans', u'excepting', u'except', u'minus', u'except for', u'leaving out', u'', u'']","[u'take_out', u'keep_out', u'turf_out', u'bar', u'eject', u'debar', u'omit', u'chuck_out', u'except', u'leave_off', u'boot_out', u'turn_out', u'leave_out', u'shut', u'shut_out']","['Y']","[u'bar', u'shut out', u'get rid of', u'blackball', u'except', u'repel', u'expatriate', u'exile', u'excommunicate']","['Y']"
"""Like many Bolshevik artists , Eisenstein envisioned a new society which would subsidize artists totally , freeing them from the confines of bosses and budgets , leaving them absolutely free to create , but budgets and producers were as significant to the Soviet film industry as the rest of the world .""","envision","[u'imagined', u'imagined', u'saw', u'pictured', u'visualized', u'imagined', u'imagined', u'imagined', u'imagined', u'pictured', u'pictured', u'dreamed', u'dreamed of', u'conceptualized', u'imagined', u'imagined', u'saw', u'imagined', u'viewed', u'imagined', u'imagined', u'imagined', u'saw', u'imagined', u'imagined', u'imagined', u'saw', u'saw', u'saw', u'imagined', u'dreamed of', u'pictured', u'imagined', u'saw', u'foresaw', u'imagined', u'saw', u'dreamed of', u'thought up', u'dreamed of', u'imagined', u'imagined', u'saw', u'imagined', u'imagined', u'pictured', u'imagined', u'dreamed', u'dreamed', u'imagined', u'imagined', u'']","[u'picture', u'visualize', u'foresee', u'figure', u'visualise', u'image', u'fancy', u'project', u'see']","['N']","[u'conjure up a vision', u'visualize']","['N']"
"Jamie Farr is an American television and film actor and popular game show panelist .","panelist","[u'player', u'participant', u'judge', u'contributor', u'guest', u'host', u'member', u'guest', u'judge', u'participant', u'member', u'player', u'actor', u'host', u'player', u'participant ', u'player', u'participant', u'guest', u'host', u'contestant', u'contributor', u'person', u'member', u'host', u'participant', u'player', u'member', u'participant ', u'host', u'player', u'judge', u'contestant', u'guest', u'member', u'contestant', u'player', u'member', u'player', u'player', u'person', u'member', u'host', u'contestant', u'participant', u'guest', u'guest', u'guest', u'contestant', u'judge', u'', u'']","[u'panellist']","['N']","[]","['N']"
"""Thousands of videos exist on YouTube of users showing the original video to their friends and taping their reactions , although some videos seem to be staged .""","tap","[u'recording', u'filming', u'recording', u'recording', u'capturing', u'recording', u'recording', u'videoing', u'recording', u'recording', u'recording', u'recording', u'recording', u'recording', u'filming', u'recording', u'recording', u'filming', u'recording', u'showing', u'recorded', u'taking video of', u'recording', u'recording', u'recording', u'recording', u'recording', u'recording', u'recording', u'recording', u'recording', u'recording', u'filming video', u'recording', u'recording', u'recording', u'showing', u'capturing', u'recording', u'showing', u'recording', u'recording', u'recording', u'recording', u'recording', u'recording', u'recording', u'recording', u'recording', u'recording', u'', u'']","[u'pink', u'knock', u'hydrant', u'spigot', u'water_faucet', u'tip', u'dab', u'beg', u'water_tap', u'wiretap', u'exploit', u'intercept', u'rap', u'strike', u'pat', u'solicit', u'bug', u'tapdance']","['N']","[u'vent', u'stopcock', u'draw off', u'slap', u'dash', u'sluice', u'stroke', u'dint', u'rap', u'gully', u'bore', u'blow', u'pat', u'bung', u'ping', u'thump', u'strike', u'main', u'plug', u'funnel', u'hit', u'flap', u'dab', u'beat', u'spike', u'cork', u'snap', u'smack', u'outlet', u'chimney', u'floodgate', u'knock', u'pierce', u'perforate', u'empierce', u'spill', u'tunnel', u'spout', u'flue', u'bang', u'slam', u'drill']","['N']"
"""They renamed the place Alcante or Alcanatif which means Port of Salt , due to the old salt industry of Phoenicians and Romans .""","rename","[u'gave a new name to', u'changed the name of', u'called', u'changed', u'called', u'named', u'called', u'called', u'called', u'called', u'changed the name of', u'recalled', u'called', u'changed', u'named', u'retitled', u'called', u'changed the name of', u'called', u'changed', u'changed', u'called', u'gave another name to', u'called', u'reintroduced', u'changed', u'named', u'changed the name of', u'gave a new name to', u'named', u'changed the name of', u'named', u'called', u'remade the name of ', u'now call', u'called', u'dubbed', u'called', u'called', u'reassigned', u'called', u'named', u'named', u'changed the name of', u'changed the name of', u'called', u'called', u'called', u'changed the name of', u'changed the name of', u'', u'']","[]","['N']","[]","['N']"
"""In reference to the landscape , bush describes a wooded area , intermediate between a shrubland and a forest , generally of dry and nitrogen-poor soil , mostly grassless , thin to thick woody shrubs and bushes , under a sparse canapy of eucalypts .""","*sparse","[u'limited', u'scattered', u'small', u'thin', u'few', u'thin', u'thin', u'thin', u'thin', u'thin', u'thin', u'small', u'small', u'limited', u'small', u'limited', u'thin', u'thin', u'little', u'small', u'thin', u'thin', u'thin', u'skimpy', u'thin', u'small', u'light', u'thin', u'few', u'bare', u'thin', u'small', u'scattered', u'few', u'thin', u'thin', u'thin', u'light', u'scattered', u'limited', u'skimpy', u'thin', u'thin', u'scant', u'thin', u'bare', u'slim', u'small', u'thin', u'skimpy', u'thin', u'']","[u'thin']","['Y']","[u'dispread', u'broadcast', u'widespread', u'sporadic']","['N']"
"He was kidnapped and held by the notorious Pirate Peter Easton in Harbour Grace .","notorious","[u'infamous', u'wicked', u'famous', u'well', u'known', u'famous', u'infamous', u'famous', u'famous', u'well-known', u'infamous', u'famous', u'feared', u'infamous', u'mean', u'bad', u'famous', u'infamous', u'infamous', u'famous', u'infamous', u'infamous', u'known', u'famous', u'infamous', u'legendary', u'shameful', u'mean', u'popular', u'infamous', u'evil', u'flagrant', u'infamous', u'famous', u'infamous', u'famous', u'evil', u'infamous', u'famous', u'infamous', u'infamous', u'infamous', u'infamous', u'infamous', u'well-known', u'famous', u'evil', u'infamous', u'ill-famed', u'infamous', u'infamous', u'infamous']","[u'ill-famed', u'infamous']","['Y']","[u'well-known', u'received', u'notable', u'recognized', u'outrageous', u'ascertained', u'shocking', u'noted', u'errant']","['Y']"
