"""A `` dune field '' is an area covered by extensive sand dunes .""","*panoptic","[u'lots of', u'many', u'large', u'large', u'a lot of', u'many', u'large', u'a lot of', u'large', u'many', u'many', u'large', u'many', u'large', u'large', u'large', u'many', u'big areas of', u'many', u'numerous', u'complex', u'many', u'large', u'large ', u'many', u'huge', u'wide', u'large', u'many', u'huge', u'a lot of', u'many', u'many', u'many', u'many', u'big', u'a lot of', u'many', u'large', u'many', u'a large area', u'many', u'large', u'huge', u'huge', u'lots of', u'vast', u'major', u'large', u'many', u'', u'']","['wide@JJ', 'across-the-board@NN', 'extended@VBN', 'broad@JJ', 'blanket@NN', 'all-encompassing@NN', 'encompassing@VBG', 'all-inclusive@JJ', 'all-embracing@NN', 'extensive@JJ', 'panoptic@JJ']","['Y']"
"""107 Camilla is one of the largest main belt asteroids .""","prominent","[u'biggest', u'biggest', u'biggest', u'biggest', u'biggest', u'biggest', u'biggest', u'biggest', u'biggest', u'biggest', u'biggest', u'biggest', u'biggest', u'biggest', u'biggest', u'biggest', u'biggest', u'biggest', u'biggest', u'biggest', u'biggest', u'biggest', u'biggest', u'biggest', u'biggest', u'biggest', u'biggest', u'biggest', u'biggest', u'biggest', u'biggest', u'biggest', u'biggest', u'biggest', u'biggest', u'biggest', u'biggest', u'biggest', u'biggest', u'top', u'biggest', u'biggest', u'biggest', u'biggest', u'biggest', u'biggest', u'biggest', u'biggest', u'biggest', u'biggest', u'', u'']","['tumid@NN', 'heavy@JJ', 'great@JJ', 'bombastic@JJ', 'orotund@NN', 'gravid@NN', 'big@JJ', 'enceinte@NN', 'expectant@NN', 'large@JJ', 'turgid@NN', 'magnanimous@JJ', 'declamatory@NN', 'with_child@NN', 'prominent@NN']","['N']"
"""First mentioned by the Ancient Greek geographer Ptolemy , the pre-Christian settlement of the Saxon people originally covered an area a little more to the northwest , with parts of the southern Jutland Peninsula , Old Saxony and small sections of the eastern Low Countries .""","discussion_section","[u'parts', u'portions', u'parts', u'areas ', u'parts', u'parts', u'parts', u'areas', u'portion', u'parts', u'parts', u'parts', u'parts', u'areas', u'parts', u'parts', u'areas', u'parts', u'areas', u'parts', u'places', u'areas', u'parts', u'parts', u'parts', u'areas', u'parts', u'areas', u'parts', u'parts', u'areas', u'parts', u'parts', u'pieces', u'parts', u'parts', u'areas', u'parts', u'parts', u'areas', u'areas', u'areas', u'areas', u'parts', u'parts', u'areas', u'portions', u'areas', u'parts', u'parts', u'', u'']","['division@NN', 'surgical_incision@NN', 'subdivision@NN', 'incision@NN', 'section@NN', 'plane_section@NN', 'part@NN', 'department@NN', 'segment@NN', 'discussion_section@NN']","['N']"
"""Jeanne Demessieux had a prodigious memory : she had memorized more than 2,500 works , including the complete organ works of Johann Sebastian Bach , Csar Franck , Franz Liszt , Felix Mendelssohn and Marcel Dupr .""","prodigious","[u'huge', u'great', u'amazing', u'stunning', u'large', u'great', u'great', u'great', u'remarkable', u'big', u'big', u'great', u'impressive', u'great', u'good', u'great', u'much better than normal', u'fantastic', u'fantastic', u'great', u'great', u'great', u'great', u'very large', u'big', u'huge', u'amazing', u'great', u'remarkable', u'excellent', u'great', u'vast', u'very good', u'large', u'great', u'great', u'remarkable ', u'vast', u'great', u'big', u'excellent', u'huge', u'vast', u'fantastic', u'great', u'huge', u'impressive', u'huge', u'great', u'colossal', u'', u'']","['stupendous@JJ', 'exceptional@JJ', 'colossal@NN', 'exceeding@VBG', 'surpassing@VBG', 'olympian@JJ', 'portentous@JJ', 'prodigious@JJ']","['Y']"
"""At the end of each season , a series of playoff games are contested among the top six teams in the NFC , consisting of the four division champions and the two other teams with the best win-loss records .""","contest","[u'fought', u'played', u'played', u'played', u'argued', u'played', u'fought', u'played', u'played', u'played', u'running', u'played', u'played', u'played', u'played', u'played', u'played', u'disputed', u'fought', u'played', u'played', u'played', u'played', u'played', u'fought ', u'debated', u'played', u'played', u'engaged in', u'debated', u'played', u'played', u'played', u'played', u'played', u'argued', u'played', u'played', u'played', u'played', u'played', u'fought', u'played', u'played', u'debated', u'played', u'played', u'played', u'matched', u'', u'', u'']","['contend@NN', 'repugn@NN', 'competition@NN', 'contest@NN']","['N']"
"""Veritas and Undina would have been the largest fragments of that collision .""","fragmentise","[u'pieces', u'pieces', u'pieces', u'peices', u'rubble', u'pieces', u'pieces', u'parts', u'pieces', u'pieces', u'pieces', u'parts', u'pieces', u'parts', u'parts', u'pieces', u'parts', u'parts', u'pieces', u'pieces', u'parts', u'pieces', u'pieces', u'pieces', u'pieces', u'pieces', u'pieces', u'peices', u'parts', u'pieces', u'piece', u'pieces', u'pieces', u'pieces', u'pieces', u'pieces', u'pieces', u'pieces', u'pieces', u'parts', u'pieces', u'pieces ', u'parts', u'pieces', u'pieces', u'pieces', u'parts', u'remnants', u'parts', u'pieces', u'', u'']","['break_up@NN', 'fragment@NN', 'fragmentize@VB', 'shard@NN', 'sherd@NN', 'fragmentise@NN']","['N']"
"""After the Partitions of Poland in 1794 the area was annexed by Prussia .""","annex","[u'overtaken', u'captured', u'taken', u'added', u'given', u'taken', u'taken', u'claimed', u'captured', u'acquired', u'taken', u'united', u'added', u'added', u'taken', u'seperated', u'separated', u'added', u'taken', u'added', u'cutoff', u'taken over', u'cut off', u'seized', u'taken', u'claimed', u'taken over', u'taken over', u'taken', u'added', u'acquired', u'conquered', u'claimed', u'added', u'taken over', u'united', u'added', u'added', u'taken', u'seized', u'taken', u'adjoined', u'added', u'added', u'taken over', u'added', u'taken over', u'made permanent', u'seized', u'united', u'', u'']","['wing@VBG', 'annexe@NN', 'extension@NN', 'annex@NN']","['N']"
"""The models initially had difficulty predicting the track of the depression and the forecasts from the National Hurricane Center reflected this , indicating that the depression would move towards Texas .""","speculate","[u'showed', u'showed', u'showed', u'showed', u'mirrored', u'mirrored', u'showed', u'repeated', u'showed', u'mirrored', u'showed', u'showed', u'showed', u'showed', u'also showed', u'showed', u'showed', u'noted', u'showed', u'showed', u'showed', u'showed', u'showed', u'showed', u'showed', u'also showed', u'mirrored ', u'echoed', u'demonstrated', u'showed', u'showed', u'showed', u'showed', u'showed', u'showed', u'showed', u'showed', u'showed', u'showed', u'showed', u'showed', u'showed', u'showed', u'showed', u'showed', u'showed', u'showed', u'showed', u'showed', u'displayed', u'', u'']","['shine@NN', 'ponder@NN', 'ruminate@NN', 'mull@NN', 'muse@NN', 'think_over@NN', 'reflect@NN', 'contemplate@NN', 'meditate@NN', 'chew_over@NN', 'reverberate@NN', 'mull_over@NN', 'excogitate@NN', 'speculate@NN']","['N']"
"""A British nobleman , Lord Stanhope , took an interest in Hauser and gained custody of him late in 1831 .""","pull_ahead","[u'received', u'got', u'got', u'earned', u'got', u'obtained', u'got', u'got', u'got', u'got', u'took', u'got', u'got', u'got', u'got', u'got', u'took', u'got', u'won', u'took', u'won', u'got', u'took', u'got', u'obtained', u'got', u'got', u'got', u'had', u'got', u'granted', u'had', u'got', u'received ', u'took', u'won', u'got', u'got', u'got', u'was given', u'earned', u'got', u'aquired', u'got', u'acquired', u'gave', u'increased', u'got', u'got', u'got', u'', u'']","['win@NN', 'attain@NN', 'derive@NN', 'addition@NN', 'make@VB', 'increase@NN', 'arrive_at@NN', 'make_headway@NN', 'pull_in@NN', 'hit@NN', 'acquire@VB', 'reach@NN', 'take_in@NN', 'amplification@NN', 'gain@NN', 'put_on@NN', 'realize@VB', 'advance@NN', 'earn@NN', 'bring_in@NN', 'gain_ground@NN', 'get_ahead@NN', 'clear@JJ', 'gather@NN', 'profit@NN', 'benefit@NN', 'realise@NN', 'pull_ahead@NN']","['N']"
"""Simon Phillip Cowell is an English music executive , television producer and entrepreneur .""","enterpriser","[u'business owner', u'business owner', u'business-owner', u'businessman', u'business owner', u'businessman', u'business owner', u'promoter', u'businessman', u'businessman', u'businessman', u'businessman', u'businessman', u'business man', u'businessman', u'businessperson', u'business man', u'business owner', u'maker', u'businessmen', u'businessman', u'businessman', u'businesman', u'executive', u'businessman', u'businessman', u'buiness owner', u'business organizer', u'businessman', u'businessman', u'founder', u'salesman', u'employer', u'business owner', u'businessman', u'buisnessman', u'business owner', u'businessman', u'businessman', u'business man', u'business owner', u'businessman.', u'businessman', u'businessman', u'tycoon', u'business starter', u'business creator', u'manager', u'businessperson', u'businessman', u'', u'']","['entrepreneur@NN', 'enterpriser@NN']","['N']"
"""The remnants of the depression persisted until 2 am EDT at which time it was absorbed by a warm front .""","engulf","[u'swallowed', u'racing', u'taken-over', u'evaporated', u'stopped', u'taken up', u'removed', u'incorporated', u' immersed', u'overtaken', u'conjoined', u'consumed', u'destroyed', u'gotten rid of', u'removed', u'consumed', u'taken', u'lost', u'immersed', u'sucked up', u'consumed', u'swallowed', u'ended', u'absorbed', u'ended', u'replaced', u'taken', u'sucked up', u'eaten', u'sucked in', u'consumed', u'overtaken', u'overrun', u'soaked in', u'lost', u'taken over', u'consumed', u'taken in', u'taken in', u'consumed', u'erased', u'enveloped ', u'taken in', u'consumed', u'swallowed up', u'overcome', u'consumed', u'replacex', u'made', u'sucked up', u'', u'']","['draw@NN', 'plunge@NN', 'take_up@NN', 'immerse@NN', 'occupy@NN', 'assimilate@NN', 'absorb@NN', 'soak_up@NN', 'take_in@NN', 'engross@NN', 'imbibe@NN', 'engage@NN', 'steep@NN', 'ingest@NN', 'suck_up@NN', 'suck@NN', 'take_over@NN', 'sop_up@NN', 'engulf@NN']","['N']"
"""A good measure of notability is whether someone has been featured in multiple , independent , reliable sources .""","multiple","[u'many', u'many', u'many', u'many', u'many', u'many', u'many', u'many', u'many', u'many', u'many', u'many', u'different', u'several', u'several', u'many', u'many', u'many', u'many', u'many', u'many', u'different', u'several', u'many', u'many', u'many', u'lots of', u'many', u'several', u'several', u'many', u'different', u'several', u'many', u'many', u'several', u'several', u'many', u'a lot of', u'many', u'different', u'several', u'different', u'numerous', u'many', u'several', u'many', u'several', u'some', u'trotting', u'', u'']","['multiple@NN']","['N']"
"""It originally aired on the Fox network in the United States on October 10 , 1991 .""","publicize","[u'ran', u'played', u'was shown', u'was seen', u'played', u'shown', u'played', u'played', u'showed', u'televised', u'showed', u'was shown', u'premiered', u'was shown', u'was shown', u'played', u'showed', u'showed', u'showed', u'played', u'showed', u'showed', u'showed', u'was shown', u'shown', u'shown', u'played', u'showed', u'showed', u'was shown', u'played', u'shown', u'showed', u'showed', u'showed', u'was shown', u'was shown ', u'was shown', u'was televised', u'played', u'appeared', u'showed', u'opened', u'showed', u'appeared', u'showed', u'played', u'played', u'broadcasted ', u'played', u'', u'']","['vent@NN', 'atmosphere@RB', 'strain@NN', 'bare@NN', 'gentle_wind@NN', 'melody@NN', 'publicise@NN', 'air_out@NN', 'ventilate@NN', 'air_travel@NN', 'send@NN', 'transmit@NN', 'aerate@NN', 'melodic_phrase@NN', 'zephyr@NN', 'broadcast@NN', 'beam@NN', 'aviation@NN', 'line@NN', 'tune@NN', 'melodic_line@NN', 'air@NN', 'breeze@NN', 'aura@NN', 'airwave@NN', 'publicize@NN']","['N']"
"""Religious law is explicitly based on religious precepts .""","commandment","[u'principles', u'ideas', u'code', u'rules', u'belief', u'laws', u'doctrine', u'laws', u'ideas', u'ideas', u'beliefs', u'rules', u'rules', u'order', u'ideas', u'ideas', u'ideas', u'rules', u'beliefs', u'beliefs', u'laws', u'principles', u'examples', u'beliefs', u'thoughts', u'rules', u'rules', u'ideas', u'orders', u'teachings', u'beliefs', u'beliefs', u'ideas', u'laws', u'rules', u'tenets', u'actions', u'ideas', u'laws', u'thought', u'rules', u'concepts', u'beliefs', u'rules', u'directions', u'ideas', u'standards', u'rules', u'guidelines', u'', u'']","['precept@NN', 'teaching@VBG', 'principle@NN', 'commandment@NN']","['N']"
"""The principal greenhouse , in an art nouveau style with a modern metallic structure , resembles the mid-19th century Crystal Palace in London .""","resemble","[u'is similar to', u'looks like', u'looks-like', u'mimics', u'represents', u'looks like', u'looks like', u'looks like', u'looks like', u'matches', u'looks like', u'looks like', u'looks like', u'matches', u'looks like', u'shows', u'looks like', u'looks like', u'looks like', u'mirrors', u'looks like', u'looks like', u'looks like', u'echos', u'looks like', u'looks like', u'look like', u'looks like', u'looks like', u'looks like', u'favors', u'looks like', u'looks like', u'looks like', u'looks like', u'looks like', u'appears like', u'looks like', u'looks like', u'match', u'looks like', u'looks like', u'looks like', u'looks like', u'looks like', u'reminds one of', u'looks like', u'simulates', u'looks like', u'looks like', u'', u'']","['resemble@JJ']","['N']"
"""Metlink , formerly The Met , is the marketing body and umbrella brand for public train , tram and bus transport operators in Greater Melbourne , Victoria , Australia .""","*make","[u'maker', u'body', u'company', u'tradename', u'type', u'type', u'type', u'mark', u'company', u'company', u'company', u'company', u'name', u'type', u'company', u'type', u'branch', u'trademark', u'company', u'company', u'company', u'logo', u'name', u'name', u'label', u'sign', u'symbol', u'term', u'name', u'character', u'product', u'company', u'company', u'entity', u'symbol', u'manufacturer', u'label', u'logo', u'symbol', u'type', u'symbol', u'company', u'company', u'name', u'status', u'label', u'name', u'kind', u'label', u'name', u'', u'']","['steel@NN', 'stigmatise@NN', 'stigmatize@VB', 'brandmark@NN', 'post@NN', 'brand@NN', 'blade@NN', 'trademark@NN', 'brand_name@NN', 'denounce@NN', 'mark@NN', 'marque@NN', 'trade_name@NN', 'sword@NN', 'stigma@NN', 'stain@NN', 'firebrand@NN', 'make@VB']","['Y']"
"""On April 9 , 1919 , Miss Marcella Sherwood , who supervised the Mission Day School for Girls was bicycling round the city to close her schools when she was assaulted by a mob in a narrow street , the Kucha Kurrichhan , was beaten and left wounded .""","rape","[u'attacked', u'attacked', u'attacked', u'attacked', u'attacked', u'beaten', u'attacked', u'attacked', u'attacked', u'attacked', u'attacked', u'attacked', u'attacked', u'attacked', u'attacked', u'attacked', u'attacked', u'hurt', u'attacked', u'attacked', u'attacked', u'attacked', u'attacked', u'attacked', u'attacked', u'attacked', u'attacked', u'fought', u'attacked', u'hurt', u'attacked', u'attacked', u'attacked', u'attacked', u'beat', u'attacked', u'attacked', u'attacked', u'beat up', u'attacked', u'attacked', u'attacked', u'attacked', u'attacked', u'attacked', u'attacked', u'battered ', u'attacked', u'hurt', u'beaten', u'', u'']","['dishonour@NN', 'lash_out@NN', 'violate@NN', 'ravish@NN', 'violation@NN', 'dishonor@NN', 'Assault@NN', 'assault@NN', 'set_on@NN', 'ravishment@NN', 'outrage@NN', 'assail@NN', 'attack@NN', 'snipe@NN', 'round@NN', 'rape@NN']","['N']"
"""Schoenberg refused , saying `` I would only make you a bad Schoenberg , and you 're such a good Gershwin already . ''""","turn_down","[u'denied', u'said no', u'said no', u'denies', u'said no', u'rejected', u'declined', u""didn't"", u'denied', u'negated', u'denied', u'said no', u""wouldn't"", u'said no', u'reject', u'said no', u'rejected', u'declined', u'said no', u'declined', u'declined', u""didn't"", u'said no', u'said no', u'said no', u'said no', u'would not', u'declined', u'declined ', u'said no', u'disagreed', u'did not', u'declined', u'said no', u'denied', u'did not', u'declined', u'declined', u'declined', u'turned his back', u'declined', u'said no', u'denied', u'replied', u'denied', u'denied', u'rejected', u'declined', u'chose not to', u'said no', u'', u'']","['decline@NN', 'refuse@NN', 'deny@NN', 'garbage@NN', 'turn_away@NN', 'defy@NN', 'pass_up@NN', 'resist@NN', 'food_waste@NN', 'reject@NN', 'scraps@NNS', 'turn_down@NN']","['Y']"
"""However media outlets soon found ways around the ban , initially by the use of subtitles , but later and more commonly by the use of an actor reading his words over the images of him speaking .""","ab_initio","[u'at first', u'first', u'first', u'originally', u'first', u'usually', u'first', u'originally', u'first', u'first', u'originally', u'at first', u'first', u'at first', u'first', u'firstly', u'first', u'first', u'first', u'first', u'first', u'firstly', u'first', u'at first', u'first', u'first', u'originally', u'first', u'first', u'starting', u'first', u'at first', u'first', u'first', u'first off', u'first', u'at first', u'first', u'first', u'firstly', u'first', u'first', u'first', u'always', u'first', u'originally', u'first', u'at first', u'firstly', u'first', u'', u'']","['initially@RB', 'ab_initio@NN']","['N']"
"""However , the new king , Louis XVIII , knew that ideas of nationalism and democracy still lingered in his country ; hence the establishment and signing of the Charte constitutionnelle franaise , the French Constitution otherwise known as La Charte .""","*thence","[u'thus', u'this led to', u'so ', u'then', u'therefore', u'causing', u'so', u'thus ', u'thus', u'therefore', u'therefore', u'which lead to', u'therefore', u'thus', u'that is the reason for', u'therefore', u'since', u'so', u'thus', u'thus', u'thus', u'so', u'explaining', u'leading to', u'causing', u'thus', u'so', u'therefore', u'therefore', u'therefore', u'so', u'bringing about', u'forward', u'so', u'due to', u'from now on', u'which led to', u'thus', u'so', u'thus', u'so', u'thus', u'so', u'so', u'thus', u'so', u'so', u'so', u'therefore', u'therefore ', u'', u'']","['hence@NN', 'so@RB', 'thus@RB', 'therefore@RB', 'thence@NN']","['Y']"
"""In 1873 mine employers attempted to introduce Saturday afternoon and Sunday shifts .""","effort","[u'tried', u'tried', u'tried', u'tried', u'tried', u'tryed', u'tried', u'tried', u'tried', u'tried', u'tried', u'tried', u'tried', u'tried', u'tried', u'tried', u'tried', u'tried', u'tried', u'tried', u'tried', u'tried', u'tried', u'tried', u'tried', u'tried', u'tried', u'tried', u'tried', u'tried', u'tried', u'tried', u'tried', u'tried', u'tried', u'tried', u'tried', u'tried', u'tried', u'tried', u'tried', u'tried', u'tried', u'tried', u'tried', u'tried', u'sought', u'tried', u'tried', u'tried', u'', u'']","['essay@NN', 'attempt@NN', 'seek@NN', 'set_about@NN', 'try@NN', 'attack@NN', 'undertake@NN', 'assay@NN', 'endeavour@NN', 'endeavor@NN', 'effort@NN']","['N']"
"""He then settled in the Avon Valley , one of the most rugged and inaccessible places in the Darling Range .""","unaccessible","[u'difficult', u'impassable', u'out of reach', u'inapproachable', u'hidden', u'roadless', u'unreachable', u'off-limits', u'out of reach', u'dangerous', u'hard to reach', u'decrepit', u'hard-to-reach', u'remote', u'remote', u'hard to reach', u'hard to reach', u'hard to reach', u'unreachable', u'remote', u'isolated', u'remote', u'out-of-the-way', u'unapproachable', u'unreachable', u'remote', u'unreachable', u'unreachable', u'unreachable ', u'hard to reach', u'hard to reach', u'hard to reach', u'unreachable', u'not accessible', u'distant', u'difficult', u'hard to travel', u'unavailable', u'out of the way', u'difficult', u'limited', u'out-of-the-way', u'unapproachable', u'distant', u'hard to find', u'unreachable', u'remote', u'unavailable', u'unreachable', u'unattainable', u'', u'']","['untouchable@JJ', 'inaccessible@JJ', 'unprocurable@JJ', 'unobtainable@JJ', 'unaccessible@JJ']","['N']"
"""The central planets are firmly under Alliance control , but the outlying planets and moons resemble the 19th century American West , with little governmental authority .""","outlying","[u'outer', u'surrounding', u'far', u'outer', u'distant', u'outer', u'remote', u'farthest', u'outer', u'outer', u'distant', u'outer', u'outer', u'more distant', u'outer', u'further away', u'outer', u'backwoods', u'outer', u'far out', u'surrounding', u'outer', u'far off', u'distant', u'other', u'far away', u'further', u'distant', u'far', u'distant', u'outer', u'more distant', u'outer', u'distant', u'outer ', u'remote', u'outer', u'outer', u'distant', u'outer', u'outer', u'outer', u'furthest', u'outer', u'farther', u'distant', u'distant', u'outer', u'distant', u'outer', u'', u'']","['outlying@VBG']","['N']"
"""In 1639 , Williams established a Baptist church in Providence , Rhode Island , and Clarke began a Baptist church in Newport , Rhode Island .""","ground","[u'completed', u'started', u'founded', u'created', u'started', u'made', u'set up', u'built', u'began', u'founded', u'founded', u'began', u'started', u'started', u'started', u'made', u'started', u'created', u'created', u'started', u'started', u'founded', u'started', u'started', u'made', u'created', u'made', u'owns', u'made', u'started', u'started', u'started', u'created', u'made', u'started', u'began', u'built', u'started', u'founded', u'started', u'founded', u'created', u'made', u'started', u'started', u'started', u'started', u'started', u'created', u'created', u'', u'']","['plant@NN', 'give@VB', 'lay_down@NN', 'launch@NN', 'institute@NN', 'make@VB', 'prove@NN', 'set_up@NN', 'instal@NN', 'constitute@NN', 'shew@NN', 'base@NN', 'build@NN', 'install@NN', 'demonstrate@NN', 'show@NN', 'found@NN', 'establish@VB', 'ground@NN']","['N']"
"""While each edition of Windows 2000 was targeted to a different market , they share a core set of features , including many system utilities such as the Microsoft Management Console and standard system administration applications .""","inwardness","[u'basic', u'basic', u'main', u'base', u'center', u'main', u'basic', u'basic', u'main', u'base', u'common', u'common', u'base', u'main', u'base', u'base', u'basic', u'basic', u'basic', u'similair', u'common', u'main', u'kernal', u'central', u'same', u'similar', u'basic', u'center', u'basic', u'main', u'main', u'basic', u'basic', u'central', u'standard', u'central', u'main', u'base', u'main', u'common', u'same', u'basic', u'basic', u'important', u'basic', u'basic', u'basic', u'base', u'basic', u'fundamental', u'', u'']","['kernel@NNS', 'heart_and_soul@NN', 'heart@NN', 'nitty-gritty@JJ', 'essence@NN', 'nub@NN', 'sum@NN', 'core_group@NN', 'core@NN', 'gist@NN', 'centre@NN', 'effect@NN', 'magnetic_core@NN', 'nucleus@NN', 'burden@NN', 'marrow@NN', 'Congress_of_Racial_Equality@NN', 'CORE@NN', 'meat@NN', 'substance@NN', 'center@NN', 'pith@NN', 'inwardness@NN']","['Y']"
"""The first conflict between the British and the Marathas was the First Anglo-Maratha War which began in 1774 and resulted in the 1782 treaty of Salbai , by which the island of Salsette , adjacent to Bombay island , was ceded to the British , while Bharuch was ceded to the Maratha ruler Scindia .""","side_by_side","[u'next to', u'next', u'next', u'connected', u'across', u'close', u'next', u'next to', u'next', u'bordering', u'next to', u'next to', u'next', u'next', u'near', u'next', u'next', u'next', u'next to', u'next', u'right next', u'next to', u'next to', u'next', u'next ', u'next', u'next', u'next', u'next', u'next ', u'next', u'right next', u'next', u'next', u'next', u'next', u'next door', u'next', u'next', u'next', u'close', u'next to', u'next to', u'next to', u'next to', u'next to', u'next', u'next ', u'next', u'next', u'', u'']","['neighboring@VBG', 'contiguous@JJ', 'next@JJ', 'conterminous@JJ', 'adjacent@NN', 'side_by_side@NN']","['Y']"
"""OpenOffice.org Calc is the spreadsheet component of the OpenOffice.org software package .""","*ingredient","[u'part', u'part', u'piece', u'part', u'part', u'part ', u'part', u'part', u'piece', u'piece', u'part', u'part', u'part', u'part', u'segment', u'part', u'software', u'element', u'part', u'equal', u'part', u'part', u'part', u'part', u'part', u'part', u'tool', u'part', u'part', u'part', u'part', u'part', u'part', u'part', u'part', u'part', u'part', u'part', u'element', u'part', u'part', u'piece', u'part', u'part', u'part', u'part', u'part', u'section', u'part', u'part', u'', u'']","['component_part@NN', 'component@NN', 'element@NN', 'portion@NN', 'part@NN', 'factor@NN', 'constituent@NN', 'ingredient@NN']","['Y']"
"""The Countess tells him it is only Susanna , trying on her wedding dress .""","narrate","[u'told', u'told', u'says to', u'tells', u'says to', u'informs', u'tells', u'informs', u'says to', u'says to ', u'says to', u'informs', u'told', u'bids', u'told', u'says to', u'told', u'warns', u'lets him know', u'says to', u'explains', u'informs', u'say to', u'says to', u'says to', u'says', u'told', u'says to', u'said to', u'informs', u'says to', u'advises', u'informs', u'said to him', u'advices', u'explains', u'says', u'says to', u'advises', u'told', u'informs', u'told', u'said to', u'says to', u'says to', u'states to', u'informs', u'says to', u'says to', u'informs', u'', u'']","['recite@NN', 'secernate@NN', 'severalise@NN', 'evidence@NN', 'William_Tell@NNP', 'severalize@VB', 'enjoin@NN', 'say@VB', 'Tell@VB', 'assure@NN', 'state@NN', 'secern@NN', 'tell_apart@NN', 'differentiate@NN', 'separate@JJ', 'recount@NN', 'distinguish@NN', 'order@NN', 'tell@NN', 'narrate@NN']","['N']"
