"""Gr_nberg and Fert have received a number of prestigious prizes and awards for their discovery and contributions to the field of spintronics including the 2007 Nobel Prize in Physics .""","encounter","[u'gotten', u'gotten', u'accepted', u'won', u'earned', u'been given', u'gotten', u'been given', u'gotten', u'been given', u'gotten', u'won', u'gotten', u'taken', u'gotten', u'accepted', u'accepted', u'got', u'got', u'gotten', u'gotten', u'collected', u'won', u'gotten', u'earned', u'gotten', u'won', u'gotten', u'gotten', u'gotten', u'gotten', u'gotten', u'gotten', u'earned', u'been given', u'been given', u'gotten', u'accepted', u'been given', u'accepted', u'been given', u'earned', u'gotten', u'gotten', u'gotten', u'earned', u'got', u'won', u'gotten', u'won', u'', u'']","['pick_up@NN', 'invite@NN', 'get@VB', 'receive@NN', 'welcome@NN', 'obtain@VB', 'experience@NN', 'incur@NN', 'take_in@NN', 'have@VB', 'meet@NN', 'find@VB', 'encounter@NN']","['N']"
"""During their trip , Aras and Cirie made a pact for the Final 2 ; while Danielle and Terry also conspired for their fate in the game during their time on exile .""","conjure","[u'plotted', u'thought up', u'plotted', u'plotted', u'planned', u'planned', u'planned', u'plotted', u'cooperated', u'planned', u'plotted', u'planned', u'planned', u'co-operated', u'plotted', u'worked together', u'plotted', u'plotted', u'planned', u'running', u'planned', u'cooperated', u'plotted', u'planned', u'plotted', u'discussed', u'planned secretly', u'plotted', u'planned', u'helped plan', u'planned', u'schemed', u'made secret plans', u'planned', u'planned', u'united', u'worked together', u'planned', u'were in cahoots', u'thought', u'planned', u'planned', u'plotted', u'cooperated', u'planned', u'planned', u'plotted ', u'united', u'secretly planned', u'plotted', u'', u'']","['collude@NN', 'cabal@NN', 'machinate@NN', 'conspire@NN', 'complot@NN', 'conjure@NN']","['N']"
"""Gorgoneia that decorate the shields of warriors on mid-5th century Greek vases are considerably less grotesque and menacing .""","menace","[u'scary', u'scary', u'threatening', u'scary', u'scary', u'scary', u'threatening', u'frightening', u'scary', u'frightening', u'threatening', u'scary', u'scary', u'mean looking', u'threatening', u'scary looking', u'scary', u'scary', u'threatening', u'scary', u'mean', u'threatening', u'scary', u'frightening', u'scary', u'scary', u'scary', u'scary', u'scary', u'scary', u'mean', u'scary', u'scary ', u'scary', u'dangerous', u'scary', u'scary', u'scary', u'scary', u'scary', u'threatening', u'scary', u'frightening', u'scary', u'threatening', u'scary', u'mean', u'intimidating', u'alarming', u'troublesome', u'', u'']","['jeopardise@NN', 'peril@NN', 'jeopardize@NN', 'imperil@NN', 'threat@NN', 'endanger@NN', 'threaten@NNS', 'menace@NN']","['N']"
"""Charon , discovered in 1978 at the United States Naval Observatory Flagstaff Station , is the largest satellite of the dwarf planet Pluto . Following the 2005 discovery of two other natural satellites of Pluto , Charon may also be referred to as Pluto I. The New Horizons mission is scheduled to visit Charon and Pluto in July 2015 .""","artificial_satellite","[u'moon', u'dish', u'moon', u'satellite', u'moon', u'outer', u'moon', u'moon', u'moon', u'picture', u'moon', u'moon', u'moon', u'moon', u'nearest planet', u'moon', u'moon', u'orbiting bod', u'orbit', u'moon', u'orbiting body', u'orbiting object', u'moon', u'object', u'moon', u'asteroid', u'moon', u'space station', u'rotating body', u'moon', u'moon', u'moon', u'object', u'follower', u'moon', u'piece', u'moon', u'revolver', u'moon', u'moon', u'object', u'moon', u'moon', u'space station', u'moon', u'moon', u'moon', u'moon', u'asteroid', u'', u'', u'']","['planet@NN', 'satellite@NN', 'orbiter@NN', 'artificial_satellite@NN']","['Y']"
"""They are typically specified to withstand an impact of 3600 g and temperatures of over 1,000 C .""","typically","[u'normally', u'usually', u'usually', u'usually', u'normally', u'usually', u'frequently', u'usually', u'normally', u'usually', u'commonly', u'usually', u'usually', u'usually', u'usually', u'normally', u'normally', u'normally', u'usually', u'usually', u'almost always', u'usually ', u'usually', u'normally', u'usually', u'usually', u'normally', u'usually', u'usually', u'usually', u'normally', u'usually', u'usually', u'usually', u'usually', u'normally', u'usually', u'usually', u'commonly ', u'almost always', u'usually', u'usually', u'usually', u'usually', u'usually', u'normally', u'usually', u'usually', u'normally', u'normally ', u'', u'']","['typically@RB']","['N']"
"""If K rei did exist , there is no evidence to suggest that the title tenn was used during the time period to which his reign has been assigned .""","grounds","[u'proof', u'proof', u'data', u'proof', u'proof', u'proof', u'proof', u'proof', u'clue', u'sign', u'proof', u'proof', u'proof', u'proof', u'proof', u'proof', u'proof', u'proof', u'clue', u'proof', u'proof', u'proof', u'proof', u'proof', u'proof', u'proof', u'proof', u'proof', u'proof', u'proof', u'proof', u'information', u'proof', u'proof', u'information', u'proof  ', u'proof', u'proof', u'proof', u'clue', u'proof', u'proof', u'proof', u'proof', u'proof', u'proof', u'information', u'proof', u'proof', u'proof', u'', u'']","['attest@NN', 'prove@NN', 'certify@NN', 'testify@NN', 'manifest@JJS', 'show@NN', 'demonstrate@NN', 'evidence@NN', 'tell@NN', 'bear_witness@NN', 'grounds@NNS']","['N']"
"""Once a flourishing Saxon riverport , it lies in the Waveney valley and is a popular boating center .""","lie_down","[u'is', u'is', u'is', u'sits', u'is', u'stis', u'is', u'sits', u'is located', u'is', u'is', u'is', u'is', u'is', u'sits', u'is', u'sits', u'is ', u'rests', u'is located', u'sits', u'is in', u'is', u'sits', u'is', u'is', u'sits', u'is', u'is found', u'stands', u'is', u'is located', u'is', u'sits', u'sits', u'is', u'rests', u'is found', u'is', u'sits', u'is situated', u'sits', u'sits', u'sits', u'rests', u'is', u'is', u'is', u'is located', u'is', u'', u'']","['prevarication@NN', 'lie@NN', 'Trygve_Halvden_Lie@NN', 'consist@NN', 'Lie@NN', 'Trygve_Lie@NN', 'lie_in@NN', 'rest@NN', 'dwell@NN', 'lie_down@NN']","['N']"
"""The circuit cost approximately US $ 150 million to construct .""","*reconstruct","[u'make', u'build', u'build', u'build', u'build', u'build', u'build', u'build', u'build', u'build', u'build', u'build', u'build', u'build', u'build', u'build', u'build', u'build', u'make', u'build', u'build', u'build', u'build', u'build', u'build', u'build', u'build', u'build', u'build', u'build', u'build', u'build', u'build', u'build', u'make', u'build', u'build', u'build', u'make', u'build', u'build', u'build', u'build', u'make', u'build', u'make', u'build', u'make', u'make', u'build', u'', u'']","['manufacture@NN', 'concept@NN', 'conception@NN', 'fabricate@NN', 'retrace@NN', 'make@VB', 'construct@NN', 'build@NN', 'reconstruct@NN']","['Y']"
"""A page that is a redirect can be moved like any other page .""","incite","[u'changed', u'pushed', u'evicted', u'transferred', u'changed', u'transferred', u'relocated', u'shifted', u'changed', u'sent', u'changed', u'changed for where it is', u'moved', u'shifted', u'changed', u'relocated', u'used', u'changed', u'changed', u'put somewhere else', u'changed', u'put somewhere else', u'changed', u'tranferred', u'changed', u'moved', u'changed', u'changed', u'shifted', u'extracted', u'transferred', u'changed', u'changed', u'carried', u'changed', u'changed', u'replaced', u'sent', u'sent', u'placed', u'changed', u'shifted', u'relocated', u'redirected', u'rearranged', u'changed', u'put in another place', u'relocated', u'transitioned', u'changed', u'', u'']","['prompt@NN', 'propel@NN', 'move@NN', 'actuate@NN', 'go@VB', 'proceed@NN', 'travel@NN', 'motivate@NN', 'relocation@NN', 'be_active@NN', 'strike@NN', 'motility@NN', 'run@VB', 'impress@NN', 'displace@NN', 'locomote@NN', 'affect@NN', 'make_a_motion@NN', 'motion@NN', 'act@NN', 'movement@NN', 'incite@NN']","['N']"
"""Then Cogswell asked Gallaudet to travel to Europe to study methods for teaching deaf students , especially those of the Braidwood family in Edinburgh , Scotland .""","*trip","[u'go', u'go', u'go', u'go', u'go', u'go', u'go', u'go', u'go with him ', u'go', u'go', u'fly', u'go', u'go', u'go', u'come', u'journey', u'go', u'move', u'explore', u'go', u'go', u'go', u'move', u'go', u'go', u'go', u'come', u'go', u'go', u'move', u'go', u'go', u'go', u'go to', u'go', u'go', u'go', u'go with him', u'go', u'go', u'go ', u'go', u'fly', u'go', u'go', u'go', u'go', u'go', u'go', u'', u'']","['change_of_location@NN', 'move_around@NN', 'travel@NN', 'move@NN', 'jaunt@NN', 'journey@NN', 'locomote@NN', 'traveling@VBG', 'go@VB', 'locomotion@NN', 'travelling@VBG', 'trip@NN']","['Y']"
"""He is widely known for his roles as Little Joe Cartwright in Bonanza , Charles Ingalls in Little House on the Prairie , and Jonathan Smith in Highway to Heaven .""","widely","[u'well', u'well', u'largely', u'mostly', u'well', u'well', u'largely', u'majorly', u'famously', u'mostly', u'well ', u'well', u'extensively', u'well', u'mostly', u'famously', u'well', u'well', u'broadly', u'mostly', u'often', u'mostly', u'mostly', u'well', u'well', u'well', u'commonly', u'generally', u'commonly', u'mostly', u'well', u'well', u'well', u'popularly', u'largely', u'commonly', u'commonly', u'well', u'broadly', u'well', u'mostly', u'often', u'commonly', u'popularly', u'well', u'commonly', u'generally', u'commonly', u'commonly', u'well', u'', u'']","['wide@JJ', 'widely@RB']","['N']"
"""Since Minamoto no Yoritomo launched the shogunate , the true power had been in the hand of the Shoguns , who were mistaken several times for the Emperors of Japan by the Chinese government .""","launching","[u'began', u'began', u'started', u'began', u'introduced', u'started', u'started', u'started', u'started', u'started', u'began', u'projected', u'started', u'released', u'began', u'started', u'started', u'made', u'started', u'started', u'started', u'started', u'began', u'started', u'created', u'started', u'started ', u'started', u'started', u'started', u'started', u'started', u'began', u'produced', u'started', u'began', u'started', u'started', u'introduced', u'created', u'begun', u'started', u'began', u'started', u'released', u'set off', u'started', u'started', u'started', u'founded', u'', u'']","['plunge@NN', 'launch@NN', 'set_up@NN', 'set_in_motion@NN', 'found@NN', 'establish@VB', 'launching@VBG']","['N']"
"""Swiss cheese is a generic name common to many countries for several related varieties of cheese which resemble the Swiss Emmental .""","resemble","[u'look like', u'looks like', u'is similar to', u'are similar to', u'look like', u'look like', u'imitate', u'lookalike', u'are like', u'mimics', u'match', u'look like', u'looks like', u'look like', u'look like', u'remind', u'look like', u'look like', u'look like', u'are like', u'look like', u'are like', u'look like', u'look like ', u'look like', u'looks like', u'are like', u'look like', u'are like', u'matches', u'mimic', u'favor', u'look like', u'looks like', u'are like', u'look like', u'look like', u'mirror', u'are like', u'look like', u'mirror', u'are similar to ', u'looks like', u'look like', u'are like', u'look like', u'look like', u'look like', u'look like', u'looks like', u'', u'']","['resemble@JJ']","['N']"
"""Several of these tropical cyclones have caused deaths or heavy property damage , usually due to flooding caused by rain .""","grounds","[u'from', u'made', u'produced', u'made', u'lead', u'after', u'brought about', u'made', u'generated', u'created', u'from', u'made', u'made', u'started', u'started', u'made', u'made ', u'made', u'from the effect', u'made', u'made', u'started', u'made', u'brought', u'started', u'created', u'made happen', u'from', u'produced ', u'created', u'brought on', u'brought on ', u'brought on', u'began', u'made', u'flooding from rain', u'brought', u'created', u'set off', u'started', u'created ', u'created', u'made', u'developed', u'made', u'began', u'because of', u'made', u'made', u'induced', u'', u'']","['case@NN', 'do@VB', 'campaign@NN', 'get@VB', 'effort@NN', 'make@VB', 'drive@NN', 'causal_agency@NN', 'reason@NN', 'lawsuit@NN', 'induce@NN', 'have@VB', 'suit@NN', 'causa@NN', 'causal_agent@NN', 'movement@NN', 'cause@NN', 'stimulate@NN', 'crusade@NN', 'grounds@NNS']","['N']"
"""Through these feedback processes , the cryosphere plays a significant role in global climate and in climate model response to global change .""","pregnant","[u'noteworthy', u'main', u'big', u'important', u'major', u'important', u'important', u'big', u'large', u'important', u'important', u'serious', u'important', u'important', u'important', u'important', u'major', u'big', u'major', u'important', u'big', u'large', u'important', u'major', u'major', u'important', u'large', u'important', u'big', u'big', u'large ', u'major', u'important', u'large', u'key', u'big', u'important', u'large', u'big', u'important', u'important', u'major', u'important', u'big', u'major', u'important', u'important', u'certain', u'major', u'major', u'', u'']","['meaning@NN', 'important@JJ', 'substantial@JJ', 'significant@JJ', 'pregnant@NN']","['Y']"
"""About 20 % of patients with acute ischemic colitis may develop a long-term complication known as chronic ischemic colitis .""","*explicate","[u'get', u'get', u'get', u'get', u'get', u'get', u'make', u'gain', u'create', u'get', u'get', u'create', u'get', u'get', u'have', u'gain', u'cause', u'get', u'get', u'get', u'grow', u'turn in to', u'get', u'get', u'grow', u'get', u'get', u'become', u'grow', u'get', u'get', u'make', u'get', u'get', u'get', u'get', u'get', u'get', u'get', u'create', u'have', u'create', u'begin to have', u'get', u'get', u'foster', u'acquire', u'get', u'show', u'have', u'', u'']","['formulate@NN', 'uprise@NN', 'spring_up@NN', 'arise@NN', 'modernize@VB', 'educate@NN', 'develop@VB', 'prepare@NN', 'modernise@NN', 'germinate@NN', 'make_grow@NN', 'evolve@NN', 'rise@NN', 'get@VB', 'acquire@VB', 'break@NN', 'train@NN', 'grow@NN', 'originate@NN', 'build_up@NN', 'recrudesce@NN', 'produce@NN', 'explicate@NN']","['Y']"
"""Fiction Records is a UK formerly indie label , now wholly owned by Polydor a subsidiary of Universal Music Group , started by Chris Parry in 1978 that is best known as being the home of The Cure for over 20 years .""","possess","[u'held', u'ran', u'possessed ', u'bought', u'held', u'gained', u'purchased', u'controlled', u'maintained', u'had', u'controlled', u'had', u'bought', u'belonging to', u'held', u'controlled', u'absorbed', u'bought', u'bought', u'held', u'controlled', u'belonging to', u'held', u'possessed ', u'possessed ', u'belonged to', u'kept', u'bought', u'bought', u'held', u'controlled ', u'bought', u'held', u'a part of', u'kept', u'purchased', u'bought', u'held', u'held', u'held', u'held', u'kept', u'controlled', u'bought', u'belongs to', u'held', u'belonging to', u'ran', u'used', u'run', u'', u'']","['ain@NN', 'own@JJ', 'have@VB', 'possess@NN']","['N']"
"""Alexander Stepanovich Popov was a Russian physicist who first demonstrated the practical application of electromagnetic waves , although he did not apply for a patent for his invention .""","present","[u'showed the world', u'showed', u'showed', u'showed', u'showed', u'shown', u'showed', u'showed', u'showed', u'performed', u'showed', u'showed', u'showed', u'showed', u'showed', u'showed', u'showed', u'showed', u'showed', u'showed', u'showed', u'showed', u'showed', u'showed', u'showed', u'showed', u'showed', u'displayed', u'showed', u'showed', u'showed', u'showed', u'showed', u'showed', u'showed', u'showed', u'showed', u'showed', u'showed', u'showed', u'showed', u'showed', u'showed', u'showed everyone', u'showed', u'showed', u'showed', u'showed', u'showed', u'showed', u'', u'']","['exhibit@NN', 'attest@NN', 'certify@NN', 'march@NN', 'prove@NN', 'demo@NN', 'show@NN', 'manifest@JJS', 'shew@NN', 'demonstrate@NN', 'evidence@NN', 'establish@VB', 'present@NN']","['N']"
"""In nature , there is a strong evolutionary pressure for animals to blend into their environment or conceal their shape ; for prey animals to avoid predators and for predators to be able to sneak up on prey .""","*hold_back","[u'hide', u'hide', u'hide', u'hide', u'hide', u'hide', u'hide', u'hide', u'hide', u'hide', u'hide', u'hide', u'hide', u'hide', u'hide', u'hide', u'hide', u'hide', u'hide', u'hide', u'hide', u'hide', u'hide', u'hide', u'hide', u'hide', u'hide', u'hide', u'hide', u'hide', u'hide', u'hide', u'hide', u'hide', u'hide', u'disguise', u'hide', u'hide', u'hide', u'hide', u'hide', u'hide', u'hide', u'hide', u'hide', u'hide', u'hide', u'hide', u'hide', u'hide', u'', u'']","['conceal@NN', 'hold_in@NN', 'hide@NN', 'hold_back@NN']","['Y']"
"""In Switzerland , the constitutional ban on absinthe was repealed in 2000 during an overhaul of the national constitution , although the prohibition was written into ordinary law instead .""","ban","[u'restriction', u'constraint', u'prevention', u'ban', u'refusal', u'ban', u'ban', u'ban', u'limit', u'ban', u'laws against drinking', u'ban', u'ban', u'rule', u'ban', u'refusal', u'ban', u'ban', u'ban', u'ban', u'ban', u'ban', u'forbidding law', u'ban', u'banning', u'law against it', u'ban', u'ban', u'ban', u'prevention', u'ban', u'ban', u'ban', u'ban', u'ban', u'ban', u'ban', u'act', u'restriction', u'restriction', u'ban', u'ban', u'ban', u'restriction', u'allowance', u'banning', u'ban', u'refusal', u'law', u'', u'']","['proscription@NN', 'forbiddance@NN', 'prohibition_era@NN', 'prohibition@NN', 'inhibition@NN', 'ban@NN']","['N']"
"""One theory suggests that the source of the name is an ancient Finnic language , in which it means `` dark '' and `` turbid '' .""","cloudy","[u'goth', u'heavy', u'angry', u'unclear', u'cloudy', u'dense', u'thick', u'unclear', u'cloudy', u'muddy', u'murky', u'murky', u'cloudy', u'thick', u'dense', u'heavy', u'thick', u'dense', u'cloudy', u'unclear', u'dingy', u'cloudy', u'confused', u'unclear', u'hazzy', u'cloudy', u'foggy', u'thick', u'foul', u'unclear', u'cloudy', u'moving', u'murky', u'thick', u'dense', u'troubled', u'murky', u'clouded', u'cloudy', u'muddy', u'thick', u'cloudy', u'dense', u'cloudy', u'confused', u'unclear', u'obscured', u'cloudy', u'unclear', u'', u'']","['murky@NN', 'muddy@NN', 'turbid@NN', 'mirky@NN', 'cloudy@NN']","['Y']"
"""The geological composition of rock and soil dictates the type of shore which is created .""","dictate","[u'reveils', u'governs ', u'tells us', u'causes', u'says', u'indicates', u'decides', u'shows', u'decides', u'directs', u'decides', u'decides', u'decides', u'determines', u'determines', u'decides', u'causes', u'determines', u'shows', u'determines', u'chooses', u'determines', u'decides', u'controls', u'rules', u'shows', u'controls', u'causes', u'determines', u'decides', u'guides', u'tells', u'tells', u'decides', u'determines', u'determines', u'orders', u'tells', u'decides', u'determines', u'shows', u'leads to', u'commands', u'indicates', u'tells', u'shows', u'determines', u'directs', u'determines', u'decides', u'', u'']","['prescribe@NN', 'order@NN', 'dictate@NN']","['N']"
"""He held the imperial seal and could convene all other viziers to attend to affairs of the state ; the viziers in conference were called `` Kubbealt viziers '' in reference to their meeting place , the Kubbealt in Topkap Palace .""","convene","[u'gather', u'summon', u'tell', u'gather', u'combine', u'meet', u'call on', u'call', u'call', u'call', u'call', u'gather', u'get', u'assemble', u'call', u'gather', u'bring together', u'bring together', u'tell', u'gather', u'gather', u'gather', u'gather', u'call together', u'gather', u'begin', u'summon', u'gather', u'rally', u'meet', u'call', u'bring together', u'call together', u'meet', u'call', u'bring', u'gather', u'gather', u'call', u'call', u'call', u'get', u'gather', u'order', u'assemble', u'gather', u'come together', u'call', u'meet', u'gather', u'', u'']","['convoke@NN', 'convene@NN']","['N']"
"""Combining their observations with thermal measurements taken in November 2000 , the team estimated the size of the components of the system .""","observation","[u'findings', u'notes', u'thoughts', u'information', u'visions', u'findings', u'views', u'views', u'reviews', u'fidings', u'viewing', u'information', u'notes of what they saw', u'views', u'findings', u'findings', u'views', u'findings', u'data', u'findings', u'conclusions', u'views', u'notes', u'notes', u'attention', u'data', u'findings', u'views', u'findings', u'notes', u'findings', u'notes', u'what they saw', u'watchings', u'information', u'views', u'findings', u'thoughts', u'recordings', u'studies', u'notes', u'views', u'views', u'data', u'findings', u'studies', u'reports', u'interpretations', u'studies', u'notes', u'', u'']","['notice@NN', 'observance@NN', 'reflection@NN', 'watching@VBG', 'reflexion@NN', 'observation@NN']","['N']"
"""Many Beijing office towers were evacuated , including the building housing the media offices for the organizers of the 2008 Summer Olympics .""","towboat","[u'buildings', u'buildings', u'buildings', u'spires', u'buildings', u'buildings', u'buildings', u'buildings', u'buildings', u'buildings', u'buildings', u'buildings', u'buildings', u'buildings', u'buildings', u'buildings', u'buildings', u'buildings', u'buildings', u'buildings', u'buildings', u'buildings', u'buildings', u'buildings', u'towers', u'buildings', u'buildings', u'buildings', u'buildings', u'buildings', u'buildings ', u'buildings', u'high rises', u'buildings', u'buildings', u'buildings', u'buildings', u'buildings', u'buildings', u'buildings', u'buildings', u'buildings', u'buildings', u'high rises', u'spires', u'buildings', u'skyscrapers', u'buildings', u'buildings', u'buildings', u'', u'']","['tugboat@NN', 'loom@NN', 'column@NN', 'pillar@NN', 'hulk@NN', 'predominate@NN', 'tower@NN', 'tug@NN', 'towboat@NN']","['N']"
"""The sculpture was made from the same weathering steel as the Angel of the North sculpture , which gradually develops a tightly adhering oxide layer as it is exposed to the elements .""","bit_by_bit","[u'slowly', u'slowly', u'slowly', u'slowly', u'slowly', u'slowly', u'slowly', u'slowly', u'slowly', u'slowly', u'slowly', u'eventually', u'slowly', u'over time', u'slowly', u'slowly', u'slowly', u'slowly', u'slowly', u'slowly', u'then', u'slowly', u'slowly', u'slowly', u'slowly', u'slowly', u'over time', u'slowly', u'slowly', u'slowly', u'slowly', u'slowly', u'slowly', u'slowly', u'slowly', u'steadily', u'over time', u'slowly', u'steadily', u'slowly', u'slowly', u'slowly', u'slowly', u'slowly', u'slowly', u'fastly', u'slowly', u'eventually', u'slowly', u'slowly', u'', u'']","['gradually@RB', 'step_by_step@NN', 'bit_by_bit@NN']","['N']"
"""Valzacchi and Annina now offer their services to him .""","help","[u'work', u'assitance', u'help', u'help', u'jobs', u'work', u'help', u'help', u'help', u'business', u'help', u'work', u'help', u'help', u'help', u'business', u'help', u'help', u'skills', u'skills', u'help', u'help', u'abilities', u'help', u'help', u'talents', u'assistance', u'help', u'work', u'help', u'abilities', u'business', u'work', u'offers', u'work', u'aid', u'labor', u'help', u'help', u'assistance', u'help', u'help', u'expertise ', u'labor', u'aid', u'help', u'work', u'work', u'work', u'', u'']","['avail@NN', 'serving@VBG', 'overhaul@NN', 'service@NN', 'Service@NNP', 'divine_service@NN', 'Robert_William_Service@NN', 'inspection_and_repair@NN', 'serve@NN', 'table_service@NN', 'religious_service@NN', 'service_of_process@NN', 'servicing@VBG', 'armed_service@NN', 'military_service@NN', 'help@NN']","['N']"
"""Because carbon dioxide is released at a faster rate through the acid-base reaction than through fermentation , breads made by chemical leavening are called quick breads .""","waiver","[u'freed', u'discharged ', u'freed', u'put out', u'let-go', u'freed', u'given off', u'created', u'let out', u'let go', u'issued', u'let go', u'exposed', u'let go', u'let go', u'freed', u'let go', u'dispensed', u'let out', u'let go', u'mades', u'let go', u'let go', u'let out', u'moved', u'let go', u'made', u'let out', u'let go', u'launched', u'sent out', u'freed', u'expelled', u'let go', u'given out', u'let go', u'produced', u'given off', u'freed', u'freed', u'let go', u'discharged', u'let go', u'let go', u'let go', u'let go', u'dispersed', u'let out', u'put out', u'freed', u'', u'']","['freeing@VBG', 'secrete@NN', 'tone_ending@VBG', 'vent@NN', 'bring_out@NN', 'unloose@JJ', 'sack@NN', 'exhaust@NN', 'unblock@NN', 'unloosen@NN', 'put_out@NN', 'dismissal@NN', 'expel@NN', 'publish@NN', 'liberation@NN', 'going@VBG', 'exit@NN', 'spillage@NN', 'issue@NN', 'let_go_of@NN', 'give_up@NN', 'sacking@VBG', 'press_release@NN', 'loose@JJ', 'free@JJ', 'let_go@NN', 'outlet@NN', 'discharge@NN', 'relinquish@NN', 'loss@NN', 'acquittance@NN', 'eject@NN', 'spill@NN', 'resign@NN', 'liberate@NN', 'button@NN', 'firing@VBG', 'departure@NN', 'handout@NN', 'turn@NN', 'unfreeze@NN', 'expiration@NN', 'release@NN', 'passing@NN', 'dismission@NN', 'waiver@NN']","['N']"
"""Many publications , such as the Suikoden World Guide and Suikoden Encyclopedia , exist for the Suikoden series , though the majority are only in Japanese .""","*survive","[u'are', u'are there', u'are', u'are available', u'live', u'are there', u'made', u'live', u'are', u'are', u'occur', u'are', u'are', u'are', u'are', u'are', u'live', u'are', u'can be used', u'are', u'are', u'remain', u'are', u'are like', u'are', u'continue', u'occur', u'are there', u'are there', u'happen', u'occur', u'are available', u'are', u'live', u'are around', u'are', u'live', u'are present', u'live', u'are', u'remain', u'are', u'are', u'live', u'live', u'are', u'occur', u'remained', u'go', u'', u'']","['be@VB', 'live@JJ', 'exist@NN', 'subsist@NN', 'survive@NN']","['Y']"
