"He aided the Doukhobors in migrating to Canada .","aid","[u'helped', u'helped', u'helped', u'helped', u'helped', u'helped', u'helped', u'helped', u'helped', u'helped', u'helped', u'helped', u'helped', u'helped', u'helped', u'helped', u'helped', u'helped', u'helped', u'helped', u'helped', u'helped', u'helped', u'helped', u'helped', u'helped', u'helped', u'helped', u'helped', u'helped', u'helped', u'helped', u'helped', u'helped', u'helped', u'helped', u'helped', u'helped', u'helped', u'helped', u'helped', u'helped', u'helped', u'helped', u'helped', u'helped', u'helped', u'helped', u'helped', u'helped', u'', u'']","[u'tending', u'attention', u'help', u'assistance', u'assist', u'economic_aid', u'care', u'financial_aid']","['N']","[u'help to ', u""lend one's aid"", u'humor ', u'help ', u'befriend ', u'aidance', u'subvention ', u'assist', u'help', u'succor', u'second ', u'promote ', u'nurture ']","['N']"
"""The concept of a `` picture element '' dates to the earliest days of television , for example as `` Bildpunkt '' in the 1888 German patent of Paul Nipkow .""","concept","[u'idea', u'idea', u'idea', u'idea', u'thought', u'idea', u'thought', u'idea', u'idea', u'idea', u'idea', u'idea', u'idea', u'idea', u'idea', u'idea', u'idea', u'idea', u'idea', u'idea', u'idea', u'idea', u'idea', u'idea', u'idea', u'idea', u'idea', u'idea', u'theory', u'idea', u'idea', u'basis', u'idea', u'idea', u'idea', u'idea', u'idea', u'idea', u'idea', u'idea', u'idea', u'idea', u'idea', u'idea', u'idea', u'idea', u'idea', u'idea', u'idea', u'idea', u'', u'']","[u'conception', u'construct']","['N']","[]","['N']"
"""The Eastern Orthodox Church accepts Psalm 151 as canonical . Roman Catholics , Protestants , and most Jews consider it apocryphal .""","*consider","[u'deem', u'think', u'think', u'think', u'call', u'think', u'think', u'believe ', u'find', u'think', u'think', u'find', u'think', u'believe', u'think', u'think', u'deem', u'think', u'think', u'assume', u'call', u'think', u'think', u'think', u'call', u'think', u'feel', u'think', u'think', u'think', u'think', u'believe', u'think', u'find', u'think', u'view', u'think', u'find', u'think of it as ', u'think', u'think of', u'think of it as', u'think', u'think', u'find', u'believe', u'figure', u'think', u'believe', u'think', u'', u'']","[u'count', u'conceive', u'deal', u'turn_over', u'reckon', u'study', u'regard', u'look_at', u'think', u'moot', u'see', u'take', u'weigh', u'deliberate', u'believe', u'debate', u'view']","['Y']","[u'think of', u'scan', u'calculate', u'deliberate', u'study', u'regard', u'scrutinize', u'excogitate', u'reflect', u'examine', u'esteem', u'presume', u'cogitate', u'think']","['Y']"
"Triton was revealed to have remarkable active geysers and polar caps .","remarkable","[u'real', u'extraordinary', u'incredible', u'amazing', u'notably', u'amazing', u'amazing', u'exceptional', u'amazing', u'unusual', u'amazing', u'impressive', u'awesome', u'amazing', u'incredible', u'great', u'amazing', u'amazing', u'amazing', u'awesome', u'amazing', u'great', u'super', u'amazing', u'amazing', u'amazing', u'incredible', u'incredible', u'amazing', u'amazing', u'great', u'amazing', u'impressive', u'outstanding', u'impressive', u'very', u'extraordinary', u'huge', u'incredible', u'interesting', u'amazing', u'wonderful', u'amazing', u'awesome', u'significant', u'noteworthy', u'interesting', u'beautiful', u'amazing', u'extraordinary', u'amazing', u'']","[u'noteworthy', u'singular']","['Y']","[u'noteworthy', u'pointed', u'marked', u'out of the way', u'outre', u'veriest', u'of mark', u'memorable']","['Y']"
"""Several people required rescue assistance , and in Comal County a car accident caused three fatalities .""","cause","[u'made', u'led to', u'created', u'made', u'created', u'instigated', u'caused', u'brought', u'created', u'lead to', u'created', u'created', u'made', u'led to', u'created', u'resulted in', u'made', u'created', u'made', u'led to', u'created', u'brought about', u'made', u'created', u'made happen', u'led to', u'resulted in', u'produced', u'resulted in', u'led to', u'lead to', u'incurred', u'created', u'lead to', u'made', u'resulted in', u'created', u'had', u'produced', u'created', u'causing', u'made', u'was the blame for', u'ended in', u'lead to', u'led to', u'produced', u'resulted in', u'made', u'', u'', u'']","[u'case', u'do', u'campaign', u'get', u'effort', u'make', u'drive', u'causal_agency', u'reason', u'lawsuit', u'induce', u'have', u'suit', u'causa', u'causal_agent', u'movement', u'stimulate', u'crusade', u'grounds']","['N']","[u'origin', u'because', u'reason why ', u'faintly ', u'originate ', u'therefore ', u'because ', u'weakness ', u'weaken ', u'source', u'origin ', u'suit', u'exhaust', u'shatter', u'found ', u'suscitate', u'occasion', u'lawsuit', u'germ ', u'sow the seeds of', u'element', u'principle', u'rationale ', u'action', u'kindle', u'weak ']","['N']"
"""It was founded in 1964 in Hamilton , Ontario by Canadian hockey player Tim Horton and Jim Charade , after an initial venture in hamburger restaurants .""","found","[u'explored', u'made', u'started', u'made', u'created', u'set', u'formed', u'started', u'formed', u'made', u'created', u'formed', u'started', u'started', u'started', u'started', u'begun', u'started', u'started', u'started', u'started', u'begun', u'set up', u'started', u'started', u""started'"", u'started', u'started', u'set up', u'opened', u'created', u'created', u'started', u'started', u'started', u'started', u'formed', u'created', u'made', u'created', u'formed', u'set up', u'created', u'set up', u'created', u'started', u'formed ', u'started', u'started', u'started', u'', u'']","[u'find_oneself', u'retrieve', u'bump', u'discover', u'set_up', u'constitute', u'see', u'determine', u'line_up', u'happen', u'recover', u'establish', u'find', u'witness', u'ground', u'detect', u'notice', u'feel', u'regain', u'plant', u'get_hold', u'get', u'obtain', u'chance', u'observe', u'incur', u'find_out', u'encounter', u'launch', u'institute', u'come_up', u'rule', u'receive', u'base', u'ascertain']","['N']","[u'bottom', u'institute', u'imbed', u'broach', u'lay the foundation of', u'base', u'embed', u'ground']","['N']"
"The Shinto pantheon alone consists of an uncountable number of kami .","consist","[u'is made up', u'is composed', u'is made', u'endures', u'made', u'composed', u'is made of', u'is made up of', u'includes', u'is made up', u'is', u'is made', u'is made', u'is', u'is made', u'is made up', u'contains', u'is made', u'is made up', u'is made up', u'is made ', u'has a lot', u'is made up', u'is made', u'has', u'is', u'has most ', u'is made up ', u'makes up', u'is made', u'is made', u'have', u'exists', u'contains', u'is made ', u'is formed', u'is made up', u'is made', u'comprises', u'belong', u'is made up of', u'is made up ', u'is made', u'is made ', u'is made up', u'contains', u'comprises', u'had', u'is', u'is made', u'', u'']","[u'dwell', u'comprise', u'lie_in', u'lie']","['N']","[]","['N']"
"""The axe , or ax , is an implement that has been used for millennia to shape , split and cut wood , harvest timber , as a weapon and a ceremonial or heraldic symbol . The axe has many forms and specialized uses but generally consists of an axe head with a handle , or helve .""","implement","[u'tool', u'tool', u'tool', u'tool', u'tool', u'tool', u'tool', u'tool', u'tool', u'tool', u'tool', u'tool', u'tool', u'tool', u'tool', u'tool', u'tool', u'tool', u'tool', u'tool', u'tool', u'tool', u'instrument', u'instrument', u'tool', u'tool', u'instrument', u'tool', u'tool', u'tool', u'tool', u'tool', u'tool', u'tool', u'tool', u'tool', u'tool', u'tool', u'tool', u'item', u'tool', u'device', u'tool', u'tool', u'tool', u'instrument', u'tool', u'instrument', u'tool', u'tool', u'tool', u'']","[u'follow_up', u'follow_through', u'go_through', u'carry_out', u'follow_out', u'apply', u'put_through', u'enforce']","['N']","[u'engine', u'organ', u'utensil', u'tool', u'lathe', u'machine', u'instrument', u'gin', u'mill']","['Y']"
"""Mainstream music denotes music that is familiar and unthreatening to the masses , as for example popular music , pop music , middle of the road music , pop rap or soft rock ; Mainstream jazz is generally seen as an evolution of be-bop , which was originally regarded as radical .""","denote","[u'means', u'indicates', u'shows', u'is', u'means', u'means', u'means', u'shows', u'promotes', u'means', u'means', u'expresses', u'is', u'shows', u'means', u'symbolizes', u'expresses', u'means', u'is', u'shows', u'means', u'expresses', u'means', u'marks', u'means', u'notates', u'indicates', u'means', u'means', u'defines', u'means', u'is', u'expresses ', u'represents', u'means', u'describes', u'is', u'frowns on', u'indicates', u'means', u'is', u'means', u'means', u'is', u'describes', u'is', u'marks', u'indicates', u'means', u'means', u'', u'']","[u'announce', u'refer']","['N']","[u'indicate ', u'betoken', u'indicate', u'point out', u'select']","['N']"
"""One theory suggests that the source of the name is an ancient Finnic language , in which it means `` dark '' and `` turbid '' .""","turbid","[u'cloudy', u'goth', u'heavy', u'angry', u'unclear', u'cloudy', u'dense', u'thick', u'unclear', u'cloudy', u'muddy', u'murky', u'murky', u'cloudy', u'thick', u'dense', u'heavy', u'thick', u'dense', u'cloudy', u'unclear', u'dingy', u'cloudy', u'confused', u'unclear', u'hazzy', u'cloudy', u'foggy', u'thick', u'foul', u'unclear', u'cloudy', u'moving', u'murky', u'thick', u'dense', u'troubled', u'murky', u'clouded', u'cloudy', u'muddy', u'thick', u'cloudy', u'dense', u'cloudy', u'confused', u'unclear', u'obscured', u'cloudy', u'unclear', u'', u'']","[u'murky', u'muddy', u'mirky', u'cloudy']","['Y']","[u'obfuscated', u'fuliginous', u'dreggy', u'vaporous', u'opacous', u'muggy ', u'muddy', u'hazy', u'foggy', u'thick', u'turbidity', u'nubiferous', u'cloud', u'misty']","['Y']"
"The technique consists of precoding the data so as to cancel the effect of the interference .","technique","[u'way', u'idea', u'style', u'method', u'style', u'method', u'process', u'method', u'procedure', u'process', u'style', u'method', u'method', u'approach', u'task', u'style', u'form', u'style', u'method', u'approach', u'style', u'step', u'method', u'process', u'process', u'method', u'method', u'task', u'method', u'steps', u'trick', u'method', u'skill', u'way', u'pattern', u'method', u'effort', u'skill', u'method', u'skill', u'style', u'method', u'method', u'way', u'practice', u'method', u'process', u'method', u'job', u'way', u'', u'']","[u'proficiency']","['N']","[]","['N']"
"""Simms works alongside co-host and designer Daniel Kucan to redecorate a room of a home in just two days and with only $ 2,500 .""","redecorate","[u'redo', u'rearrange', u'redesign', u'fix up', u'redo', u'change the decorations', u'redesign', u'remodel', u'remodel', u'remake', u'rearrange', u'decorate', u'redo', u'redo', u'makeover', u'remodel', u'redesign', u'fix up', u'change', u'change', u'redo', u'remodel', u'decorate', u'update', u'redo', u'redo', u'redesign', u'remodel', u'change the look of', u'change', u'redo', u'change', u'redo', u'change the look of', u'redo', u'redo', u'change the design of', u'redo', u'furnish', u'change', u'freshen up', u'renovate', u'remake', u'redesign', u'redo', u'redesign', u'redo', u'redo', u'redo', u'redo', u'', u'']","[]","['N']","[]","['N']"
"""Tibooburra has an arid , desert climate with temperatures soaring above 40 Celsius in summer , often reaching as high as 47 C .""","arid","[u'dry', u'dry', u'dry', u'dry', u'dry', u'dry', u'dry', u'dry', u'dry', u'dry', u'dry', u'dry', u'dry', u'dry', u'dry', u'dry', u'dry', u'dry', u'dry', u'dry', u'dry', u'dry', u'dry', u'dry', u'dry', u'dry', u'dry', u'desolate', u'dry', u'dry', u'dry', u'dry', u'dry', u'dry', u'dry', u'dry', u'dry', u'dry', u'dry', u'moistureless', u'barren', u'dry', u'dry', u'dry', u'dry', u'dry', u'dry', u'dry', u'dry', u'dry', u'dry', u'']","[u'desiccate', u'desiccated', u'waterless']","['N']","[u'unproductive', u'monotonous', u'unfertile', u'unfruitful', u'sterile', u'tedious', u'addled', u'acarpous', u'humdrum', u'infertile', u'flat', u'inoperative', u'bald', u'devoid of interest', u'anhydrous', u'dull', u'dry', u'stupid', u'mortal', u'barren', u'infecund', u'uninteresting', u'unprolific']","['Y']"
"Kavirondo is the former name of the region surrounding Kavirondo Gulf as well as of two native peoples living there under the regime of British East Africa .","*former","[u'old', u'previous', u'old', u'previous', u'earlier', u'old', u'old', u'last', u'other', u'first', u'old', u'old', u'earlier', u'old', u'old', u'before', u'previous', u'previous', u'last', u'earlier', u'prior', u'previous', u'last', u'previous', u'old', u'prior', u'old', u'old', u'old', u'old', u'older', u'old', u'previous', u'old', u'previous', u'old', u'last', u'old', u'old', u'previous ', u'prior', u'old', u'earlier', u'old', u'earlier', u'old', u'old', u'previous', u'old', u'old', u'', u'']","[u'late', u'old', u'erstwhile', u'quondam', u'onetime', u'other', u'sometime', u'one-time', u'early', u'previous']","['Y']","[u'foregoing', u'quondam', u'late', u'pristine', u'ci-devant']","['N']"
"""In 1999 , a World Tamil Confederation was established to protect and foster Tamil culture and further a sense of togetherness amongst Tamils in different countries .""","foster","[u'support', u'accommodate', u'promote', u'care', u'encourage', u'previous', u'encourage', u'adopt', u'support', u'encourage', u'grow', u'advance', u'support', u'uphold', u'nurture', u'cultivate', u'support', u'grow', u'protect', u'raise', u'promote', u'encourage', u'support', u'encourage', u'nurture', u'serve', u'support', u'help', u'promote', u'support', u'nurture', u'support', u'started', u'grow', u'support', u'raise', u'support', u'grow', u'nurture', u'help', u'promote', u'cultivate', u'grow', u'nurture', u'nurture', u'promote', u'promote', u'promote', u'grow', u'support', u'support', u'']","[u'Foster', u'surrogate', u'Stephen_Foster', u'Stephen_Collins_Foster', u'further', u'nurture']","['Y']","[u'entertain a belief', u'adopt an opinion', u'have an opinion', u'cherish an opinion', u'hazard an opinion', u'kill with kindness', u'raise to a fever heat', u'imbibe an opinion', u'foster an opinion', u'adopt a belief', u'have it', u'hold an opinion', u'foment', u'embrace a belief', u'get hold of an opinion', u'hold a belief', u'hazard', u'imbibe a belief', u'nurture an opinion', u'warm', u'embrace an opinion', u'possess', u'entertain an opinion', u'get hold of a belief', u'heat', u'nurture a belief', u'cherish', u'cherish a belief']","['N']"
"""He was a prolific discoverer of asteroids , discovering 122 in all , from 136 Austria in 1874 to 1073 Gellivara in 1923 .""","discover","[u'finding', u'finding', u'finding', u'finding', u'finding', u'finding', u'finding', u'found', u'finding', u'finding', u'finding', u'finding', u'finding', u'finding', u'observing', u'finding', u'finding', u'finding', u'finding', u'finding', u'finding', u'finding', u'finding', u'finding', u'finding', u'finding', u'finding', u'finding', u'finding', u'finding', u'finding', u'finding', u'finding', u'finding', u'finding', u'finding', u'finding', u'finding', u'finding', u'finding', u'finding', u'finding', u'finding', u'finding ', u'finding', u'finding', u'finding', u'finding', u'finding', u'finding', u'', u'']","[u'happen_upon', u'bring_out', u'describe', u'notice', u'distinguish', u'see', u'identify', u'attain', u'get_wind', u'find', u'detect', u'divulge', u'chance_on', u'strike', u'expose', u'disclose', u'give_away', u'pick_up', u'unwrap', u'come_upon', u'let_on', u'break', u'observe', u'hear', u'light_upon', u'key', u'come_across', u'find_out', u'get_word', u'reveal', u'name', u'get_a_line', u'fall_upon', u'chance_upon', u'let_out', u'learn', u'key_out']","['N']","[u'spy', u'determine', u'ken', u'recognize', u'espy', u'see', u'sight', u'get at the truth ', u'find', u'discern', u'analogy', u'have in sight', u'behold', u'disclose', u'evolve', u'dismask', u'perceive', u'descry', u'distinguish', u'make out', u'learn ']","['N']"
"""In August 1995 , the TTC suffered its worst subway accident in what it refers to as the Russell Hill accident , on the Yonge-University-Spadina Line south of St. Clair West station .""","suffer","[u'had', u'endured', u'felt', u'experienced', u'had', u'braved', u'plagued', u'had', u'experienced', u'had', u'had', u'had', u'experienced', u'experienced', u'had', u'had', u'experienced', u'endured', u'had', u'had', u'had', u'experienced', u'endured', u'endured', u'pained', u'had', u'had', u'had', u'underwent', u'had', u'braved', u'went through', u'endured', u'had', u'had', u'underwent', u'endured', u'saw', u'had', u'had', u'lost', u'experienced', u'had', u'endured', u'faced', u'had', u'got in', u'endured ', u'had', u'felt', u'', u'']","[u'stick_out', u'get', u'brook', u'support', u'put_up', u'tolerate', u'bear', u'hurt', u'lose', u'abide', u'meet', u'sustain', u'endure', u'have', u'ache', u'stomach', u'digest', u'stand']","['N']","[u'enjoy', u'recognize', u'suffer for', u'have', u'support', u'suffer punishment', u'sustain', u'labor under', u'aby', u'go through', u'complain of', u'smart', u'endure', u'pass through', u'bear', u'be affected with', u'ache', u'be exposed to', u'be subjected to', u'bleed', u'encounter', u'bear with', u'tolerate', u'experience', u'ail', u'fret ', u'stand', u'bide', u'undergo', u'thole']","['N']"
"In 1887 the school relocated to the East Lake community of Birmingham .","relocate","[u'moved', u'moved', u'moved', u'moved', u'moved', u'transferred', u'moved', u'moved', u'moved', u'moved', u'moved', u'moved', u'moved', u'moved', u'moved', u'moved', u'moved', u'moved', u'moved', u'moved', u'moved', u'moved', u'moved', u'moved', u'moved', u'moved', u'moved', u'moved', u'moved', u'moved', u'moved', u'moved', u'moved', u'moved', u'moved', u'moved', u'moved', u'moved', u'moved', u'moved', u'moved', u'moved', u'moved', u'moved', u'moved', u'moved ', u'moved', u'moved', u'moved', u'moved', u'', u'']","[]","['N']","[]","['N']"
"""HMS Guardian set out before the convict ships but struck ice after leaving the Cape of Good Hope , returned to southern Africa and was wrecked on the coast .""","return","[u'went back', u'went', u'went back', u'came back', u'went back', u'came back', u'came back', u'went', u'relocated', u'back', u'came back', u'came', u'came back', u'went', u'went back', u'went back', u'came back', u'went back', u'came back', u'went back', u'came back', u'came back', u'came back', u'went back', u'came-back', u'came back', u'went back', u'came back', u'came back', u'went back', u'went back', u'revisited', u'went back', u'retreated', u'went back', u'turned around', u'went', u'came', u'went back', u'went again', u'retreated', u'headed', u'gone', u'came back', u'came back', u'came back ', u'turned', u'came back', u'went', u'came back', u'', u'']","[u'refund', u'rejoinder', u'give_back', u'render', u'hark_back', u'bring_back', u'revert', u'come_back', u'pass', u'retrovert', u'proceeds', u'payoff', u'takings', u'devolve', u'tax_return', u'give', u'income_tax_return', u'coming_back', u'recurrence', u'take', u'restitution', u'issue', u'turn_back', u'reappearance', u'rejoin', u'take_back', u'replication', u'restoration', u'deliver', u'fall', u'comeback', u'generate', u'reelect', u'recall', u'counter', u'retort', u'yield', u'repay', u'regaining', u'regress', u'paying_back', u'return_key', u'riposte', u'homecoming', u'getting_even']","['N']","[u'restore', u'ebb', u'revenue', u'recede', u'retire', u'crop', u'regrade', u'bring in', u'appointment', u'archive', u'remigration', u'restitution', u'innings', u'recur', u'backwater', u'nomination', u'proceeds', u'reversion', u'income', u'bespeak', u'incomings', u'quid pro quo', u'afford', u'put in commission', u'hire', u'fruit', u'regurgitation', u'consideration', u'revolve', u'harvest', u'recurse', u'retreat', u'appoint', u'state paper', u'engage', u'name', u'designation', u'reappear', u'nominate', u'blue book', u'revert', u'ordain', u'yield', u'pay', u'scroll', u'accredit']","['N']"
"Super Mario 64 is also characterized by featuring more puzzles than earlier Mario games .","puzzle","[u'traps', u'riddles', u'games', u'challenges', u'games', u'riddles', u'problem solving events', u'mystery', u'games', u'trials', u'games', u'logic games', u'tasks', u'brain games', u'games', u'games', u'inside mini-games', u'mazez', u'challenges', u'challenges', u'games', u'things to figure out', u'games', u'mazes', u'things to solve', u'riddles', u'puzzle stages', u'teasers', u'challenges', u'games', u'challenges', u'challenges', u'challenges', u'brainteasers', u'challenges', u'problems to figure out', u'activities', u'things to do', u'mysteries', u'games', u'challenges', u'mind games', u'games', u'games', u'games', u'challenging situations', u'mini games', u' brainteasers', u'mazes', u'tricky parts', u'', u'']","[u'mystify', u'gravel', u'flummox', u'perplex', u'bewilder', u'get', u'beat', u'pose', u'amaze', u'vex', u'baffle', u'puzzler', u'teaser', u'stick', u'stupefy', u'mystifier', u'nonplus', u'dumbfound']","['N']","[u'riddle', u'perplex', u'conundrum', u'pose', u'put out', u'enigma', u'logogriph', u'embarrass', u'rebus', u'charade', u'nut to crack']","['N']"
"""For Adam Baldwin , who grew up watching westerns , the role of Jayne Cobb was particularly resonant .""","resonant","[u'rembering', u'thrilling', u'powerful', u'appealing', u'heard', u'important', u'memorable', u'meaningful', u'powerful', u'loud', u'impressive', u'important', u'moving', u'deep', u'meaningful', u'important', u'special', u'rich.', u'profound', u'fitting', u'memorable', u'known', u'meaningful', u'meanigful', u'powerful', u'strong', u'meaningful', u'appealing', u'deep', u'fitting', u'important', u'satisfying', u'important to him', u'important', u'important', u'meaningful ', u'memorable', u'resounding', u'meaningful ', u'thrilling', u'relatable', u'vibrant', u'profound', u'memorable', u'memorable', u'powerful', u'intense', u'interesting', u'rich', u'meaningful', u'', u'']","[u'resonating', u'resounding', u'redolent', u'reverberative', u'reminiscent', u'remindful', u'reverberating', u'evocative']","['Y']","[u'tinnient', u'reverberant', u'distinct', u'tintinnabulary', u'audible']","['N']"
"""Following the death of Schidlof from a heart attack in 1987 , the Amadeus Quartet disbanded .""","disband","[u'dissolved', u'scattered', u'broke up', u'broke up', u'quit', u'broke up', u'separated', u'broke up', u'broke up', u'broke up', u'dissolved', u'broke up', u'separated', u'broke up', u'died', u'separated', u'ended', u'broke up', u'separated', u'ended', u'broke up', u'separated', u'split up', u'dissolved', u'dissolved', u'broke up', u'broke up', u'broke up', u'stopped', u'separated', u'broke up', u'dissolved', u'broke up', u'split', u'broke up', u'separated', u'broke up', u'broke up', u'separated', u'separated', u'broke apart', u'dissolved', u'ended', u'broke up', u'broke up', u'broke up', u'split', u'separated', u'split', u'separated', u'broke up', u'']","[u'dissolve']","['N']","[u'disembody', u'broadcast', u'shed', u'bestrew', u'sow', u'disseminate', u'disintegrate', u'dismiss', u'scatter', u'disenthral', u'overspread', u'diffuse', u'spread', u'disperse', u'disenthrall', u'dispense', u'discharge', u'distribute', u'dismember', u'disbranch']","['N']"
"""His linguistic capacity , thoughts and speeches correspond to those of modern man , including a vast knowledge about history , politics , philosophy and literature .""","vast","[u'wide', u'huge', u'large', u'great', u'great', u'large', u'large', u'large', u'large', u'deep', u'great', u'wide', u'great', u'broad', u'great', u'huge', u'huge', u'wide', u'large', u'large', u'wide', u'large', u'huge', u'voluminous', u'broad', u'huge', u'great', u'wide', u'wide', u'large', u'large', u'great', u'huge', u'large', u'wide', u'large', u'lot of', u'large', u'great', u'great', u'large', u'wide', u'large', u'large', u'lot of', u'great', u'large', u'boundless', u'huge', u'large', u'large', u'']","[u'huge', u'Brobdingnagian', u'immense']","['Y']","[u'enormous', u'immense', u'vasty', u'world-wide', u'uncircumscribed', u'widespread', u'extreme']","['N']"
"""The latter means basic or radical change ; whereas reform may be no more than fine tuning , or at most redressing serious wrongs without altering the fundamentals of the system .""","alter","[u'changing', u'changing', u'changing', u'changing', u'changing', u'changing', u'changing', u'changing', u'changing', u'changing', u'changing', u'changing', u'changing', u'changing', u'changing', u'changing', u'changing', u'changing', u'changing', u'changing', u'changing', u'changing', u'changing', u'changing', u'changing', u'changing', u'changing', u'changing', u'changing', u'changing', u'changing', u'changing', u'changing', u'changing', u'changing', u'changing', u'changing', u'changing', u'changing', u'changing', u'changing', u'changing', u'changing', u'changing', u'changing', u'changing', u'changing', u'changing', u'changing', u'changing', u'changing', u'']","[u'neuter', u'modify', u'vary', u'interpolate', u'falsify', u'spay', u'change', u'castrate']","['N']","[u'emasculate', u'neuter', u'fix', u'equivocate ', u'vary', u'sterilize', u'geld', u'wax and wane', u'change', u'castrate']","['N']"
